listing_id,review_id,date,comments
647314,5910989,2013-07-22T00:00:00.000Z,"Mallika's apartment is every bit as gorgeous as the photo's show. It is so easy to get to from the Mariatorget subway station and peaceful and quiet at night. 
The room, and the whole apartment was spotlessly clean. Lovely fresh towels were provided and the wifi (being able to surf the net seems almost as important as being able to get a good nights sleep and get clean these days!!) worked perfectly.
The location is great as there is an excellent coffee shop on the corner and it is so easy to jump on the subway to get into town if you need to but as the weather was gorgeous, I had just a very lovely short stroll to Gamla Stan. 
Mallika herself is a very lovely lady. Truely I could not have wished for a better host; friendly, knowledgeable and helpful and puts you immediately at ease. 
Really quick and excellent communication, whether it was by email or text message which made the pre-arrival experience smooth.
I've had a wonderful weekend in Stockholm, thank you Mallika and your beautiful home for being a part of it! Sarah x"
608672,260607973,2018-05-04T00:00:00.000Z,room is nice and comfortable.
1182616,36057243,2015-06-24T00:00:00.000Z,"Peter was a great host - he was very good at keeping in touch with us prior to arriving and during our stay. 

The apartment is very big, clean and functional. The shared bathroom is adequate and kitchen has everything you need. The bedroom is very large - with king size bed, couch, wardrobe and dresser. Our favourite part was the balcony - which is a great place to take in the long sunny evenings - Bonus! 

A bit of walk from the city centre - maybe about 25 minutes -  but a very good place to stay Stockholm."
438129,10231584,2014-02-08T00:00:00.000Z,"The best hosts one can wish for! I stayed at their place for 25 days and I'm very pleased with my stay - the location is great, just app 20 minutes by tube to the central station, the room is just nice - I did get the best sleep there -, perfect when looking for a nice cosy place where to work. Ea and her family they're by far the nicest, most helpful people one (as a foreigner/tourist) can wish for! 
Thank You! :)"
1182616,350800372,2018-11-20T00:00:00.000Z,Conforme selon la description et les commentaires
1184553,166256197,2017-07-03T00:00:00.000Z,"Apartment was exactly as described, clean and bright. Easy to find,  lots of bars and restaurants within walking distance and public transport links are excellent.

Communication with Annbritt in advance was clear. We didn't see Annbritt after check in but she was available by phone if we needed.

As stated in description, there  no access to kitchen (I missed a  kettle) or living room."
1170766,299497513,2018-07-31T00:00:00.000Z,"Annika is such a sweetheart!  The location is perfect for walking all over Stockholm (so relieved I did not bring a bike, as I kept stopping everywhere,  taking photos).  It's warm and cozy—like staying in your favorite aunt's attic.  The exercise, from walking up and down the stairs, was exactly what I needed.  And two fantastic benefits:  Paradiset (healthy grocery and deli) and Legumes Vegetarian Buffet (healthy and affordable restaurant) were just around the corner and across/down around the street.  Feeling much gratitude for this location and for Annika's kindness!"
608672,7216578,2013-09-11T00:00:00.000Z,Quiet room with computer desk.   Mini kitchen and closet.  Very small bathroom with odd shower arrangement - very difficult to avoid getting water onto floor. Location is reasonably central.  Easy access to supermarket and public transit.
1182616,239534650,2018-03-02T00:00:00.000Z,"Peter is a really great host, but the stay itself was pretty bad. We weren’t told that there would be other guests in the apartment until after we had already booked and to top that off, they started having really loud sex in the next room. The walls are paper thin and you can’t even talk at regular volume without it going through the walls, let alone having loud sex or guests coming in after midnight being extremely noisy and rude. It makes sleeping and relaxing difficult. The room itself wasn’t very clean. The floor had a lot of dust and whatnot on it and it smelled strongly of smoke even though it says no smoking in the room. The bathroom reeked the entire time we were there. It was almost unbearable sometimes to use it. There was also the start of mold on the bathroom wall.  We definitely would not stay again."
1212891,52146925,2015-10-26T00:00:00.000Z,"Maud was very kind and helpful, the room is very cute, near to the underground and central station. I suggest that accomodation."
688947,44713494,2015-08-28T00:00:00.000Z,"it was a clean, warm and very comfortable place ! even though we didn't met alexandre, because he was out, he was willing to help wherever he could and asking to give us a comfortable stay at his flat."
700113,454436694,2019-05-18T00:00:00.000Z,"Meget gæstfri, dejlig udsigt fra altan, det meste man har brug for i lejligheden; og så håber vi, at den nye seng snart kommer"
1262188,38694029,2015-07-18T00:00:00.000Z,"Karin gab auf Anfrage schnell und ausführlich Antwort und versorgte uns mit verschiedenen hilfreichen Informationen. Wir fühlten uns in ihrer Wohnung sehr wohl, sie war sauber und gemütlich, die Umgebung sehr angenehm, und perfekt gelegen, da zu Fuss alles sehr schnell erreichbar. Balkon und Spielwiese waren für uns zusätzlich ein Pluspunkt . Wir empfehlen die Wohnung wärmstens an alle Stockholm - Besucher/innen."
533880,237516716,2018-02-23T00:00:00.000Z,"Very nice place with a  very welcoming host.
Strongly recommended."
1124388,327660916,2018-09-24T00:00:00.000Z,"Carl’s apartment was great, enough room for two friends, using the spare bed. He had great communication supplies us with directions and maps to get to the apartment. The apartment is about 30 minutes from the city centre using public transport which was fine for us. With late buses too. Would recommend for a trip to Stockholm."
164448,65096511,2016-03-10T00:00:00.000Z,"Lidias place is wonderful and Lidia is a very friendly and helpful host. The Apartment is in a perfect Spot From where you can reach everything,  even by foot. And with Lidias Infos About Stockholm our Trip went absolutely well :) Lidia is a absolute top recommendation"
283446,82384963,2016-06-27T00:00:00.000Z,"Once again, I would like to thank Ms. Vidhi and her family for a nice weekend. They waited for me a long time because my train was delayed. The food they cooked was delicious and was graciously offered more. I like the vibrant diverse neighborhood and wish I could've stayed at this airbnb the whole week rather than two days. Hospitality with a capital H."
259025,33415451,2015-05-27T00:00:00.000Z,Great stay. There were many other rooms for other visitors as well in the place. A little far from the main area but it's right next to the metro station and a bus station so it wasn't a big deal. Ali was super accomodations considering how my friend and I made this listing last minute.
985944,4568517,2013-05-13T00:00:00.000Z,"Really great place to stay in Stockholm! The apartment was beautiful and cozy, the neighbourhood was wonderful and the hosts really nice. Warm recommendation!"
1041103,301401003,2018-08-04T00:00:00.000Z,Personligt inredd lägenhet med bra läge nära till tunnelbana och ICA. Jag var i stort sett ensam hela tiden då familjen var på annan ort. Allt funkade utmärkt :-)
700113,14465582,2014-06-20T00:00:00.000Z,"The studio of Ilona was exactly how described. We totally liked the 5 days we stayed at her place. We got a nice warm welcome from her. Everything was clean. The location of the apartment is perfect. Just a 5 minute walk to the subway-station t-bana and 2 stops to t-centalen in the city. A bus-stop is around the corner. A lot of supermarkets are in walking distance. As well as the coffeshops, restaurants and bars. We would definitely come back.
Thanks a lot. :)"
242188,54916267,2015-11-25T00:00:00.000Z,"Lidia is a great host. She is really kind, warm, and welcoming. Upon my arrival she gave great advice on where to see in the city. We also had very interesting conversations with a cup of tea. The room was spotless, bright, and cozy. I would definitely stay here again if I visit Stockholm another time!"
1212891,349875864,2018-11-18T00:00:00.000Z,We enjoyed staying at Mauds place. The flat is clean and everything worked out well with the keys. The city can be reached easily.
1261445,164382893,2017-06-27T00:00:00.000Z,"Wir waren 4 Tage zu Gast in Marie-Louises zauberhaftem, kleinen Apartment. Von hier aus ließ sich Stockholm wunderbar erkunden. On top fanden wir einen gut gefüllten Kühlschrank und einen Obstteller vor. Marie-Louises Tochter hat zudem eine interaktive Restaurantkarte für Stockholm erfasst, welche wir mehrmals genutzt haben ohne dabei enttäuscht zu werden. Unser nächster Aufenthalt in Stockholm? Gerne wieder bei Marie-Louise!"
338470,351304265,2018-11-22T00:00:00.000Z,"Gustaf's apartment is special, I loved to spend my time there.  I didn't had the chance to meet him in person, but I hope I will next time! He was very nice and helpful anyway, giving me a lot of precious information about the neighbourhood and Stockholm in general. I do recommend everyone this spot in town! I hope to come back soon too."
1128990,157200841,2017-06-03T00:00:00.000Z,"Great host! I had a great time at Anette's! The room is big, comfortable and clean. The location of this apartment is excellent too! Anette was kind enough to let me borrow a phone charger (thank you so much for that!), and helped me with everything I needed. I felt very welcome at her home."
581243,9591232,2014-01-03T00:00:00.000Z,"Edwin was incredibly helpful to us during these few days. Not only his welcoming was warm and friendly but also when we had to leave he helped us with the bus tickets and gave us useful informations.

The apartment is really nice, well situated and just in front of a Metro station. Absolutely a good choice!"
795354,204855182,2017-10-20T00:00:00.000Z,"Great place, will stay at it again! Many thanks!"
514210,472658739,2019-06-20T00:00:00.000Z,"This place is simply excellent! The host is very very kind and nice and the house is very clean, having a gorgeous balcony with flowers and calming view. This is very close to bus stop about 2 min from the apt. We felt like home and had a great and relaxing time. I would recommend to anyone that is respectful person. Thank you so much Margareta!"
1170766,43568685,2015-08-20T00:00:00.000Z,"Très prévenante, notre hôtesse nous a accueilli à distance de parfaite manière. La chambre est en fait un studio tout ce qu'il y a de plus cosy. Comme il est indiqué, prévoir des masques de nuit pour les personnes qui n'arrivent pas à dormir avec la lumière du jour. Clarté très agréable. 

Very welcoming, our hostess met us at distance perfectly. The room is actually a studio that is most cozy. As noted, provide sleep masks for people who do not sleep with the light of day. We loved the brightness of the flat."
302496,458520719,2019-05-26T00:00:00.000Z,Flott leilighet sentralt i Stockholm. Godt vertskap og høy standard.
916806,4616550,2013-05-15T00:00:00.000Z,"Mansour and Julia offered us a perfect place to live during our visit to Stockholm. The appartement was clean and comfortable. Mansour and Julia were friendly, helpful and uncomplicated hosts. Thank you very much!"
283446,23200678,2014-11-24T00:00:00.000Z,As soon as I got to the apartment Vidharti welcome me so nicely and introduce me to her family. They invited me to home made lunch and were so polite to me. They gave the filing of been at home. They helped me with things which I had to sattle. They gave me the privacy and comfort that I like. The room is big and very comfortable with wide double bed. At night they invited me to a pizza and tea and in the morning they took care for my breakfast.  I really felt at home with their home hospitality.  Definitely a place that I will come back again. Very recommend
647314,171862695,2017-07-19T00:00:00.000Z,"Mallika was a fantastic host. Her house was beautifully decorated, very clean and the room was very spacious and comfortable. Check in was very easy and the area was fantastic. Short walk to Gamla Stan and lots of cafes and restaurants nearby."
313763,98252846,2016-08-30T00:00:00.000Z,Martin and his apartment were both great! The location was perfect for an authentic Stockholm stay. I had a great weekend in the city and would definitely stay here again!
700113,40078835,2015-07-28T00:00:00.000Z,Ilona made us feel very welcome.  She connected with us prior to our flight to enquire about how we were getting to her from the airport & then gave good directions to our studio.  She was welcoming when we arrived & helped us with questions. The Studio was well stocked & Ilona further welcomed us with a bottle of wine & a handmade leaving gift.
565912,480152808,2019-07-02T00:00:00.000Z,Patrik's Place is warm and welcoming.  Convenient location to the Tram and connections to City.  The Gardens offer a nice respite and are quiet and calming.  Everything was accurate described and accommodating.  Excellent Host with good information and tips. Very responsive and connected.   Excellent!
1244357,99037890,2016-09-03T00:00:00.000Z,"Elliott's place is perfectly located—downtown but with calmer traffic.  His apartment- and area-guide was comprehensive and full of useful details that made arrival easy.

Tack så mycket, Elliott och Rebecca!"
1204621,400834599,2019-01-13T00:00:00.000Z,"Great value, very good location, beautiful flat, kitchen and bathroom easy to use and clean (2 towels, 3 different pillows) and Nettan, easy going person, who's there if you need!"
1054406,427208884,2019-03-23T00:00:00.000Z,"Everything was perfect.
Nice and quite area. 
Only 35 min to down town with public transport.
We will come back!
Thank you Thomas."
647314,105809983,2016-10-03T00:00:00.000Z,"If the cats are around, they *really* are around, but it's a great place to stay in a really convenient location!"
1054406,77436209,2016-05-31T00:00:00.000Z,"Thomas and Madeleine are super nice and extremely helpfull.  Reservations, correspondence and check in was a breeze.  The basement appartment is well set up and even contains a jacuzzi.  There was ample space for us and the 3 small children.  The environment is very child friendly, with a small garden and even a trampoline to use.  
Supermarket in the immediate area."
242188,8064094,2013-10-14T00:00:00.000Z,"For not being right in the middle of Gamla Stan, an easy to reach and central location in Stockholm. Less then five minutes from the train station, less then ten minutes from the nearest metro.

Lidia is a great host and the views from the room are pretty darn excellent."
1124388,39492079,2015-07-24T00:00:00.000Z,"The appartement is very Well situated, bus and métro are easyJet To Takeshi and its is not far From bromma aéroport. Thanks for everything."
1182616,188159992,2017-08-28T00:00:00.000Z,"Appartement bien situé, quartier agréable avec bars et restos à proximité.
Nous n'avons pas eu la chance de croiser Peter mais toutes les intructions & infos nécessaires nous ont bien été transmises.
Aménagement intérieur basique.
Précision : les autres chambres de l'appartement peuvent être utilsées par d'autres locataires, notre colocation s'est très bien passée."
1149820,4740265,2013-05-22T00:00:00.000Z,The reservation was canceled 30 days before arrival. This is an automated posting.
1128990,189854670,2017-09-03T00:00:00.000Z,The host canceled this reservation 5 days before arrival. This is an automated posting.
581243,188056708,2017-08-28T00:00:00.000Z,"Perfect location! Close to public transportation, shopping, and walking distance too almost everything! Very clean and nicely secured place. Edwin also provided us some great help on directions to places."
1182616,238175523,2018-02-25T00:00:00.000Z,"Les plus : Le logement de Peter est très bien situé, à deux minutes à pied du métro Friedemsplan et de la navette pour l’aéroport d’Arlanda. 
Plusieurs supermarchés et magasins se trouvent au pied de l’immeuble. 
Peter est très sympathique et arrangeant, même si nous ne l’avons pas rencontré. Nous avons pu laisser nos bagages dans l’appartement avant de reprendre notre à avion pour Paris. 
Les moins : l’appartement n’est pas très propre. À notre arrivée, le drap de notre lit était couvert de cheveux et poils en tous genres. Il y a de fortes odeurs de canalisations dans la salle de bains, où la poussière n’a pas été faite depuis longtemps. Les placards de la cuisine ne sont pas très propres non plus. 
Enfin, il faut bien noter que le salon de l’appartement a été transformé en chambre par Peter, ce qui n’est pas indiqué dans l’annonce. Il y a donc trois chambres qui peuvent accueillir jusqu’à 8 personnes dans l’appartement... pour une seule salle de bains, ce qui peut créer des bouchons les soirs et matins."
533880,7354783,2013-09-16T00:00:00.000Z,"Jarl is an excellent and caring host. He replied promptly to my request and sent invitation e-mail with all necessary information and description to find the flat in Stockholm.
I met Jarl the next day and apart from preparing breakfast with the rich contents of his fridge, I was allowed to use one of hi bike cards to rent one of Stockholm's bikes for free.
Room, kitchen, bathroom and flat are in perfect shape and pleasantly located north of Östermalm district and very close to Djurgården island.
Highly recommended! A great value-for-money!"
313195,11381150,2014-03-31T00:00:00.000Z,"Great stay in the bright and cosy apartment of David, who is himself a very welcoming and available host. We recommend it !"
700113,203949978,2017-10-16T00:00:00.000Z,Flexible checkin after a cancelled flight.  Host was very welcoming. A great place to stay!
1271843,171611353,2017-07-18T00:00:00.000Z,"Super accueil d'André, très ouvert sur les heures d'arrivées et de départ. Malheureusement il partait en vacances donc nous n'avons pas pu échanger longuement mais très bonne impression. Appartement très bien situé, propre avec tout le nécessaire à disposition. On s'est senti à la maison."
646635,186079231,2017-08-23T00:00:00.000Z,"Very nice apartment, very comfortable room, well situated and super very kind host ! It was a real pleasure to stay at Kristina's place with her and her son !"
1153177,18783798,2014-09-01T00:00:00.000Z,"The flat was lovely and in a great position. Light and airy with lots of room for the whole family. We loved the area, near to a great park for running with a lovely supermarket and an amazing bakery close by. You can walk to most parts of Stockholm from here and we found some lovely parks close by for the children. We'd definitely rent this place again. It was very clean and Terry left us milk, juice and water which was great. We even used a few of his tea bags (thanks Terry)!"
688947,77060578,2016-05-30T00:00:00.000Z,"Really nice place a bit far from the city centre, but very easily reachable by the T-bana. Totally recommended!"
916806,436975055,2019-04-14T00:00:00.000Z,A nice little apartment within walking distance of a mall and a metro station. My friends and I enjoyed our stay at this airbnb and I'm sure you will too.
755843,355454685,2018-12-04T00:00:00.000Z,"Квартира удобно расположена в 15-20 минутах ходьбы от вокзала, ратуши; рядом автобусная остановка. В доме есть лифт, но квартира расположена на полуэтаже, поэтому около 10 ступенек надо пройти пешком. Недалёко есть несколько продуктовых магазинов.
В начале был сильный запах сигарет.
В квартире есть камин как и написано в описании.
Фотографии полностью соответствуют действительности.
На кухне есть все необходимое для приготовления пищи и приветственная бутылка шампанского в холодильнике.
В спальне большая кровать и широкий диван в гостиной; два туалета: один с ванной, другой в коридоре.
Хотя хозяин не смог лично нас встретить, но приезд был организован отлично.
В целом все было хорошо, рекомендую."
514210,159213765,2017-06-10T00:00:00.000Z,"Margareta has a friendly, helpful, and welcoming attitude to guests coming into her home. The guest room is very comfortable and attractive and visitors have the use of all the facilities they will ever need. Highly recommended."
1271843,77443587,2016-05-31T00:00:00.000Z,"Andre' and Johanna are amazing!  They are the most welcoming and friendly hosts (new friends) you could ever hope for!  Their home is clean, spacious, and has a \"home away from home\" feel to it.  The location is perfect and only about a two minute walk from the metro.  We are sincerely grateful for having stayed here and getting to know Andre' and Johanna."
242188,211039546,2017-11-12T00:00:00.000Z,"Li’s Place is wonderful - clean, spacious, light, airy, and secure. The location in the Södermalm district is close to three transit stations and many bus lines. Several excellent bakeries and coffee houses lie within a 5-minute walk - you can even walk to Gamla Stan (the Old Town area) if you want. Li is friendly and helpful and a joy to talk with, making you feel right at home. Will definitely be my first choice when heading back to Stockholm!"
822497,437200985,2019-04-14T00:00:00.000Z,"The location is 5 minutes from the metro, the flat is so beautiful and comfortable and Moa is very nice person, recommended us some interesting places and she tried to make our trip great. Thanks."
757320,24282443,2014-12-24T00:00:00.000Z,Barb was the perfect host! She made me feel very comfortable and the room was lovely. Her apartment is charming and I enjoyed chatting with her. It was easy to get around from her location and fun to explore Gamla Stan which was so close! I strongly recommend her room to travellers!
916806,4814511,2013-05-27T00:00:00.000Z,"The spacious, clean, bright and very well equipped appartment where we enjoyed our Stockhom getaway weekend! If you are looking for some solitude, romance and privacy - that is definitely the right place to stay! The surrounding nature, the proximity to the beautiful park and the spectacular view made our stay unforgettable. Travelling to the city centre is easy as long as you are prepared to spend half on hour for this. We haven't met Mansour, but Julia appeared to be a nice young lady, very welcoming and flexible in terms of check-in/check-out. The hosts stay in the same house on top floor which makes it easy to communicate if necessary.
Highly recommend this appartment to young couples who love to travel but want to feel like home in Stockholm.
Thank you, Julia and Mansour!"
1243144,5989056,2013-07-25T00:00:00.000Z,Our family of four had a wonderful time in this charming apartment. The location was perfect for exploring the city and the neighbourhood was lovely. An was an extraordinarily helpful and friendly host and we highly recommend her place.
1166419,54030676,2015-11-15T00:00:00.000Z,"Thank you. Good location, and Margit is very helpful."
904739,486477948,2019-07-12T00:00:00.000Z,"Tuvimos u a experiencia magnífica con toda la familia de Germán, todos muy muy atentos y apasionados,  fué realmente maravilloso poder compartir esa hermosa experiencia y forma de vida!! Demasiado recomendable!!!! Adorables todos!!"
164448,56729250,2015-12-17T00:00:00.000Z,Lidia's place is great to explore Stockholm - the location is perfect  and the neighbourhood is very calm and friendly. Also is Lidia: she stayed up very late to welcome us because we took a night flight. She is a very nice and caring lady and we would definitely recommend her place to others.
299154,484633543,2019-07-09T00:00:00.000Z,"Very good location, pictures were accurate, Daniel was very nice host."
610948,21703674,2014-10-22T00:00:00.000Z,"We just got home from spending the most amazing week in Stockholm! Lina's flat was the perfect home for us while we were there. We love to cook and took advantage of her lovely kitchen. My boyfriend and I work remotely, and her main living room area offered the perfect environment to do so. The flat is conveniently located, only a few blocks from T-Bana and all of the restaurants, bars and shopping you could want. We were able to walk into Gamla Stan as well as all of the wonderful museums that Stockholm has to offer. You also won't want to miss the MOST AMAZING view of Stockholm located on a beautiful tree-lined walkway directly across from Lina's front door!

I can't recommend Lina and her lovely home enough!"
299154,54105344,2015-11-16T00:00:00.000Z,"Great apartment and perfect location. Exactly as described, no problems."
581243,204434289,2017-10-18T00:00:00.000Z,It’s the second time we stay at Edwin’s house. It’s very clean and convenient! Close to metro station and shopping center. Edwin is very nice and helpful! We will definitely come here again!
