listing_id,review_id,date,comments
862528,41571477,2015-08-08T00:00:00.000Z,"We had a fantastic stay in Arne's house with our two little daughters. The house is well-located for a journey in Stockholm area, 15mn from the city by car and close to a metro station direct to the centre. Arne was hère to welcome us and showed us kindly and quickly all what to know about the house.
The house is extremely pleasant, nicely decorated  and very convenient for à Family with its garden and its two terraces, a large living-room and opened cuisine, the 3.bedrooms and bathrooms... Arne arranged us a crib and a high chair. The Nespresso machine, the Netflix access were nice bonus. Everything went extremely well, except maybe the unconfortable king-size bed (too soft for us)... We highly recommand Arne and his house for your future stay in Stockholm!!"
1212891,58790648,2016-01-05T00:00:00.000Z,"Maud hat uns mit einem warmherzigen und freundlichen Lächeln begrüßt und uns alle nötigen Dinge für unseren Aufenthalt bereitgestellt. 
Das Zimmer war groß genug, damit zwei Menschen sich darin ausbreiten können. Es gab neben dem Bett einen kleinen Kleiderschrank, einen Tisch und mehrere Schränkchen mit Schubläden. In diesen befand sich neben nützlichen Dingen auch eine Mappe mit Informationen über verschiedene Attraktionen rund um Stockholm. Das Bett war mit 1,20 Meter gerade ausreichend für zwei Personen, aber super neu und komfortabel. 
Wir haben uns zu jeder Zeit super wohl gefühlt und konnten uns an allen Sachen bedienen, die wir zum Leben/Schlafen/Kochen benötigt haben. 
Auch war Maud uns stets mit Rat und Tat zur Seite gestanden, als Fragen bezüglich Stockholm aufkamen. Diese beantwortete sie sofort durch verschiedene Karten und Flyern, vielen Informationen und einem ständigen Lächeln. 
Die Wohnung selbst liegt etwa zehn Minuten von der nächsten S-Bahn-Station entfernt und die Fahrt ins Zentrum dauert ungefähr 15 Minuten.
Maud war einfach eine mega herzliche Gastgeberin, die dafür gesorgt hat, dass man sich als Gast rundum wohlfühlt und es einem an nichts mangelt!"
1248490,458535741,2019-05-26T00:00:00.000Z,"La casa di Maria è esattamente come mostrata in foto,  quello che le foto non possono  raccontare è il calore che questa casa trasmette...fare colazione davanti alla finestra con lo sguardo sui tetti e  alberi è impagabile. Una casa pulitissima, molto curata nei dettagli, comoda per 5 persone e con tutto l'occorrente visto che in realtà è una casa abitata dalla proprietaria, che è stata molto flessibile anche con il chek-out (abbiamo potuto lasciare la casa il pomeriggio dato che il volo era verso sera), inoltre ci ha lasciato le tessere da ricaricare  per i mezzi di trasporto che altrimenti avremmo dovuto acquistare...queste sono delle piccole attenzioni verso l'ospite che non trovi dappertutto, quindi grazie."
1153177,14076474,2014-06-11T00:00:00.000Z,"We stayed in Terry's apartment in early June, 2014.  Terry was fantastic to deal with. He was very prompt in responding to the booking request and later inquiries.  He clearly makes every attempt to accommodate guests. Terry's apartment was exactly as advertised.  It was clean & has all the amenities needed.  It is in a very convenient location, only 2 stops on the metro from the central station, & only a few minutes walk from there.  I can recommend Terry & his apartment without hesitation.  Thanks Terry!!"
581243,495493080,2019-07-26T00:00:00.000Z,"Эдвин - очень контактный и гостеприимный человек! 
Он дал много ценных советов и инструкций!
В квартире идеальная чистота.
Расположение отличное! 
Будем рады приехать вновь.
Рекомендую!"
1261445,166608896,2017-07-04T00:00:00.000Z,"The apartment is just as described... Bianca was extremely helpful, we had a great stay in Stockholm!"
581243,309581652,2018-08-18T00:00:00.000Z,Everything was OK
871262,14126689,2014-06-12T00:00:00.000Z,I felt very comfortable in my room in Lotta's appartment. Perfect location. Lotta is nice host and gave me some valuable tips.
755843,529993206,2019-09-15T00:00:00.000Z,"Great, spacious apartment. Par was super friendly and communicative."
954832,422867037,2019-03-12T00:00:00.000Z,"The accommodation is a very welcoming, cosy and clean space where we felt comfortable during our stay. Mikael arranged everything very nice. Communication with him was great, since he always responded within a couple of minutes. The neighbourhood is good; restaurants, supermarkets and public transport are easily accessable. Definitely recommend this place!"
862528,16423337,2014-07-27T00:00:00.000Z,"Arne's place is really special: spacious, quiet, well equipped, nice neighborhood. A place to come back to. It was always easy to communicate with Arne. As someone wrote earlier this villa fits a family or a couple perfectly."
533880,3509909,2013-02-10T00:00:00.000Z,Jarl's place is just a few blocks from the most exciting parts of Stockholm. The room is exactly as described: nice & calm. Jarl was very easy to get in contact with although he prepared everything so well I didn't have to bother him with anything at all! A+ ... I would stay here again without a second thought if I make it back to Stockholm!
897584,143082447,2017-04-10T00:00:00.000Z,As a first-time Airbnb user I'm so glad to have found Viveka! We really enjoyed staying in her lovely home and getting the occasional friendly cat visitor in the mornings :) She was a very considerate and helpful host and we can't thank her enough!
242188,7860406,2013-10-06T00:00:00.000Z,"I definately recommend Lidias place as a perfect place to stay in your Stockolm visit.  Its conveniently located close to everything withbwonderful communications near by.  My room was neat, clean, spacious and had wonderful light.  I slept woderfully, with quiteness and comfort.  The showe is excellent, abundant hot water, great after a long day of walking.  I felt pretty much at home, Lidia made me feel immediately welcomed, helped me with asertive suggestions of ways and places ti visit, her daily opinions helped me to make the best of my time in this fantastic city.  Her breakfast was delicious, in a cozy luminious table, with everything so esquisitely arranged and presented.  i can still taste those crunchy croissants, perfect way to start a busy day!!! Those tastybcheeses, hams and salamis!!! Fruit, eggs, everything!! Thank you Lidia!!! I look forward in returning to Stockholm and to stay of course in Lidias place, she is a warm, helpful open woman offering a veryncomfortable apartment to stay!   The access to the fridga upstairs, microwave and plates was very convenient!! I experienced complete privacy as well.  Thank you Lidia for making my stay 5 stars in all ways,!!!!"
723539,50370892,2015-10-11T00:00:00.000Z,"I stayed at Mathias' with two close friends. As this was the first time using AirBnB I was pretty nervous but it turned out great. Definitely priceworthy. 

The apartment is cozier and more personalized than I feel the pictures and description convey. The cleaning rules might seem rigid, but read once more they are really common sense. I guess Mathias, despite this, has had some negative experienced regarding checking out, hence the rules. 

If you are more than two people you must be okay with sharing beds as there are only one bed and one couch (that you can fold out into a bed). The kitchen is small but felt well planned and well equipped. We never cooked food but found everything we needed for making breakfast and snacks. It might be good to know that you are allowed to use essentials such as tea, coffee, butter, beans etc. If you are unsure just ask Mathias. 

He was reachable by phone and mail the whole stay. Unfortunately we never got the chance to meet but both check in and check out ran smoothly. The day of our arrival he called which was a much appreciated gesture. 

For us the location was perfect: central and quiet with beautiful buildings surrounding us. As an apartment at Östermalm is ridiculously expensive we felt lucky to get to live there, if only for a few days, and felt immediately at home. 

To sum it up: we were all three very happy with our stay and would love staying there again at future visits to Stockholm."
757320,515488579,2019-08-23T00:00:00.000Z,"We really liked to stay at Barb‘s apartment. The location is perfect (close to the old town and in the center of Södermalm which is a very cool part of town). The room was cosy and clean and Barb is a very friendly host. The thing we didn‘t like was that she wanted to communicate by SMS which distegards the Airbnb rules. Communication only worked when using SMS, otherwise we didn’t get a response. But still we enjoyed our stay very much!"
533880,293928255,2018-07-21T00:00:00.000Z,"Jarl is a great host.  He was away traveling during much of my stay, but he still took care to make sure I had everything I needed and familiarized me with the building. He’s friendly, easy-going and quick to reach.  His apartment is central to many areas in Stockholm, and is also close to the local nightlife areas.  The room itself is quite large, much more than I was expecting for a city apartment."
1170766,101625430,2016-09-14T00:00:00.000Z,"Nous avons passé un excellent séjour dans l'appartement de Annika. Toutes les indications pour arriver nous ont été donnés. L'appartement est très propre, clair, fonctionnel et bien situé géographiquement. Rien ne manque : draps, serviettes toilette, torchon, télévison, radio, wifi, équipement pour faire à manger... Elle est gentil et prévenante et son accueil était chaleureux. Un délicieux pain suédois nous a été offert. N'hésitez pas à réserver chez Annika, vous ne serez pas déçus."
1231897,156048877,2017-05-29T00:00:00.000Z,Alexander was a great host. We was always there to help and made us feel at home!
1035775,269816715,2018-05-28T00:00:00.000Z,"Fantastic location. Great apartment, had everything we wanted. Kristineberg metro station was only a few minutes walk away. Magnus was very prompt with his responses. Thoroughly enjoyed our stay in Stockholm."
1124388,63345667,2016-02-22T00:00:00.000Z,"Basic, cute apartment near a grocery store and bus stop. Easy, flat, pretty walk along the water to all the downtown sites in 40-60 mins. Quiet and comfortable. Definitely a guy's apartment. A girly girl might not prefer this. Local pizza place was good. Very safe to walk everywhere."
164448,127689484,2017-01-20T00:00:00.000Z,Always a pleasure to stay at that place ! Well recommended !
757320,111733936,2016-11-01T00:00:00.000Z,"Very well located and clean flat. Barb helped us make the best of our stay. 
The bedroom is as in the picture,  bed for two, very confortable. The bathroom is big, will all the commodities we needed. 

All in all, a good choice to stay in Stockholm!"
1248490,18396055,2014-08-26T00:00:00.000Z,"We spent a girl's weekend in Stockholm and Maria's appartmant was perfect for us. We very much liked the appartment style, it was cosy. We just felt \"at home\". We were also happy with the location in the middle of Södermalm with restaurants and shops very close by. Maria introduced us very well to Stockholm! We definitely would stay there again...Thank you very much Maria for this wonderful stay!"
1158893,34054705,2015-06-04T00:00:00.000Z,"Our stay at Dany's house was excellent. The house is cozy, well equipped and conveniently located. Dany was extremely helpful, attentive and flexible. I would highly recommend this property to anyone wanting to see Stockholm."
1212891,30922837,2015-04-29T00:00:00.000Z,"Maud is very friendly and helpful host. Atmosphere in her house is calm and nice. The room is cozy, bright and very clean. Our stay at Maud's house was perfect :) We highly recommend!"
1182616,306872606,2018-08-13T00:00:00.000Z,"Sejour agréable , situe non loin du centre ! Parfait pour y séjourner quelques jours ! Merci bien :))"
206221,273184860,2018-06-05T00:00:00.000Z,We stayed three nights  at Elisabeth's cozy home and felt  very much welcomed. Beside the delicious breakfast and enjoyable talks we got  a lot of good tips how to spend the time in Stockholm.
628555,2255939,2012-09-10T00:00:00.000Z,"Even though we haven't met Anna, she arranged everything perfectly and the communication was excellent. It was a small but really nice apartment. Took us quite a while to get there (30 min or so from the city centre) but was definitely worth it."
242188,49598434,2015-10-05T00:00:00.000Z,"I felt very welcome when I arrive at Lidia's. She kindly offered me a cup of tea and explained me about the area and the main tourist attractions in Stockholm. The room was cosy and had a nice view on the city, perfect for a weekend! The flat itself is very well located with train station 3 min away and other metro station 5-10 min away and at a walkable distance to cafes, bars and Slussen."
1184553,84223345,2016-07-06T00:00:00.000Z,"Annbritt was one of the best 'friendly host' i have met so far. The room was exactly same as seen in the photos. House was very clean, tidy, comfortable and its location was great! We did not use any public transport during our holiday.
Her flexibility at check in/out times was very helpful for us as we had to put our luggages to her home while we were waiting our train."
608672,231248473,2018-01-31T00:00:00.000Z,Excellent host
299154,296603923,2018-07-26T00:00:00.000Z,"Daniel was an outstanding host. He met with us and showed us everything we needed to know. The apartment was very close to transit and Gamla Stan (be aware that people are out enjoying themselves fairly late into the night, and you will be very close to that action). We were here during a heat wave, and Daniel made sure we had a fan. That was GREATLY appreciated! Definitely a great place for a couple looking to spend time in the city!"
299154,238132282,2018-02-25T00:00:00.000Z,Daniel was a great host! Excellent location and great room. Exactly what we needed. Highly recommended!
723539,19073793,2014-09-06T00:00:00.000Z,"Excellent description how to come to the  apartment (from airport or railway station), everything was organized in a perfect way, the apartment was clean, bright, and very tastefully furnished, with a smart kitchen and a really wonderful balcony. 
mathias   is a very nice and uncomplicated host, offers help,if you need some, it was a pleasure for me to stay there for a whole week, and a pleasure as well to water all the plants.

the apartment is located in östermalm, a few minutes from humlegârden, a beautiful and peaceful place to make a break. therefore also the apartment is very quiet, perfect for a deep sleep after working or exciting city life.
there are many good bars and restaurants around the corner.
I absolutely recommend this apartment, perfect for one or two persons."
442837,533240615,2019-09-21T00:00:00.000Z,駅からすぐの立地にあり､また駅構内にｼｮｯﾋﾟﾝｸﾞﾓｰﾙを併設しているため大変便利でした｡ﾌｰﾄﾞｺｰﾄや大型のｽｰﾊﾟｰも入っているので節約したい人には大変おすすめです｡
581243,42873994,2015-08-16T00:00:00.000Z,"Thank you Edwin, we had a very pleasant stay! The room is well located and we could walk to all nice places in Stockholm (only a few hundred meters to all \"hotspots\").

Everything was clean and Edwin was very helpful in providing informations before our trip.

Highly recommended!"
299154,217188938,2017-12-08T00:00:00.000Z,"Enkelt incheckning, ren liten etta men bra läge, kan ara svårt att hitta parkering om man har bil, trevlig värd som svarar snabbt.
//Niclas"
974175,59638039,2016-01-13T00:00:00.000Z,"Jesper and Sofie have a beautiful stylish apartment. It was very comfortable for our family of two young children and us. 

It is well located near the city and close to transport and many amentities."
916806,416206507,2019-02-24T00:00:00.000Z,"Perfect place! Very peaceful and green streets, not far from the city center (6 minutes to the metro station). We had a lot of questions about the city and Julia always helped us :) 5 stars, definitely!"
938750,8620905,2013-11-09T00:00:00.000Z,Amazing place. Peter is extremely helpful and the penthouse is lovely. Don't have much else to say apart from praise :)
862528,5890032,2013-07-21T00:00:00.000Z,"It's a beautiful new villa in a quiet green  neighborhood. When you sit on the terrasse you can't believe you are in Stockholm. Using the \"tunnelbahn\" you are in about 20 minutes in the heart of the city.
We had a great time at Arne's place. Though we never met him in person,  the communication was excellent before and during our stay.
The house is clean and cosy and has a charming garden.
The kitchen is very well equipped and the parking situation in front of the house is relaxed.
We would highly recommend Arne's place to anyone!"
974175,203444973,2017-10-15T00:00:00.000Z,"Rolig og fint område, sentral beliggenhet og en helt fantastisk flott leilighet! Tusen takk til vertene Sofie og Jesper. Vi var 5 besøkende, og vi kan anbefale denne til alle som ønsker å besøke Stockholm!"
954832,167509078,2017-07-07T00:00:00.000Z,"Wir hatten einen sehr schönen Aufenthalt bei Mikael. Er ist ein sehr zuvorkommender und hilfsbereiter Gastgeber und hat uns sehr herzlich empfangen. Die Lage der Wohnung ist absolut einmalig, man ist direkt an der U-Bahn und sogar direkt zu Fuss nach ein wenig Laufzeit in der Innenstadt. 

Es ist die perfekte Wohnung für einen schönen Trip nach Stockholm, die Austattung ist absolut ausreichend und man findet alles Nützliche! Wir hatten wunderschöne Tage und ich kann die Wohnung absolut empfehlen! Beim nächsten Mal kommen wir wieder :)"
819676,122562963,2016-12-24T00:00:00.000Z,"Amazing couple and great place to stay. Walking distance from some of the hippest place in town, loved it."
164448,363675614,2018-12-29T00:00:00.000Z,"Ms li has received us with hospitality and friendliness. Although the transport in Stockholm  is very complicated , ms li helped us by useful map and advise. It's pity that some activity is closed in winter."
164448,36102368,2015-06-25T00:00:00.000Z,"Lidia was very welcoming and had clear instructions for finding apartment. She helped us by providing tourist info, places to visit. Place is as mentioned and clean. Its really close to public transportation made stay easy and comfortable."
145320,263616667,2018-05-12T00:00:00.000Z,"The place was great, close to shops and the metro. Kim was a great host and we had a great time. There was a lot to good and everything was really close by."
556363,343925289,2018-11-02T00:00:00.000Z,"What a gem! Stylish attic that is and feels much bigger than the photos show. The location is amazing! Metro across the street, with quick easy access anywhere in Stockholm. Super comfy beds and great kitchen! Host is great, and was helpful in every way, he even organised an Xbox for my 11 year old son! Can't recommend highly enough!"
536691,32197557,2015-05-15T00:00:00.000Z,The host canceled this reservation 32 days before arrival. This is an automated posting.
1271843,73267246,2016-05-07T00:00:00.000Z,"We could write a long chorus of praise, but there's no need to say more:
André and Johanna are perfect hosts!
Best Location direct in the heart of their fabolous home town.
We felt more than welcome and left as friends.
This experience we can truly call a prime experience and is pretty much the reason why we love travelling by AirBnB."
242188,185923605,2017-08-23T00:00:00.000Z,"La casa de Li tiene una ubicación privilegiada, a dos cuadras de la estación de metro Sodra, es confortable y muy cómoda, el baño es amplio y la habitación es muy confortable, cómoda y luminosa. Li es una anfitriona de primera, cuando llegué me esperó hasta las 22:45 Hs y como era tarde y no había ningún lugar par cenar me ofreció- de modo totalmente desinteresado- unas tostadas con dulce y un té y me explico sobre mis opciones turísticas en estocolmo( eran más de las 23
Hs), otro día me quizo invitar el desayuno - que no acepté pues me pareció que sería abusivo de mi parte. Tanta amabilidad y cuidado por
el turista resulta importante destacar, pues la verdad que me hizo sentir muy a gusto. Es una opción altamente recomendable. Gracias por todo"
1205051,12822161,2014-05-12T00:00:00.000Z,"Viktor is a very good host, his apartment is very nice, practical and well-located.
Even if we arrived late, he was there to give us the key.
We recommend him to anyone."
873383,4581716,2013-05-13T00:00:00.000Z,"The appartment was clean and is located not far from the center.The metro station is only a few meters away. Isabelle was really friendly and helpful. All in all, we had a really nice stay in Stockholm."
916806,206189389,2017-10-24T00:00:00.000Z,Lovely and clean apartment. Enough space for two adults with three small children. Easy access to the shops and public transport. Amazing view and quite area. Just what we needed it highly recommended!
1212891,281114081,2018-06-24T00:00:00.000Z,"Maud is a super nice host, very welcoming and friendly! The apartment and room is lovely and very clean, easy to find, metro station is super close but the area very quiet. There was enough space to use in the kitchen, refrigerator, bathroom. Maud really makes space in her flat for her guests. We didn't miss anything."
1244357,450380456,2019-05-09T00:00:00.000Z,"Мы с женой и нашим ребёнком останавливались в этой квартире во время нашего пребывания в Стокгольме на неделю. Квартира очень чистая, мебель новая, санузел в прекрасном состоянии. Порадовала также продуманность бытовых мелочей: полотенца, посуда, необходимые для готовки специи, соусы и тд. Всё это предоставлено в большом количестве. Если выйти из дома и повернуть направо, в трёх минутах ходьбы есть отличная детская площадка в парке. Поэтому проблем с тем, где погулять вечером с ребёнком, также не возникало. Там же находится пункт раздельного сбора мусора. Локация: до метро идти около 3-5 минут. Пешком до станции T centralen около 15-20 минут. Мы любим гулять и ходили пешком в музей Васа и Юнибакен, это занимало около 40 минут. Если вы любите бегать, то рекомендовал бы парк рядом с музеем Васа, до него около 3 километров от дома. Для ребёнка в квартире комфортные условия, единственно нет детской кроватки (это хозяева сообщили заранее, поэтому неприятных неожиданностей не было). Поэтому я спал в гостиной, так как втроём спать на одной кровати было бы неудобно. Я однозначно рекомендую данное жильё, оно полностью соответствует описанию, очень чистое и абсолютно новое."
1261445,19832769,2014-09-19T00:00:00.000Z,"Marie-Louise is a great host of course. smooth communication, complete privacy, great apartment with very nice deco and plenty of fruit and candy + towels prepared when we arrived! Excellent and highly recommended. The area is definitely one of the best in Stockholm, and I'm from there so I know what I'm talking about. Thanks Marie-Louise!"
1212891,524213277,2019-09-05T00:00:00.000Z,"This is a very clean, comfortable bedroom in a small apartment. The host provides well organized supplies and spaces in kitchen and bathroom. The bathroom is shared with the host and perhaps a guest in the second bedroom. The host is helpful and thoughtful. She has a nice cat named Sammy. The place is a 5 - 10 minute walk from a metro (Tunnelbana) station, so it is easy to get around Stockholm from here. Getting to know this woman was a big part of my happy visit to Stockholm!"
620848,3400450,2013-01-23T00:00:00.000Z,"We had the pleasure to stay for 12 days here in january.

IT has been a very nice stay with great flexibilty and everything in order! 

We felt very welcome and we will defenetly use this again.

The best and most cosy stay ever which we can absolutely recommend everyone."
954832,202680649,2017-10-12T00:00:00.000Z,We really love Miakel's apartment. It's convince
1182616,27813772,2015-03-12T00:00:00.000Z,"Pretty nice location. 
Really easy going stay in a nice bright room!"
916806,6362304,2013-08-10T00:00:00.000Z,"Very nice apartment with a really big terrace. Everything was clean and comfortable. The kitchen has everything you need to prepare a breakfast and dinner. The apartment is about 10min far from the metro station (by foot), where you can also find a lot of supermarkets. from the metro station is takes about 20min to the city center of Stockholm. I would recommend the apartment to other guest. It is very quiet with a lot of nature nearby and it isn't quite far to the city center."
