listing_id,review_id,date,comments
1271843,65396332,2016-03-13T00:00:00.000Z,"André and Johanna were the perfect hosts. We only stayed one night in Stockholm and even so it was an amazing experience. Great hospitality, friendly and helpful couple. André offered us advice about places to go, dine or hangout so we had so much choice! They even provided a lovely breakfast. The apartment is modern, stylish and spacious as well as close to all amenities. Definitely recommend this place. Thumbs up!"
819676,94500821,2016-08-15T00:00:00.000Z,"Andy and Vannie are so kind, easy-going, and welcoming! They weren't able to meet me at the apartment last minute, so they had a friend come down and check me in to the room; it was very painless and their friend was just as great. The bed was a bit uncomfortable for me (very firm), as it is only a futon/sofa bed, but worked just fine. The apartment is incredibly nice, with an even nicer private bath. Great location and so much to do on the island. Highly recommend! Cheers, guys."
647314,147324891,2017-04-26T00:00:00.000Z,I really enjoyed my stay at Mallika's place.  The room was very large and beautifully decorated which made for a comfortable stay.  Mallika also made herself available for tips and suggestions during my stay which was very helpful.  I highly recommend staying here.  Great location!
581243,26051371,2015-02-02T00:00:00.000Z,Super convenient location! Walkable to everywhere! Very happy with the accommodations and the hospitality!
1173290,29662585,2015-04-11T00:00:00.000Z,"Christian and Karen made us feel very welcome and we felt right at home. The apartment itself is beautiful and we certainly felt a sense of \"place\": it reflects the Swedish sense of style. We had everything we needed and it proved a great jumping off point for our exploration of the city. There is very easy access to the great Stockholm public transportation network, but it is also easy to walk into the city centre. There are plenty of restaurants in the neighbourhood as well. All in all we would heartily recommend this apartment to others."
1182616,433930622,2019-04-07T00:00:00.000Z,"The location of this accommodation was perfect, just 2-4 subway stations to the central station. Peter was always helpful and kind. The room was enough for 2 persons provided it has a balcony, the only bad part was that the bathroom was not quite clean and the sink (which was also pretty dirty) and the shower was clogged and there was a bad smell generally in the bathroom."
1182616,30954403,2015-04-29T00:00:00.000Z,"Muy bien! Peter es muy amable y correcto. Está atento a dar la información que necesitemos para la estadía en su apartamento. 
El apartamento es muy limpio, ordenado, tiene todo lo necesario. Es muy central y tranquilo."
845365,58980311,2016-01-05T00:00:00.000Z,"Michael is a great host! We are happy that met such a kind and intelligent person in our trip! His flat is very creative and it looks like concept design museum with million simple things that are in perfect order.

Good transport communication to the center. Two big supermarkets 5 minutes far from the house. Wonderful forest 5 minutes from the house.

Highly recommended!"
1234960,45547739,2015-09-04T00:00:00.000Z,The host canceled this reservation 16 days before arrival. This is an automated posting.
954832,15732583,2014-07-14T00:00:00.000Z,Mikael was a wonderful host who was able to help with immediate accommodation on the account of a last minute cancellation.  An incredibly helpful and friendly host who will go out of his way to help you. The accommodation was convieniently located in stockholm with 5-15minutes to all the major landmarks depending on method of transport.  Room was comforting to unwind at the end of the night.  Will be spend Stockholm again with Mikael.
259025,1770605,2012-07-22T00:00:00.000Z,"We stade 2 nights
Convenient place, close to the metro
Clean apartment
Hospitable host
He provided assistance on any matter

Thanks Ali"
1096827,493821825,2019-07-23T00:00:00.000Z,"The place in Stockholm gives you the feeling to be home and easy. It’s 15 minutes from the old town, when you travelling by the metro. There is a supermarkt nearby, a fresh bakerystore and a tasty italian restaurant.
Anita is very friendly with suggestions to see in Stockholm"
553914,286851746,2018-07-07T00:00:00.000Z,"Small but lovingly furnished apartment in the middle of the city. The communication was Great and Sibelle answered very quickly.  Supermarket, restaurants and bakers are just around the corner.  We felt very comfortable.  :)"
1212891,19071230,2014-09-06T00:00:00.000Z,"Maud is a lovely, friendly and easy-going person! It's very easy to deal with her, she is always ready to help and she makes you feel free all the time. It was very nice to meet her and  chat with her. The apartment is near to the metro, supermarket and the sea! It's a nice neighborhood. Everything is clean, the shower is nice and the cats are lovely. We enjoyed a lot! Thank you for everything, Maud!"
875505,519379446,2019-08-28T00:00:00.000Z,"While the place may seem bare, it is actually serene and and calm. There are no frills or fuss at all. A functional kitchen for nights in (it can get expensive eating out in Stockholm). A spacious bathroom, with a washer/dryer. An amazing view of the sunrise/sunset over the expansive city. The best part though... the prime location, surrounded by shopping centers, green parks for relaxing, metro stop within close distance, and countless of sightseeing areas to explore. If you are flying in from the airport, there's an express train taking you straight to Central Station - a 10 minute walk from the flat!

I'll shut up now. Just know you're getting a good deal with this lovely home."
1119738,331977554,2018-10-04T00:00:00.000Z,"第二次入住这个AIRBNB了,很好的感觉!
房东很友好,房间很干净,设施很齐全,交通很方便,还有免费停车｡强烈推荐!"
723539,484085048,2019-07-08T00:00:00.000Z,"Brilliant location, beautiful apartment. We spent 4 nights at Mathias’s place on a short city break to Stockholm and couldn’t have asked for a better place to stay. Highly recommend!"
242188,452472956,2019-05-13T00:00:00.000Z,"Totalmente recomendable por la veracidad de
 los servicios ofrecidos.Todo funciona y está (Website hidden by Airbnb) es una persona atenta ,amable y pendiente del (Website hidden by Airbnb) ubicación es óptima.Un cálido lugar al que dan ganas de volver."
628555,67391220,2016-03-29T00:00:00.000Z,"Anna was not able to meet us personally, but she made it very easy to get the key and to reach her apartment and sent us very good directions and advice. She was also reachable over the AirBnB App or by text the entire stay, and stayed in contact. 
The public transportation is wonderful- the T-Bahn station is only about 10 minutes walking from the apartment, and there is a bus stop right outside (all accessible with a SL transport card.) About 30 minute trip to get into the Stockholm city center. 
The apartment was lovely- accurate description, clean, and well-equipped. We were able to make ourselves feel right at home. The neighborhood is very cute, and there is a shopping center 10 minutes walking from the apartment. We were able to get all our groceries from the Co-op, the very nice supermarket nearby. 
I would recommend this apartment to any couple, especially anyone looking to be able to get away at the end of the day. It can be hectic to stay in some hotel in the city, but here you can just go back to Anna's and feel relaxed and at home. 
We had a very lovely stay and would love to stay in the apartment again anytime we are back in Stockholm. Thank you, Anna!"
647314,7267648,2013-09-13T00:00:00.000Z,"Thanks to Mallika (and her furry friends!) for the warm and friendly welcome for my first visit to Stockholm.

The flat is as lovely and welcoming as pictured and is in a brilliant location for easy walking access to all that Sodermalm and Gamla Stan offers in terms of shopping, museums, historical sights, eating (I highly recommend Bistro Sud around the corner!) and generally soaking up the culture....

A great introduction to Stockholm!"
624886,33977677,2015-06-03T00:00:00.000Z,"This apartment is very conveniently located close to Hornstull station.  We really enjoyed staying here and would highly recommend it.  It's comfortable, very quiet (no noise at all), clean, and safe.  Anyone staying in Stockholm with children will enjoy this cosy, child friendly apartment.  Oskar was quick with responses as well. Thanks!"
608672,334831580,2018-10-10T00:00:00.000Z,Karl’s place was perfect for our stay in Stockholm! Close enough to walk to everything but far enough away from any loud noise. It was clean and cozy and in a beautiful building! I definitely recommend it!
757320,504092071,2019-08-07T00:00:00.000Z,"Barb’s place is in a great location and is very clean and comfy, Barb herself was a friendly and helpful host who was as involved with your stay as much as you needed and wanted. I recommend her place to anyone."
1212891,459351511,2019-05-27T00:00:00.000Z,Great experience.
608672,124541478,2017-01-02T00:00:00.000Z,"Il n'y pas vraiment de baignoire ou de bac à douche. L'évacuation de l'eau se fait à même le sol. À part ce petit défaut, l'appartement est idéalement situé, Karl et sa compagne sont chaleureux et disponibles. Nous avons passé un excellent week-end."
164448,8519361,2013-11-04T00:00:00.000Z,"My parents stayed in the double room, and really enjoyed the stay. The beds are really cozy - and the breakfast was delicious and the perfect start for a long sightseeing day.
The place has a perfect location to the tube (5 min. walk) or by foot (20 min. walk) into the inner city.
You feel very welcome and so I can totally definitely recommend it!"
916806,221939963,2017-12-28T00:00:00.000Z,"Julia's place is great if you're looking for a quiet, modern spot away from central Stockholm. It is a redone studio below a larger house that is separate. It was very clean and comfortable with everything we needed. You can also check out the world's largest IKEA nearby!"
1234960,13779682,2014-06-04T00:00:00.000Z,"We stayed in Jacobs house for 5 nights - 4 persons. the charming house is just 15 min by metro from the city center of stockholm with a huge garden. lot of space in the house and a well equipped kitchen. 
Very nice and quiet neighborhood, supermarket around the corner and metro station nearby. 
one double bed room below the roof, one double bedroom downstairs."
1262188,5330237,2013-06-24T00:00:00.000Z,"We were fortunate to be Karin's first guests! We loved it! My husband and I were traveling with our 12 year old. It was perfect size for a family of 3, and could accommodate a family of 4 or 2 couples. It was very conveniently located to the metro and the commuter train. So really, only a 1 min walk to train and 5 min walk to metro. It was very safe and clean. It had so much light with all her windows! Very nice patio! She had a good size separate BR and well stocked kitchen. We cooked dinner almost every night. It has a wonderful choice of multiple grocery stores, bakeries, ATM machines close by, all within walking distance. Karin met us and spent a long time discussing sites to see, as well as recommendations for food and wine shopping. She was very accessible the whole time we were there! She responded quickly to our texts. 
This apartment made our stay in Stockholm very pleasant , and we would recommend it to anyone!
Thanks Karin!!"
283446,80409718,2016-06-18T00:00:00.000Z,This is a great place to stay! It is only 20min by train to the city center- very convenient and this family is very helpful! I recommend a stay at their place!
776012,278047577,2018-06-17T00:00:00.000Z,"My wife and I spent a week in Majken's apartment, and the first thing we noticed was that is was very clean and tidy. Is is a climb up the stairs but if you are looking for a location in Gamla Stan for 2 people it could not be better: just off the busy commercial streets (nice and quiet in the apartment) but right in the center of things. Five minute walk to the metro station and to a couple of grocery stores. Majken and Emil went out of their way to help us get our bearings around the city, locate restaurants, etc.  I highly recommend this host."
242188,115868743,2016-11-27T00:00:00.000Z,"my first airbnb experience, extremely happy to stay with Lidia. Charming, caring and warm lady who made my stay terrific. Room was as described, spotless. Amenities for preparing of basic meals (especially useful for the expensive city of stockholm). She gave very clear directions on how to head to her place from the train station. Her apartment is located in a central location with easy access to T-bana (metro) stations. A couple of supermarkets located in the area. Close to the usual tourist spots in Stockholm, easy access on foot, or by public transport (if you're lazy). Bed was comfortable and her place was warm enough. Nice living area to hang out and interact with other guests (if you so wish)."
954832,161956803,2017-06-19T00:00:00.000Z,"An amazing stay. The photos do not do justice to the apartment. Very convenient to all the amenities. Super clean, tidy and with all you could need  and more for a great stay. The hosts are reliable, friendly and very helpful. Thanks we had a fabulous stay."
1182616,19568438,2014-09-14T00:00:00.000Z,"We did not manage to meet Peter but he gave clear instructions on how to check in. The apartment's location was very good, a few minutes walk away from the metro station. We enjoyed our stay here."
954832,31199374,2015-05-03T00:00:00.000Z,"Très bon séjour à stockholm, dans ce petit appartement très fonctionnel, propre, confortable et bien localisé, fidèle à sa description. Mikael nous a accueilli très chaleureusement, et nous a donné toutes les informations nécessaires pour visiter la ville et ses alentours, soucieux de notre bien être tout au long du séjour. Merci Mikael !"
242188,267592793,2018-05-22T00:00:00.000Z,"Li was a great warm hostess that made me feel almost at home.
She provided me with lots of information and tips that saved me money and time.
I wish I stayed longer. I also hope that Li’s place will be available when I’ll visit Stockholm again."
916806,24027786,2014-12-17T00:00:00.000Z,It was our second time at Mansour's place. We love the apartments and view from the terrace. Mansour and Julia are very kind and helpful hosts. Highly recommend this place.
1261445,33564301,2015-05-30T00:00:00.000Z,"Great apartment, wonderful host. Convenient location. We were met by the host and her daughter, given thorough briefing on the apartment, the neighborhood, public transportation, must -sees, etc.
The apt. Was filled with fresh fruit, roses, candy. It is light filled and beautifully decorated. It was a perfect base for our Stockholm stay"
1248490,79662183,2016-06-13T00:00:00.000Z,"Tolle Wohnung in perfekter Lage, sehr zentral und ruhig. Außerdem sehr schön eingerichtet, super ausgestattet und sehr sauber.
Maria hat uns sehr freundlich empfangen und mit wertvollen Tipps versorgt. Absolut zu empfehlen!"
581243,80870182,2016-06-20T00:00:00.000Z,"Edwin was a great host. He made sure that I was informed about Stockholm before I arrived. I almost felt like I was the only one in the apartment. As soon as you enter the room, you can smell the fresh linens. The apartment was right across the subway, and only a couple of stops away from the main attractions. Overall, it was a pleasant stay."
755843,534038768,2019-09-22T00:00:00.000Z,Väldig fint och städat
1182616,42495151,2015-08-13T00:00:00.000Z,"The room was spacious enough for two, clean and centrally located. Very nice time in Stockholm. Thank you Peter!"
1205051,15193619,2014-07-04T00:00:00.000Z,"Our host was most gracious, fitting his schedule to our delayed arrival.  The apartment was as advertised.  It was comfortable, tidy, clean, and very, very functional.  It was easy to get around, convenient to public transportation and an easy walk to the Old Town, the Palace, and downtown."
313195,3426226,2013-01-28T00:00:00.000Z,"David's apartment was everything I was excepting. I felt he provided a great services throughout. 

The apartment is very cosy and gave me a very good vibe from the second we arrived. It was really clean, too. It's location is also brilliant with a handful of nice little restaurant and bars close by and only 10 minutes away from the nearest tube. 

I wouldn't hesitate to recommend it to other travellers."
1248490,74515830,2016-05-15T00:00:00.000Z,"Maria was extremely welcoming and took the time to show us around the flat, point out some of the amazing things to do in Stockholm and impress upon us that she was always available by text if we had any queries.  In fact she went beyond the call of duty by texting us some bar choices! Excellent host!"
581243,461251708,2019-05-31T00:00:00.000Z,"Edwin’s place is truly a gem. Very conveniently located, and perfect for those who want to explore as much as Stockholm as possible. He is very kind, and was willing to greet us even when our flight arrived very late. I would highly recommend his place, my stay was extremely comfortable."
757320,115899157,2016-11-27T00:00:00.000Z,"Great location, very special host"
299154,46282425,2015-09-09T00:00:00.000Z,"The apartment was great and in a perfect location. It was exactly what we were looking for. 
Although Daniel didn't meet us on our arrival he had arranged for a friend to give us the keys and we had no issues. We experienced a delay in our arrival and this was handled perfectly.
Overall the apartment was great and the location was exceptional!
Thank you for a great stay!"
688947,40416941,2015-07-31T00:00:00.000Z,The host canceled this reservation 14 days before arrival. This is an automated posting.
299154,8341359,2013-10-26T00:00:00.000Z,"An amazing apartment in the center of the city. a great location, walk distance from everything u want. a minute walk from the subway. 
Stayed at Daniel's apartment for 5 nights and it was really nice, space is small- but u get everything u need :) Nice accsorized Kitchen, huge cable TV and WiFi plus I got the best sleep on his bed! mattress was so comfortable i didn't want to wake up :) Also nice Balcony which is always fun to go out to. 
Communication with Daniel was great - and Check in/out were flexible :) :)  
Thank you Daniel!! Definitely Recommend this apartment and will be back there :)"
620848,6872854,2013-08-28T00:00:00.000Z,"We found the apartment very comfortable, Stockholm is easily accessible. The pantry was full, and this has saved us a lot of money. Hanna and K. have explained in detail everything we needed. There are all detergents and lots of soap. Although it lacks a drying rack, clothes dry-cleaned Manoi easily hung on a hanger in the bathroom. The temperature inside is very comfortable. Just one note:  there are not a basin and soap to handwash clothes . Sure the value of our holiday was increased by our stay in this apartment."
278311,8791330,2013-11-18T00:00:00.000Z,"Linnea is a very nice person. I can sincerely recommend to stay at her place. Only minus for me was missing TV, but Linnea's personality and her spirit made it everything so easy and comfy.

Ilkka Järvilehto"
1048260,32416658,2015-05-17T00:00:00.000Z,"Annika has a really nice appartment, in the South of Stockholm. Although we did not met she was very helpfull in answering questions & providing me with all the info needed. Because it was good whether I used the bike a lot to go into Sodermalm & the city center. The metro station is a 10 min. walk. Thanks for a great stay, I really felt at home!"
164448,498731198,2019-07-30T00:00:00.000Z,"Quarto e banheiro muito confortáveis, limpos, boa área de estar. Li é muito prestativa e muito interessada em oferecer ajuda. Tivemos problemas com nossa bagagem que não chegou e ela logo nos ofereceu escova de dentes na chegada. Nos ajudou na intermediação com a empresa aérea quando precisamos que recebesse mensagens e a própria bagagem qdo foi entregue.  Voltaria a me hospedar em seu apartamento"
647314,356857818,2018-12-09T00:00:00.000Z,"The room was clean and welcoming. The apartment is located near a metro station, shops and restaurants.
I recommend it to everyone."
1153177,40918528,2015-08-03T00:00:00.000Z,"We had a great time staying at this spacious and well located apartment. Terry was a great host and laid on food and beers for our arrival which was a really nice touch. Totally quiet at night so you can get a good sleep, yet only 2 stops from Central Stockholm . Would recommend to anyone looking for a base from which to explore this beautiful city."
1096827,5711795,2013-07-13T00:00:00.000Z,"The flat is really spacious but also quite cosy. The neighborhood is located outside the city centre and seems quiet but also very save. The metro is just about 5min from the apartment and takes you into the city every 10min. There is also a supermarket and a pharmacy nearby.
Anita is a great hostess, we had the pleasure to meet her and talk a bit. She even left us some food in the fridge. Overall we had a great stay and enjoyed the time at Anitas place."
299154,53735165,2015-11-11T00:00:00.000Z,"Thank you Daniel for his kindness And his warmly welcome to the appartement which Is Very Nice in the city center, close to the Metro station. Highly recommanded!"
347192,25606018,2015-01-20T00:00:00.000Z,J ai passé un séjour très agréable dans l appartement qui est idéalement située et très confortable.
1117037,152224306,2017-05-15T00:00:00.000Z,Polina's place was fantastic for my short stay in Stockholm. It is literally around the corner from the train station which takes you directly to Stockholm in ~20 minutes or so. There is a nice grocery store just down the street and the kitchen was perfect to cook a few meals. The room is clean and nice with a lovely bed and the bathroom was also clean and pleasant. Polina stayed up very late to check me in which was much appreciated. Great stay at a great price!
647314,4979715,2013-06-05T00:00:00.000Z,"We were in town for the Stockholm Marathon. The location is simply perfectly located very close to a subway station. Easy to walk or cycle everywhere in the city if you feel like it. The apartment and the room you get is great, and Mallika helps you out with whatever you can think of. She's a good singer too, as she demonstrated in a live performance at one of the bars in Gamla Stan :-) She also helped us out when we had a minor medical problem on our flight to Stockholm.

In short, we had a great time. You should know though she has two cats, so if that bothers you, keep this in mind. It didn't bother us - we really didn't mind, nice animals!

Thanks again to Mallika for having us. Next time in Stockholm, we won't hesitate to come back!"
1054406,124959225,2017-01-03T00:00:00.000Z,"We had a fantastic stay! The apartment is amazing, modern, beautiful and comfortable. Would give 6 out of 5 stars if I could! Thomas is extremely friendly and helpful. Honestly; all in all, our stay was perfect. I would highly recommend staying there! The lake nearby is lovely and it's easy getting to the next bus stop and to the city.
Every time again! :)"
1271843,409313513,2019-02-07T00:00:00.000Z,"Great room and near the underground, handsome host with plenty of useful information."
299154,38942176,2015-07-19T00:00:00.000Z,"Lejligheden ligger meget centralt og stemmer fint overens med beskrivelsen på hjemmesiden. Lejligheden er ikke stor, men der er alt, hvad der behøves til en forlænget weekend. Daniel var meget hjælpsom og gav nogle gode råd til området."
145320,318660967,2018-09-04T00:00:00.000Z,"Excellent location near Mariatorget metro station.  Good nearby restaurants, shops and bars. Very pleasant host with a really cute and comfortable apartment. Recommended!"
299154,9318560,2013-12-21T00:00:00.000Z,Daniel was a great host and his apartment was super cosy. Very close to city center so it was convenient to travel around Stockholm. Would definitely recommend Daniel's apartment for a small group of friends visiting Stockholm for the first time!
755843,342041011,2018-10-28T00:00:00.000Z,"An overall great appartment close to the city center. Great hospitality, safe to say that I can recommend this place to anyone coming to Stockholm. 10/10"
700113,332353183,2018-10-05T00:00:00.000Z,Trevlig vistelse med omtänksamma detaljer
1212891,225983457,2018-01-08T00:00:00.000Z,Maud was very nice she accommodated my late arrival and was super hospitable even in the middle of the night. I was there only for a short while due to fact that i arrived late and left early. If i come back to Stockholm and need accommodation at this area I would go back!
647314,194160702,2017-09-16T00:00:00.000Z,We had some nice days in Mallika's lovely room. Thanks a lot!
