listing_id,review_id,date,comments
757320,528997967,2019-09-14T00:00:00.000Z,"Our stay in Stockholm was most enjoyable! Barb's place is well located so we were able to get to Gamla Stan within 20mins. Supermarkets , restaurants, bars, galleries,  bakeries are all close by too! Barb really made the effort to keep the place clean and tidy. Thank you !"
819676,509176928,2019-08-14T00:00:00.000Z,Definitely recommend staying here. Very friendly hosts with great communication. Room is very clean and in a great part of town.
608672,149406902,2017-05-04T00:00:00.000Z,Best thing about this studio is the location - it's walkable to everything we wanted to do/see/eat in Stockholm. Neighborhood is lovely. Karl was accommodating and communication was easy and quick. Karl has plans to expand the bathroom to include a full shower cabinet which will be a nice improvement. Highly recommended!
608672,70229460,2016-04-17T00:00:00.000Z,"We passed an excellent week-end to Stockholm. The flat of Karl is perfect for one person or a couple. It is situanted in very good area, we did not use the transport at all. We discoverd the city by foot. Karl is  kindly and prevenant host. He advice us a pub with live jazy soul music (the stampen) and we passed a pretty night. 
NB: Karl parle très bien français ! 
Alice & Clement"
700113,18396844,2014-08-26T00:00:00.000Z,"Me and my friend spent 9 nights at Ilona's apartment and studio, and we had a great stay. The studio was really cosy, comfortable and very clean. It is located in a nice area, not far away from the city center.

Ilona is very kind, helpful, sympathetic and easy to talk. She does her best to make the guests comfortable. Her pets are nice and friendly.

We have no reason to complain : everything was perfect. Thank you very much Ilona !"
723539,75268055,2016-05-20T00:00:00.000Z,Thanks for an enjoyable stay. The apartment is clean and looks as good as in the photos. It also seems to be in a pretty high-class neighbourhood. It is a short walk to the very appetising Saluhall market. Central station and Gamla Stan are also within walking distance.
700113,81675570,2016-06-24T00:00:00.000Z,"The place was clean, centrally located and easy to access."
1244657,74096269,2016-05-13T00:00:00.000Z,"Hyvä sijainti, kiva huone ja ystävällinen vastaanotto."
608672,461262205,2019-05-31T00:00:00.000Z,"Flott 1-roms husvære. Eigen inngang. Sentralt i byen. God seng. Roleg område. Litt lite bad/wc, mykje vatn ut på golvet (ikkje fall mot sluk). Kjem gjerne attende."
608672,530720059,2019-09-16T00:00:00.000Z,"Very lovely host. Perfect communication. Confortable room and bed. Only point to improve: shower (but we knew in advance from pictures). Perfect spaces organization and kitchenette facilities. Excellent position (2min walk from Coop, apoteke, metro and coffees + 3 metro stops from Gamla Stan)."
1271843,127998110,2017-01-22T00:00:00.000Z,"The most amazing airbnb stay. I travelled for business and André was extremely accommodating even though he was busy with work.  He was very gracious with his space and made me feel like I was at home with access to all the things I needed.  Communication was great and his space was very clean,  conveniently located next to the underground staff and very easily accessed from the airport. I had Wi-Fi, coffee, food and a comfortable and clean bed.  I highly recommend him and the space"
647314,195610509,2017-09-20T00:00:00.000Z,"Mallika's space is truly beautiful! There are so many aesthetic touches to the spacious tastefully designed room.
 Her home is pure medicine for anyone who loves originality and style. 
Mallika's friendly way and eagerness to give tips regarding the area makes one feel welcome and immediately at ease. 
Hope to return to this oasis for the spirit right in the centre of groovy Södermalm!! I loved my stay!"
259025,9155406,2013-12-09T00:00:00.000Z,"Ali was an excellent host, always open for a friendly chat. The room was fine too. 

I particularly appreciated Ali's quick response to whatever query I had, booking Ali's place was easy and fast. 

His place is somewhat remote from the center of Stockholm but easily reachable by metro. It is a really good option as prices are particularly high in the city center."
299154,39148217,2015-07-21T00:00:00.000Z,"Our stay at Daniel's place was enjoyable.  The location was great and we appreciated that Daniel went out of his way to have a baby crib for us to use.  Daniel gave us a thorough introduction of his apartment and also had a First Aid Kit available for us to use, which incidentally we ended up having to use."
313195,39105521,2015-07-20T00:00:00.000Z,Good place at a great location. Apartment was nice and clean with ample space for the three of us traveling together. There are many nice restaurants and cafes close to the apartment and the city is in walking distance. David was very friendly and accommodating. We booked the apartment only a few days before we arrived and David answered our request immediately.
206221,7926625,2013-10-08T00:00:00.000Z,Everything o.k. We had a nice stay. This is a good place to stay at stockholm.
1271843,141485949,2017-04-03T00:00:00.000Z,"Amazing location next to metro station, in the cool part of Stockholm and within walking distance of old town. Andre is the perfect host, charming, helpful and very clear in communication. Apartment was wonderful base for a great week in Stockholm!"
556363,409010340,2019-02-06T00:00:00.000Z,Lennard place is far nicer than it even appears in pictures. great location. Lennard was very responsive and went out of his way to make sure things were good. it's a great place!!
739726,471869579,2019-06-18T00:00:00.000Z,"Sanna's place is incredibly well located in the middle of Söder, the trendiest part of Stockholm. It's a comfortable and roomy one bedroom flat with tasteful decorations and a comfy bed. The are is quiet at night and there's loads of cafes and restaurants open just around the corner. Sanna was also very helpful with the check in and throughout our stay. Would rent again!"
954832,4935060,2013-06-03T00:00:00.000Z,"Had an amzing stay at Mikael's place.  It was cenral....a few mintesaway from the metro, shopping etc. Very clean and had everything  I needed....good bedding, nice towels, place to play music and they booked laundry for me.  There is no TV, but it is not needed in this beautiful city. Mikael answered emails quickly and thougt of everything....even a SL card......thank you for everything.....I will recomend and return if I return to stockolm."
299154,304808276,2018-08-10T00:00:00.000Z,"Perfekt liten lägenheten som ligger otroligt nära allt och väldigt lätt att hitta! 
Daniel är en fantastisk värd som svarar snabbt, är otroligt hjälpsam och svarar gärna på frågor! 
Allt finns i lägenheten, från handdukar, tvål och schampo till en liten \"affär\" i ett skåp där man kan köpa smått som man glömt eller vill ha tex en flaska vin eller tandkräm. 
Fräscht och fint och till och med en chokladbit som välkomstpresent!"
608672,191584309,2017-09-08T00:00:00.000Z,"Tres bien situé, à 5 minutes de la grande rue piétonnière, parle très bien français, l'appartement est propre mais ne considère pas cela comme un appartement plus une chambre avec salle de bain , très petit. La cuisine ressemble plus à un garde manger, manque flagrant d'ustensiles et la douche aurait besoin de renos, on met de l'eau partout  mais Stockholm est une très belle ville!!"
581243,172498496,2017-07-21T00:00:00.000Z,"Edwin’s place was comfortable, quiet and cozy. I would definitely stay again!"
536691,315179953,2018-08-28T00:00:00.000Z,"Charming flat, very well located, original and quiet !"
1304431,20432971,2014-09-29T00:00:00.000Z,"We had a wonderful weekend in Stockholm and enjoyed Madeleine's delightful, well equipped apartment.  Madeleine was easy to get in touch with throughout our stay and left ample information about the apartment and area.  We were disappointed to not have working Wifi available, but I believe this was a relatively new issue, and hopefully it will be resolved by the next time anyone comes to stay.  I would highly recommend renting this home!"
1048260,157583999,2017-06-04T00:00:00.000Z,"Wir hatten einen wundervollen Aufenthalt in Stockholm.
Annika's Wohnung ist sehr schön und mit viel Charme eingerichtet. Sie liegt zentral, zur Bahn geht man ca. 5 Minuten und zum Zentrum sind es nur vier Stationen. 
Wir haben uns bei Annika sehr willkommen gefühlt, die Kommunikation war sehr freundlich und sie hatte auch ein paar tolle Tipp´s für uns. Vielen Dank! :-)"
1117037,221086047,2017-12-25T00:00:00.000Z,Nice room in a quiet residential area close to a subway station.
795354,46541204,2015-09-11T00:00:00.000Z,"Gustav was super nice and helpful, very responsive and a great host. The flat is very spacious (actually bigger than what it seems from the pics), great open plan kitchen and bathroom and comfortable bed. Definitely recommend it!"
1182616,65240620,2016-03-12T00:00:00.000Z,Great location and a nice host!
858902,26450312,2015-02-13T00:00:00.000Z,"The communication before my visit with Lotta was very easy and clear. I was very warmly welcomed by her daughter Beatrice and her adorable dog Lola. The room looks just like the pictures and was - like the rest of the appartment - very clean. It had a big build-in wardrobe and closet, so lots of space to store my cloths. I found the plastic box very convenient to store my hygiene products and carry them to the shower.

Lotta provided me a area in the fridge, where I could leave my food. The Wifi is very fast and absolutely stable. Several bus and subway stations are just around the corner - the location couldn't be any better. I highly recommend this room - especially when you prefer privacy and quitness."
164448,43582851,2015-08-20T00:00:00.000Z,"Lidia is a wonderful woman. Her apartment is really nice and comfy. She was always looking for us, specially when we were leaving Stockholm she walked us to the metro station. The breakfast was really good all the days we stayed Thank you Lidia."
533880,33138954,2015-05-25T00:00:00.000Z,"I stayed at jarl place in Stockholm in May. He was an awesome host and so kind and friendly. He provided me with lots of tips about the city and directions I places. He always responded so quickly to all my question. The room itself was perfect for me, very bright, clean and big. The location of the place is close to a metro station which is two stops from central station. I highly recommend staying here. Thanks jarl for being such a great host! :)"
514210,6880329,2013-08-28T00:00:00.000Z,"Margareta and her family was a nice and careing host and we had a great time in Stockholm. Visit her, we can recommend it."
242188,121322524,2016-12-16T00:00:00.000Z,"Staying with Lidia was one of my all-time favorite Airbnb experiences. Her home was incredibly warm and cozy—I felt like a real Stockholmer. It's insanely easy to find, right next to the commuter train station, which you can reach directly from Arlanda. She also sent me perfectly clear directions. Upon arrival, she offered me green tea and gingerbread cookies and we sat with the map of Stockholm so she could explain the must-sees. It was so sweet. Highly recommend!"
974175,23452021,2014-12-01T00:00:00.000Z,Tack Sofie och Jesper för att vi fick förmånen att spendera vår Stockholmshelg i er charmiga och hemtrevliga lägenhet! Vi är väldigt nöjda med boendet och hur allt runt omkring sköttes. Området är mysigt och behagligt och dessutom perfekt avstånd till stan. Stort tack igen!
1189469,39670342,2015-07-25T00:00:00.000Z,"I did not meet the host in person but the apartment was as lovely as the pictures shown! It is very spacious and definitely comfy for a family to live in. There were also enough facilities in the apartment. The apartment was in an excellent location with a supermarket, train station and bus stop nearby."
536691,440757234,2019-04-21T00:00:00.000Z,"Amazing location and value. We especially liked having a fully equipped kitchen too!

And Cecilia is a great host and communication was fast and to the point. Definitely recommended."
1153177,290859554,2018-07-15T00:00:00.000Z,"O apartamento é claro, ventilado  e com tudo o que é necessário para a hospedagem. Rua tranquila, residencial, mas a curta distância de supermercado, farmácia e comercio em geral."
897584,7587495,2013-09-25T00:00:00.000Z,"We adored Viveka's apartment. It was located next to the woods, so we could open the windows at night and hear the rustling leaves!  It was quaint and well decorated. We slept two on the couch and one on the bed, and all were very comfortable! Viveka was a great communicator and good to check in and answer all questions. We would recommend this to anyone!"
1296080,14450829,2014-06-19T00:00:00.000Z,"Bjorn's flat was a great place to stay in Stockholm: easily accessible by metro, very cute and clean, and in a quiet neighbourhood. Would definitely recommend!"
338470,81154275,2016-06-21T00:00:00.000Z,"Great little apartment in a great neighborhood of Stockholm. Gustaf was there to greet us and gave us good recommendations on what to do and see in the city. The apartment is very pleasurable to be in and has great light, which makes for some very short June nights. Bring an eye mask if you're coming to Stockholm in the summer!"
757320,263551658,2018-05-12T00:00:00.000Z,"Très bon accueil de la part de Barb. Malgré les 6h de retard de notre vol, Barb a su se montrer très compréhensible pour organiser notre arrivée.
Appartement propre avec cuisine à disposition. Situé près de quartiers animés mais situé un peu plus loin de la vieille-ville de Stockholm (accessible en 15 min à pied ou en 5 min en vélo)."
1184553,278939169,2018-06-19T00:00:00.000Z,"Annbritts place is really great to explore the awesome city of Stockholm! It’s close to everything you need. Cafes, Bars, Restaurants, Shopping and Public Transportation are just a stone throw away. A sightseeing bus stop and Metro station are just a 3 minute walk away. The room was very clean and we really liked the furniture and the overall style of the apartment. Communicating with Annbritt was very easy and fast. During our stay she checked-in on us and asked if everything was okay and really made us feel at home! :-) Thanks again!"
581243,76127068,2016-05-25T00:00:00.000Z,Edwin and his wife were excellent hosts. Extremely friendly and helpful. The room was immaculately clean and convenient. It is very easy to get anywhere I the city from here (walking or public transit!)
313195,30930461,2015-04-29T00:00:00.000Z,"we had a great stay in the appartement of David. The flat has a cosy and stylish athmosphere and we immediately felt comfortable. The kitchen is simple but you find everything you need. The beds are both very comfortable and David even provides towels. The flat is in a calm and nice neighbourhood where you find also a lot of Cafés, Restaurants, shops and there are good connections to public transprt."
647314,349740170,2018-11-18T00:00:00.000Z,"Mallika’s place is truly in the heart of Stockholm and is a great retreat after exploring the city day and night. Her place is cosy and well designed, can definitely recommend."
608672,18247522,2014-08-24T00:00:00.000Z,"We enjoyed our brief stay in Stokholm at this neat, clean, and wonderfully located studio apartment. Karl was an extremely welcoming host and explained the accommodations upon our arrival. He was easy to communicate with prior to our trip as well. Would definitely recommend Karl's apartment in the future!"
1212891,104372384,2016-09-26T00:00:00.000Z,"My experience was amazing! Maud was such a lovely host and very well prepared. She was helpful and friendly, I enjoyed my stay very much."
610948,316310040,2018-08-31T00:00:00.000Z,"Lina’s apartment is spacious, bright and decorated with lots of cool details, art and design. A very inspiring place in the best neighborhood and even with a good view. The communication has been easy. I would definitely recommend this place for others who appreciate art and design."
700113,418501882,2019-03-02T00:00:00.000Z,Great location and great room with a nice hostess
475409,21660910,2014-10-21T00:00:00.000Z,"L'accoglienza è stata puntuale e calorosa, Cor è una persona molto disponibile e al nostro arrivo ci ha accompagnato in alcuni punti strategici della zona. L'appartamento è adatto ad una/due persone ed è fornito di tutto il necessario. Il quartiere me lo aspettavo più vivo e caratteristico, probabilmente ciò è legato al fatto di aver soggiornato durante il week end."
299154,468258829,2019-06-12T00:00:00.000Z,"Daniel was super helpful through the process, and was understaning when I had to amend the booking for my colleagues. He kept in touch through out and has a comfy apartment perfect for exploring the city."
1048260,473662024,2019-06-22T00:00:00.000Z,"Nice bohemic apartment with a balcony,  great contact to Annika! 
5-10 min to city centre, groceriestores and metro nearby the apartment,  i would book it again!"
145320,310825120,2018-08-20T00:00:00.000Z,"Vous pouvez aller chez Kim les yeux fermés. C'est une hôtesse d'exception, accueillante, chaleureuse et bienveillante, elle m'a tout de suite aidée à me sentir comme chez moi dans son adorable appartement - au passage idéalement situé. Ses conseils vous aideront à passer un incroyable séjour à Stockholm ! Encore merci Kim !"
1166419,267976108,2018-05-23T00:00:00.000Z,Super location with grocery store literally across the street and walking distance to most things.
164448,79040842,2016-06-10T00:00:00.000Z,"Lidia's home is perfectly located for visiting Stockholm, with all public transport very near. The room is small, but equipped with all necessary stuff. Lidia was very helpful for planning our visit."
1271843,154425190,2017-05-24T00:00:00.000Z,"André is a great guy, very friendly and welcoming. The property is in a great location with easy access to the T-bana and close by to attractions. His house is exactly as described and André keeps and maintains the property very clean. I highly recommend his place for any one looking for a place to stay in Sodermalm."
873383,47366727,2015-09-18T00:00:00.000Z,"Isabelle was a really nice host. Right from the first email she was so helpful and responsive which make booking my trip so much easier. The place is as described and its clean and spacious. Isabelle attend to any questions I have and recommended things I can do and places to eat, which was great. Overall great experience staying with Isabelle and Dan. If I ever come back to Stockholm again, I will definitely try to stay with them again."
873383,5449068,2013-07-01T00:00:00.000Z,"My stay with Isabelle was fantastic. She was a great host and a great friend. She showed me around the city and took me along to events or parties she was going to. I was in Stockholm for 6 weeks, and staying with her made me feel like I was at home. The apartment was clean and nice, and very cozy. Isabelle provided me with everything I needed. Her cats were also great company. :)

I would definitely recommend Isabelle to anyone traveling to Stockholm - you will have a great time!"
514210,91358007,2016-08-05T00:00:00.000Z,"Sono stata presso l'appartamento di Margareta per 6 giorni, tutto era preciso, pulito e la stanza addirittura più grande e accogliente che nella foto! Io e il mio ragazzo ci siamo trovati davvero bene, la nostra host è venuta a prenderci alla stazione centrale per mostrarci la strada più comoda per raggiungere la casa. La cosa in assoluto più piacevole è stata poter godersi la colazione nel terrazzo che affaccia sul verde e la passeggiata nel bosco del suo quartiere molto tranquillo. Consiglio vivamente questa esperienza!"
1170766,92526681,2016-08-09T00:00:00.000Z,"Super appart' très bien situé, propre et calme, avec une petite terrasse tres agréable. Recommande à 100% !"
1212891,14262003,2014-06-16T00:00:00.000Z,"We had a lovely time at Maud's house, the room was just as pictured with a nice view and very quiet. Maud was really helpful in providing information about Stockholm and things to do and also dug out an iron for me to sort out a creased shirt and bridesmaid dress dilemma! I would definitely recommend staying here and the gorgeous cats are a bonus :)"
299154,43772904,2015-08-22T00:00:00.000Z,"Daniel was very friendly and everything went fine during our stay in Stockholm.
The apartment is very close to Gamla Stan (Downtown) and was easy to reach by metro.
Apartment was a little bit smaller than what I thought but fit well our group (3 persons).
I would be there again!"
442837,78625878,2016-06-07T00:00:00.000Z,"Jo's apartment was an excellent option for me. The apartment itself is well kept, light and in a quiet area. Metro and bus lines are just outside the building. This made it very convenient to travel from/to the airport and to the city center. Jo's mother provided me with lots of suggestions and city secrets, witch made it easier for me to get around.
Had a good time at Jo's place and would recommend it!"
581243,4561039,2013-05-13T00:00:00.000Z,"Edwin was a pleasure to deal with, very friendly and happy to help in any way he could. The appartment is in a fantastic location, and was really a great set-up for our long weekend in Stockholm. The room was spacious and comfortable, and the amenities were very clean and well kept. I would highly recommend this appartment to anyone."
755843,523230443,2019-09-03T00:00:00.000Z,Pärs appartment is super cozy and perfectly located for discovering Stockholm. Very good and easy communication with Pär and nice welcome drink. I would definitely come back!
1212891,134634322,2017-02-28T00:00:00.000Z,"Maud's place is fantastic. She was able to let me check in even though she was out of the house. The home is clean and small, but has all that a traveler would need: towels, tea, wall adapter, kitchen, guide books, a fluffy cat, slippers (of many sizes), good wifi, good heating (I wore shorts mostly while it snowed outside), did I mention the cat? It's right near a big grocery store, right next to metro and bus stops, and above all, Maud is very kind, warm, and welcoming. I spent a lot of time sleeping off jet lag or exploring the city, but Maud is always happy to talk and give advice. I highly recommend her place."
608672,132998752,2017-02-20T00:00:00.000Z,"Excellent location, walking distance to local shop, underground, city centre. Good value for money. Clean place and everything up to standards."
688947,29528541,2015-04-08T00:00:00.000Z,"Amazing person, super clean.."
536283,440864579,2019-04-21T00:00:00.000Z,"Super séjour chez Paolo, l'appartement est très agréable à vivre, propre, calme et très bien placé, dans un super quartier. Nous avons beaucoup apprécié notre séjour à Stockholm, tout était parfait. Paolo est super réactif. Je recommande ce logement !"
1212891,428527069,2019-03-25T00:00:00.000Z,"Our stay at Mauds apartment was really nice. The room was really comfy, the city is near and Maud is a really friendly Person. We felt free and welcoming. Also the cat was cute. I liked everything."
1212891,133230981,2017-02-21T00:00:00.000Z,"Excellent place! Quiet and nice surrounding, but also well communicated with the city centre and all tourist attractions"
581243,5555232,2013-07-06T00:00:00.000Z,This is truly a five star experience. The facility is spotless.  The location was ideal.  The host was most helpful.  I would stay here again without a second thought.
748847,37045473,2015-07-04T00:00:00.000Z,"Thank you Heath for this wonderful experience!
Everything was as described. The house was clean and comfortable.
Location is perfect!"
475409,10874841,2014-03-11T00:00:00.000Z,"This apartment was clean and tidy, located in a very convenient area in Stockholm. 
Great restaurants just a short walk away with many various shops to look at.

One unexpected part of our stay was a caged bird present in the apartment at all times. We didn't have to look after it but it was a surprise."
164448,41607755,2015-08-08T00:00:00.000Z,"Lidia is a very Kind and available, a perfect host, very updated. She will give all the informations you need. Rooms are warm and wellcoming, closed to the station. Thank you,  Lidia!"
897584,234336993,2018-02-12T00:00:00.000Z,Perfect flat for a week-end for two people in Stockholm
1151217,222980416,2017-12-31T00:00:00.000Z,"Lovely, top floor duplex at edge of hip Sodermalm neighborhood. One block from T.
Apartment was clean, comfortable, and quiet. Ana was very helpful with local insights and accessible by email despite being abroad. Friendly next door neighbors were helpful in check in and out. Great base for exploring Stockholm."
974175,14261425,2014-06-16T00:00:00.000Z,"I, my Mom and Grandmother spend two nights at this lovely place. Sofie and her husband were very welcoming and helpful from the beginning. The apartment is close to the center with a lively neighborhood - but still quit.  I would recommend it to everybody!"
475409,22482504,2014-11-07T00:00:00.000Z,The reservation was canceled 53 days before arrival. This is an automated posting.
313763,28520357,2015-03-25T00:00:00.000Z,"Trevligt välkomnande vid nyckelöverlämningen. Som ex-Stockholmare
uppskattade vi områdets läge med bra utbud av butiker och restauranger."
347192,220895438,2017-12-24T00:00:00.000Z,"Great place! Very good location, in center. Matilda answer quickly. I recommend it!"
1271843,469691258,2019-06-15T00:00:00.000Z,"André was the perfect host: available to let me in, happy to get to know me briefly, ready with neighbourhood restaurant suggestions - all of which proved wonderful. He also ordered me a taxi to the airport. I recommend his place to anyone wishing to stay in Sodermalm."
