listing_id,review_id,date,comments
1096827,5381297,2013-06-27T00:00:00.000Z,"Anita's place is perfect (nice, with everything you need and well located).
Ideal place for a young couple who want to visit Stockholm.
We attended the flat late at night and she left us something to eat.
(You can imagine how nice she is !)"
1307331,9443965,2013-12-29T00:00:00.000Z,"We spend a week for Christmas there with my family, it is a very nice house well arranged and full of christmas lights! Perfect if you have children.
Nous avons passez une semaine en famille pour Noël là-bas. La maison est bien agencée et bien décorée. Parfait si vous avez des enfants avec vous.
Bref on y a passez un très bon séjour à 8 (dont 2 enfants)."
755843,62390092,2016-02-14T00:00:00.000Z,"Pär is very nice and he was very easy to get in touch with. The bus station is just downstairs. It took 7 mins by bus to the central station. The apartment is clean and comfortable. We can find everything we need. Overall, We had a great stay!"
1204621,327636609,2018-09-24T00:00:00.000Z,徒歩2分ほどのところに23時まで営業しているｽｰﾊﾟｰがあり､ﾌｪﾘｰﾀｰﾐﾅﾙ(ﾀﾘﾝｸｼﾘｱﾗｲﾝ)から徒歩10分ほどでもあり､中心街からも地下鉄で3駅なためとても便が良い場所にありました｡閑静な住宅街なため､夜中に1人で出歩いても恐怖を感じることはありませんでした｡
1265989,30658232,2015-04-26T00:00:00.000Z,The reservation was canceled 35 days before arrival. This is an automated posting.
1234109,7852360,2013-10-06T00:00:00.000Z,"I have spent 3 weeks in Nathalie's place and it was really great experience. This is a really comfortable and cozy place only 1min walk from  Fridhelmsplan tunnelbaba with fantastic neighborhood, very close to Stockholm city center. Evertything is the same as on photos. The only one small inconvenience for me was the absence of a kettle and a microwave, but on the other hand a have had a chance to improve my cooking skills =))
Nathalie was helpfull and friendly, described everything with detailes and answered all my questions. So I can recommend her for sure!
Great choice!"
819676,228860283,2018-01-21T00:00:00.000Z,"Awesome location, really sweet, friendly and helpful couple. The room is rather small but beautiful big private bathroom is something extraordinary. Nice local bar and good husmanskost in restaurant Oliver Twist next door. I highly recommend!"
242188,193838588,2017-09-15T00:00:00.000Z,Li was an excellent host- very nice and helpful. Great location next to train station- super easy to get around. Highly recommend!
283446,2484443,2012-10-02T00:00:00.000Z,"Staying at Vidhatri's apartment was great ! The family is very friendly and helpful for all kind of matters. The bedroom is spacious and equipped with a good bed, lots of wardrobe space and a desk (w/ Wifi). We chose indian breakfast, and did not regret it : we had different kinds of indian pancakes every morning, which were all very good ! We also ate at home one night : Vidhatri and her daughter Jessica teamed up to make this dinner a very enjoyable moment - both with food and conversation. We recommend staying at Vidhatri's home if you want to spend a few days in Stockholm, and we will do again if we come back."
299154,177236526,2017-08-02T00:00:00.000Z,"The location in Sodermalm is absolutely perfect. If you are going to walk the city, this is a great jumping off point with nothing being too far away. Also, Sodermalm is a great place to go out at night and people watch/have a drink. Thoroughly enjoyed our stay."
1182616,70690477,2016-04-19T00:00:00.000Z,"Peter was very nice and although we were not able to meet him in person, he was very attentive and responsive to all of our messages. The place is not far from the center of Stockholm, and actually is quite nice to walk along the water to the historic center. Area itself is clean and pleasant, and all and all, we had a great time here."
514133,45549738,2015-09-04T00:00:00.000Z,"Diese Unterkunft kann ich in allen Punkten weiterempfehlen! Von Ankunft bis Abreise hat alles wie geplant funktioniert, die Gastgeberin war darüber hinaus sehr hilfsbereit und hat zu jederzeit auf Fragen geantwortet und gerne auch Tipps gegeben. In der Wohnzng selbst fühlt man sich sehr wohl. Die Lage ist optimal: sehr zentral und dennoch schön ruhig an einem Park gelegen. Die nächste Tunnelbana ist in nur 5 Min zu Fuß erreichbar. Sehr positiv war zudem die gute Wohnungsausstattung."
1261445,148657520,2017-05-01T00:00:00.000Z,"We had a lovely few days in Stockholm, marie-louise's flat is ideally located a couple of minutes walk from local transport. There are a few restaurants walking distance from the flat, just be aware that some only accept card payments, no cash allowed! Her flat was comfortable and ideal for our stay."
1170766,90686085,2016-08-01T00:00:00.000Z,Excellente expérience! On se sent vraiment chez soi. L'emplacement est tout proche d'une bouche de metro et le quartier est calme. Je recommande ce logement.
757320,176554280,2017-07-31T00:00:00.000Z,"Barb's communication was excellent with us. She always responded quickly and informed me of important things.
Her place is convenient to all transportation and very safe . The flat was clean and comfy just like the pictures on Airbnb.
There are many good restaurants and pubs close-by. Shopping was great too! 
There is a beautiful park Mariatoget near which is nice to stroll at night.
All tourist activities were easy to get to from Sodermalm location by walking, metro, bus or bike.
 City bike rental at park across street too. it was expensive to take taxi fro Arlanda airport, best to take metro or bus."
299154,44898196,2015-08-30T00:00:00.000Z,"Excellent. Clean, comfortable, great location"
757320,4812549,2013-05-27T00:00:00.000Z,"Location of the room is perfect for exploring the city either by walking or using public transport. Room is good size and very clean and bright.
Bathroom is just opposite the room and is clean with towels provided.
Check in and check out is flexible which we found very useful.

It was a great stay.
Milena and Raf"
1158893,184562489,2017-08-20T00:00:00.000Z,"Una bella casa, molto curata, in un quartiere tranquillo. Comoda la posizione, vicina alla metropolitana e alle autostrade. Siamo stati accolti benissimo. La consiglio!"
283446,38834296,2015-07-19T00:00:00.000Z,"We felt completely at home staying with Vidhatri and Bala. Immediately on arrival we were welcomed with warm fresh Indian food. They took personal care to guide us on how to move around in the city. We were given timely advice on buying travel pass and perfect directions to reach home. Their house is well located, right near the train station. Their hospitality was great. We would always recommend staying with them."
974175,10533106,2014-02-24T00:00:00.000Z,"I stayed in Sofie’s apartment with 3 friends for a long weekend. The apartment was just perfect: it’s completely like the picture, it’s very spacious and well decorated and you can find everything you need during your stay. The apartment is 15 minutes’ walk from the center of Stockholm, so it’ very convenient! There is also a subway 3-4 minutes’ walk from the apartment, many restaurants and a supermarket close to the apartment. I would definitely recommend this place!"
845365,33623264,2015-05-30T00:00:00.000Z,"Had a great stay with Michael! The room and apartment are comfortable and cozy. A few minute walk from the train station. Michael was very nice, helpful, and easy to talk to! Not mention an overall cool guy. :)"
897584,4134419,2013-04-13T00:00:00.000Z,"We had a very nice residence in Stockholm.

Viveka picked us up at the metro station and accompany us to her home.

Her home is very nice furnished, cozy and clean.

We enjoyed our stay there. Thank you Viveka!"
1304431,32450499,2015-05-18T00:00:00.000Z,"We've had a good time in the smartly designed and light apartment in Södermalm. The location is close to a park and the water and we enjoyed all the amenities we needed for our stay very close by. The apartment is within a few minutes walk to the subway, from there the entire city is well accessible. 
Madeleine made sure we could check-in when we arrived right from the airport and was very caring. The apartment provides all the necessities for our four day stay with five people, it was very tidy."
1158791,497116915,2019-07-28T00:00:00.000Z,Great apartment! We will come back!!
700113,46631434,2015-09-12T00:00:00.000Z,"I had a great time at Ilona's, she was very welcoming and helpful. The apartment was clean and pleasant, well furnished with a nice balcony with flowers, close to a metro stop, shops and a park."
164448,129774234,2017-02-02T00:00:00.000Z,Great place and a very nice hostess
259025,1592281,2012-06-30T00:00:00.000Z,"Our stay at Ali's place was wonderful!  Ali made sure we arrived safely and was very attentive to our needs.  Thank you, Ali !  The whole house was very cleaned and organized.  Our room was just perfect!  
Very close to the train station which is a plus, however, the time that we were there the train route to the Stockholm central station was closed for construction, so it took us a bit more time to get to where we wanted to go, but it was no problem at all.  Overall, it was a pleasure to stay at Alli's place and we definitely recommend this to other guests.  Stockholm, love!!"
1115790,520832403,2019-08-31T00:00:00.000Z,"At Fatima, you feel like a friend, not a guest. I enjoyed it deeply!"
1251466,41301610,2015-08-05T00:00:00.000Z,"We stayed with Dean for one night with very last minute notice (only a few hours!).  He was quick to respond and even came and picked us up from the train station (very late at night, even though he had work) after providing very good directions.  He was a very gracious host and ensured that we were well taken care of.  The room was wonderful - VERY comfy bed with lots of room!  Dean also let us leave our bags at his place for the day and come back later to pick them up.

Thank you for a wonderful time, Dean!"
1124388,437892102,2019-04-15T00:00:00.000Z,"Carl m'a envoyé un mail avant l'arrivée avec toutes les informations nécessaires pour bien arriver à l'appartement (bus et lignes conseillées, une carte avec l'indication précise de l'appartement et les divers codes d'accès et lieux importants dans les alentours). Ils nous a accueilli à notre arrivée et soigné la propreté de l'appartement. Plein de bonnes informations et bonnes adresses, il nous a même envoyé un message pour nous informer d'un marché particulier qui avait lieu pendant notre séjour. Vraiment une personne attentionné et disponible.
L'appartement est conforme à la description, lumineux et fourni de tout le nécessaire. Une ferry juste à deux pas de l'appartement emmene jusqu'à la mairie, à côté de Gamla Stan, Carl a contacté les transports publics pour nous donner les horaires exactes du bateau, vraiment un geste très attentionné !
Nous les conseillons vraiment !"
1035775,18419253,2014-08-26T00:00:00.000Z,"We stayed at Magnus flat for 4 nights. Magnus was a helpful and friendly host. His flat is clean, well-equipped and attractive. Upon arrival he recommended some good places to go. The size of the bed was fine for us but it would be small for a larger couple. We had a good time in Stockholm and Mangus' place. Highly recommended."
1170766,451628458,2019-05-12T00:00:00.000Z,"We stayed for a week at Annika’s apartment and it was absolutely perfect! The studio is big enough for two people, the bed is really comfortable and the kitchen was well equipped! The location couldn’t be better. The subway is 3-5 min walk away and there are plenty of supermarkets in the area. Annika was more than happy to help us with everything that came up.  LI recommend her place for everyone who wants to have a pleasant stay in Stockholm!"
819676,330882091,2018-10-01T00:00:00.000Z,I really enjoyed staying at Andy's and Vannie's place; both the place and the hosts were great. We had a nice chat and I got awesome recommendations for food places.
1212891,161471373,2017-06-18T00:00:00.000Z,"Conveniently located, close to metro station, the room is small but comfortable - we just went there back to sleep as the weather was beautiful and the day was so long. I recommend this place to those who want to spend in Stockholm a nice long weekend. Supermarket is very close, open until 22.00 so you can buy your food for breakfast or dinner if you care for budget holidays."
164448,297275796,2018-07-27T00:00:00.000Z,"I really enjoyed this yoga class. It was in the perfect location, I was able to see the skyline of the city and we were right next to the river. Solveig was super nice, I really enjoyed her as a yoga instructor. After the class she shared with us a travel guide of the best places to go in Frankfurt and gave us coconut water so enjoy after the class. I will definitely go back to her class. If you are visiting or new to the city I definitely recommend this class."
1251466,526652538,2019-09-09T00:00:00.000Z,"Dean was very kind and accommodating. I had a nice stay. The location is very close to the train which made it really easy to get into the city, and it is across from a great park/nature reserve. I jogged around the lake there most mornings which was really nice. The apartment itself is in a slightly different location than what is listed here, so be sure to communicate with Dean about how to get there. It is very similar to the photos, but with different furniture. It was not as clean as I would have expected, but it was ok, and definitely worth the price in Stockholm. Thanks Dean!"
647314,29611113,2015-04-10T00:00:00.000Z,It is a quite nice and quiet room with quite good location which is very near from Metro and only 15 mins walk from old town. Mallika is a very kind and helpful host with a little lovely cat named Ramses
776155,21539507,2014-10-19T00:00:00.000Z,Ann Sofie was a wonderful host. The place was exactly as pictured. She welcomed me with a basket full of breakfast food after asking why I would like. I felt completely at home in her apartment. The location was wonderful and convenient. It was really the perfect stay.
1231897,522446357,2019-09-02T00:00:00.000Z,Persona gentile e disponibile.  Ospitalità buona. Alloggio comodo e silenzioso. Buona la condivisione della stanza da bagno ma può migliorare quella della cucina per la colazione
514210,55343494,2015-12-01T00:00:00.000Z,"I stayed in Margareta place for 3 months. It was such a great stay there. The house is exactly the same as the photos shown and the room is really spacious and cozy, the balcony is full of flowers, decorated beautifully. Margareta arranged the cleaning for every two weeks to keep the room and the private toilet clean. The two kids are really kind and every time when I ask them for help, they are always willing to help. It takes like 25-30 mins to the city centre with transport of bus + metro. One thing concerns me is the bus sometimes runs only two times every hour on Sunday. So that it is  really important to check the schedule carefully. But that is only on Sunday. From Monday to Friday, every morning I go to work, the bus runs so frequently in the peak hour (ard 7-9 am). Overall, it is a really good place to stay! I definitely recommend this house."
1124388,7516403,2013-09-23T00:00:00.000Z,"Carl's place was great for us three chaps visiting Stockholm for a few days. Nice furnishings, quiet at night, wifi, books to read on every subject, and foods for breakfast. Thanks Carl!"
1139359,171276629,2017-07-17T00:00:00.000Z,"Spacious, lovely apartment in a great part of Stockholm. We walked to the subway or train station everyday. The bus stops were also very handy. Groceries, restaurants and shops were all right there.  You are in a city and there can be noise in the evening from people on the street who have been out to bars. That didn't bother us, but some might not like it. There is no bath soap, shampoo or hair dryer, so bring your own. You will really enjoy having such a large, well decorated flat with big, modern bathrooms. We had a great stay!"
819676,279965735,2018-06-22T00:00:00.000Z,"Awesome hospitality, great space, and convenient area!!!"
478105,22316387,2014-11-03T00:00:00.000Z,"Christian is such a nice host! He gave us a really pleasant introduction to Stockholm by providing lots of tips, responding quickly and sharing his awesome apartment :)

The apartment is spacious and clean. Public transport is a nice walk trough the park. The shower is nice and clean. The bed is really good and big (1.80x2.00). Wifi works fine and the computers in the apartment are a nice addition for looking up information. The massage chair is a blessing after a day of discovering the city.

We recommend:
- the food view and expo's at fotografisk,
- The burgers at vigårda,
- All the food at the Hötorgshallen,
- Gamla Stan, Pizza Hatt, and in Gamla Stan is an overprized café, schweizer konditori, where you should try the sandwichpie or smörgåstårtoar."
581243,7069551,2013-09-05T00:00:00.000Z,"Amazingly clean apartment with beautifully landscaped courtyard for residents of the apartment complex only. Edwin was very accommodating. He wants to make sure that you have anything that you reasonably can. He made the kitchen available to us and gave us very helpful directions. He had maps available as well. Always very prompt to respond to airbnb messages with helpful advice as well. 

Protip: In Stockholm, you can't buy wine (or any alcohol) after 7 pm unless you're at a bar. Before 7 you can only buy it from the state run liquor store: Systembolaget."
723539,83355486,2016-07-02T00:00:00.000Z,The apartment was perfect! It is in a great location and was clean and comfortable - everything I could have hoped for! I would highly recommend Mathias' apartment for your next trip to Stockholm.
700113,62060635,2016-02-11T00:00:00.000Z,"Very friendly reception. The fridge was already filled. Very quiet home. Nearby is everything you need: supermarket, restaurant, coffee etc. Located very centrally! I was three days there for an Budotraining and had an wonderful relaxation during breaks."
776012,183111267,2017-08-16T00:00:00.000Z,"L'appartement est très agréable, confortable et calme. Il est excellemment situé dans une rue tranquille près de Stortoget. Il a du cachet, tout comme l'immeuble dans lequel il est situé. Il est au quatrième étage sans ascenseur, c'est à considérer pour les personnes d'une santé fragile. L'appartement est un vrai logement occupé par sa propriétaire une bonne partie de l'année, c'est un point positif supplémentaire."
646635,116607116,2016-12-02T00:00:00.000Z,"Kristina's place was fabulous. She was a perfect host and made me feel very much at home during my short stay. We had some lovely chats, despite my busy schedule. Nothing was too much of a problem and I certainly will return in future. Highly recommended. And she made me some homemade soap too! Lovely smell!!"
819676,163016718,2017-06-23T00:00:00.000Z,"Vannie and Andy's place was perfect ! The room was clean and private, as was the bathroom which I had all to myself. It was super close to a subway stop that got me every where and there was primo shopping and restaurants right around the corner. Would definitely recommend !"
1054406,245667969,2018-03-23T00:00:00.000Z,"Het appartement van Thomas betreft de onderste verdieping van zijn huis. Het is een mooie locatie met eigen ingang in een rustige woonwijk. Een auto is aan te bevelen, hoewel de bushalte circa 5 minuten lopen van het appartement verwijderd is. Er zijn 2 slaapkamers; slapen in de huiskamer kan ook. Thomas heeft nog 2 extra opklapbedden. 
Voor ons was het een prima locatie (verbleven met 4 collega's voor een beurs)"
301680,1672282,2012-07-09T00:00:00.000Z,"Anita had a full house but organised our stay with her friend Bertil.  His new, modern  free standing house in a garden setting in a peaceful neighbourhood with  woodland area not far from a lake was a lovely place to stay. Amenities were very good, breakfast provided at an extra charge - good coffee. Bertil was helpful with information about exploring Stockholm and the surrounding area and discussing life in Sweden."
822497,4596811,2013-05-14T00:00:00.000Z,"Me and my friends had exellent stay in this wonderful apartment where everything is made with love. It makes us feel like at home during our stay. Moa is a great host. We had feeling that we are staying at friend's apartment. She met us at metro station (which is really close to apartment), she bought the breakfast for us, she was flexible with check-out. Definitely reccommended! This apartment will have highest priority to stay for my further visits to Stockholm."
242188,421969788,2019-03-10T00:00:00.000Z,Very clean and nice.
1119738,367571260,2019-01-05T00:00:00.000Z,與房東同住 比較不好意思 打擾了
647314,45002757,2015-08-30T00:00:00.000Z,"The Bedroom was exactly that nice and tastefully like in the picture and I felt very comfortable there. It`s been absolutely clean and I got all the comfort, like fresh towels.
The flat is situated in a great surrounding with trendy coffees and shops. The metro and the city-center are near and easy to reach.
I met Mallika Giarimi and she is a very friendly and helpful host. 
There is absolutely no doubt: I would stay there again!!!"
299154,18902709,2014-09-02T00:00:00.000Z,The apartment was good located. Close to the metrostation Slussen. Daniel was really helpful. We didn't meet him but he indicated everything  very good. It was easy to communicate with him. The flat was clean and it's a cosy place.
536691,147392912,2017-04-26T00:00:00.000Z,The host canceled this reservation 39 days before arrival. This is an automated posting.
1304431,283556956,2018-06-30T00:00:00.000Z,Location was great!  Lovely apartment.   My family had a wonderful stay.
1204621,342636768,2018-10-29T00:00:00.000Z,Nettan was very helpful with everything I had questions or needed help with. Her place is very calm and quiet which was perfect for my preference.
1054406,83691237,2016-07-04T00:00:00.000Z,"A wonderful apartment under Thomas and Madelyn's house. It had everything we needed, including a jacuzzi type bath tub that the kids loved. Although quite far out of town, the transport links are excellent, taking about 35 mins to reach central station. Be sure to get a preloaded SL ttansport card before you arrive at the house, or install the SL app and get a prepaid data SIM. The coop at Fruängen is reasonably priced and has everything. The hosts went out of their way to accommodate us, and we could not ask for more. Also, nice lamp shades."
916806,266657693,2018-05-20T00:00:00.000Z,A lovely quiet apartment which was exactly as described. Very easy to get to from the subway and an easy journey into central Stockholm. Very close to beautiful walks and a lovely little beach. Very comfortable bed and so peaceful. The instructions were clear and easy to follow. Would definitely return.
904739,20253074,2014-09-26T00:00:00.000Z,Menaf was very friendly and responded to emails and text quickly. The apartment was very clean and comfortable size. Nice neighborhood with some cool cafes nearby. Train station and shops close by too. Menaf made himself available for assistance when I was staying. Enjoyed his apartment.
1153177,18254976,2014-08-24T00:00:00.000Z,"Terry was exceptionally responsive throughout the entire process. 
This apartment is in a great area, near a park, near a subway stop, near the city center. It's a very convenient location for a family visiting Stockholm. 
The apartment is very charming and accurate to the description. The apartment, and especially the kitchen, is equipped with everything you need."
873383,4440466,2013-05-05T00:00:00.000Z,"The room is really nice - quiet, clean, warm.
You have all you need - bed, breakfast, towels and bathroom. Also, wi-fi.

Isabelle gave clear directions to the house, showed to me everything I need, we chatted in the evening a bit )

It will take you 45 minutes to get from the Arlanda Airport by bus to T-Centralen and then to Isabelle's house by metro. 
From the centre of Stokholm this is 20 minutes by metro. 

A nice place to stay if you find the altrenative to the expensive Sweden hotels and crowded hostels)."
283446,36266257,2015-06-27T00:00:00.000Z,"I could not have asked for more considerate hosts than Vida trip and her family. Both she and her husband came by train and bus to the airport because the knew I was having some mobility problems and that was only the beginning. Vida try introduced me to South Indian cuisine, delicious.She accompanied  me to lovely gardens.

Both her and her husband were so generous, 
in so many ways. Vida trip is a teacher and taught me a lot about Swedish customs. 

It was an absolutely wonderful experience living with Vida trip and the rest of her family.

On the practical side, it is easy to get to their
home which is in a wonderful area. 

The room is adequate and the bed very comfortable."
581243,112698173,2016-11-07T00:00:00.000Z,Edwin was súper nice the room is clean And the location awesome
274876,13729531,2014-06-03T00:00:00.000Z,"Lovely light, bright and airy apartment in great part of the city. 

Emma was a great host - only too happy to help with recommendations and leaving a great pile of information regarding things to do and places to go. Check in and out were easy and convenient, and communication was always timely.

Overall, a fantastic stay in a great apartment. Clean, comfortable, quiet and very relaxing stay. We will be back."
299154,42286315,2015-08-12T00:00:00.000Z,Great location for our short stay in Stockholm. We enjoyed the neighborhood restaurants and the proximity to Gamla Stan and other attractions.
