listing_id,review_id,date,comments
757320,509859116,2019-08-15T00:00:00.000Z,Barb is a very enthousiast host!
206221,448606338,2019-05-05T00:00:00.000Z,"Le séjour chez Elisabeth était très agréable. Nous avons apprécié partager quelques moments d'échanges avec elle. C'est une personne passionnante et généreuse.
La chambre était impeccable et le logement très bien situé. Une maison pleine de charme !
Je recommande vivement"
581243,79638765,2016-06-13T00:00:00.000Z,"I only stayed one night, but it was a very nice home away from home. It was a tiny bit confusing to get in at first, but everything else was smooth. I would be happy to stay here again."
242188,51713606,2015-10-24T00:00:00.000Z,"Lidia is a most welcoming host, full of useful and interesting information about things to see round Stockholm. The accomodation is as described, comfortable, warm, very practical. The situation is perfect for visiting Gamla Stan and the surrounding areas, everything is within walking distance, and for those who prefer public transfer, the train station and bus stations are just round the corner. Also most appreciable is the free wifi connection, kettle, tea, coffee, fridge and microwave."
1048668,505350172,2019-08-09T00:00:00.000Z,"Melissa's apartment is very cosy, nicely situated in a quiet neighbourhood yet super close to the center of Stockholm. I recommend!"
299154,81384260,2016-06-22T00:00:00.000Z,"Daniel's apartment is in a great location in Södermalm within an easy walk to Gamla Stan and quick subway travel to Central Stockholm. Daniel's Södermalm neighborhood also has lots to see and do, and his guidebook is very helpful in identifying parks, grocery stores and restaurants in the immediate vicinity. 

Daniel's is apartment is very compact, as he accurately describes, but it works perfectly. We fit three people on the two beds comfortably and still had room to maneuver around the small studio apartment. 

Daniel was also a great host, providing clear communication and prompt responses to our questions. Although we did not get to meet him directly, he was very accommodating with our arrival schedule, and we found the information he provided online and in the apartment very helpful.

Thanks for a wonderful stay in Stockholm!"
164448,339169565,2018-10-21T00:00:00.000Z,"Lidia is an excellent host. She was really nice and gave us a lot of useful information. It's very easy to comunicate with her.
The appartement is well located, near the commuter rail and metro. The bedroom was comfortable and clean. Highly recommend !"
1248490,10836342,2014-03-10T00:00:00.000Z,"Maria has a beautiful apartment perfectly located in Stockholm. Maria was an excellent host, very nice and helpful. Thanks!"
1170027,26267206,2015-02-08T00:00:00.000Z,"Jeg har kun roser at sige om Diana's lejlighed. Jeg kom fra Danmark og landede først i lejligheden kl 2 om natten hvor Diana og en veninde tålmodigt havde ventet på mig i timevis. De havde guidet mig gennem nattens snefaldet gader over telefonen. Selvom jeg var så sent på den var Diana sød og imødekommende.
Oveni havde hun købt brød, kaffe, juice mm. så jag havde lidt til om morgenen når jeg vågnede. Lejligheden var ren og lækker, en hyggelig lejlighed, der kunne rumme 3 mennesker uden problemer.
Næste gang jeg skal til Stockholm ved jeg hvor jeg skal bo"
755843,120890469,2016-12-12T00:00:00.000Z,"Perfect position near the centre, bus stops, underground, several nice restaurants."
700113,77709319,2016-06-03T00:00:00.000Z,"Convenient location, everything that was needed was provided in the flat and Illona was very nice. Thank you!"
313763,36327237,2015-06-27T00:00:00.000Z,"Martin was great, very kind, helpful, and responsive. The apartment was centrally located and just like the pictures. Would stay again!"
875505,210055139,2017-11-07T00:00:00.000Z,"Apartment in great location for all the central attractions, serves well for 1-2 persons on a short visit to Stockholm, looking to explore the restaurants, shopping and nightlife in the city!"
954832,15137091,2014-07-03T00:00:00.000Z,"Nous avons apprécié l'accueil de Mikael qui a pris son temps pour nous présenter le logement, l'environnement et répondre à nos questions sur la ville de Stockholm.
L'appartement est bien situé, fonctionnel mais petit , il faudrait préciser dans le descriptif la surface; une télévision serait un plus !"
299154,28213237,2015-03-20T00:00:00.000Z,Daniel is a wonderful and very helpful host. The apartment was convenient for my meetings and in a quiet neighbourhood. Thank you for your hospitality Daniel
1231897,197630582,2017-09-26T00:00:00.000Z,"Perfect place to stay, welcoming and warm host and good connected with the city center by the underground."
916806,107643886,2016-10-11T00:00:00.000Z,"Bel appartement, très bien entretenu et confortable. Tout a bien été pensé , nous avons senti que nos hôtes sont soigneux et attentionnés. Le métro est à 10 bonnes minutes de marche, ainsi que les commerces. Il y a également de belles ballades à faire à pied dans le quartier."
1204621,196210804,2017-09-22T00:00:00.000Z,"Nettan was a great host. She texted me all the way I needed to do from the central station to go to her flat, which was really helpful.
She friendly welcomed me, tired as I was, and explained me where everything was at her flat and in the neighborhood. 
Her flat is three stations away from the central station, in a really quiet area close to the tube and the sea.
We had the chance to talk, even if both of us were quite busy, and it was great to know more about her.
Great first experience, thanks again !"
1182616,19763813,2014-09-17T00:00:00.000Z,"In an elegant and raised apartment; the host provided us with towels."
299154,19113617,2014-09-06T00:00:00.000Z,"My friend and I stayed at Daniel's place for one night and we found it very accommodating. We were drawn by the neighborhood and we truly enjoyed being there - it was so close to several train stations, shopping, trendy restaurants and boutiques. This was a no-frills place and we would definitely stay again."
242188,530871817,2019-09-16T00:00:00.000Z,Li... Is wonderful! You couldn't ask for a better host and a very thoughtful person. I would advise anyone to stay at her place and you will not be disappointed!
700113,17670528,2014-08-16T00:00:00.000Z,"I've been here for 15 days, in august 2014.
The apartment is as you can see in the photos: quite small but nice and clean.  From the balcony you have a nice view of the park. 
The apartment is in the city center, near to the subway stations and food shops.
Ilona is very kind: she invited me to a party with neighbours and she also washed my clothes for me.
Solution ok for 1-2 persons for short stays."
1128990,17641484,2014-08-15T00:00:00.000Z,"Anette has a nice apartment with a good location in the \"Sofo\" neighborhood of Stockholm. The area has great restaurants, with designer shops spread out in the neighboring blocks. It's pleasant, mostly quiet and 10 minutes from Gamlastan, the historical center. Anette was helpful with the check-in time and left us some basic provisions which were useful. The apartment has good light and accommodates 4 people (sharing one bathroom). The shortfalls for us were the lack of a washing machine (the laundry service outside was pricey), that it's a bit cluttered and, while in general it was fine, the flat needs a deep cleaning. Otherwise the flat is spacious and its located in a nice neighborhood of Stockholm."
299154,146879857,2017-04-24T00:00:00.000Z,"Daniel's place was just perfect for my stay. Daniel was warm and welcoming, and worked with my odd schedule for check-in. His recommendations were spot on. The location couldn't be better- two minute walk to subway, lots of cafes, shops, restaurants, and bars nearby. The apartment is charming, and the balcony space was perfect for morning coffee. I would love to stay here again on my next visit."
283446,2709526,2012-10-24T00:00:00.000Z,"The hosts made me feel right at home when I visited Stockholm. They came all the way to the port to pick me up when I got to Stockholm, and escorted me all the way to the airport when I had to leave. They let me use their bus/subway pass at a discounted price, and they cooked delicious and authentic Indian meals for me. The bed was super comfortable... (The first thing I did when I got to their home was take a nap.) They treated me like family, and they even planned out a schedule for me with a list of the places I should visit during my short stay in Stockholm. They also have a teenage daughter who is very friendly and knowledgeable of the top places to visit in Stockholm. I really enjoyed my stay at this place. Thank you so much!"
1248490,271704009,2018-06-02T00:00:00.000Z,"You will be pleased with the apartment, very high end.  Maria was awesome too!"
1124388,275923625,2018-06-12T00:00:00.000Z,A value place to stay in Stockholm.
164448,5844864,2013-07-19T00:00:00.000Z,"Lidia was a wonderful host,the direction given to us on how to get to her place from the airport was precise and just easy.I given her top credit to show us how easy to find her place.
She was expecting our arrival in the afternoon and treated us high tea while sharing her tips how to go about Stockholm.I would not hesitate to come again.Highly recommended .The location is good too,only 20mins walk to old town through busy street."
274876,526605643,2019-09-09T00:00:00.000Z,"Emma was an excellent host, very helpful and thoughtful. Lovely apartment ideal for our family of 5 adults.
Easy access by bus to central Stockholm, nice local bars and restaurants."
575371,181617952,2017-08-13T00:00:00.000Z,Both Tomas and his wife were nice!! I def recommend it!!
1307331,165773313,2017-07-02T00:00:00.000Z,"We are very happy to stay at Marcus's home. Close to the metro and close to  the center of Stockholm. Quiet and nice  place to stay in a group of friends. Breakfast on the terrace, in the sun, evenings in the large living room. We had a riddle - who would guess how the shower in the upper bathroom would run? Simple ! But surprising solution! Just move the faucet right! The winner had priority in the bathroom. But it was not embarrassing, because the bathrooms are two. Marcus very accurately described everything, left instructions. Thank you very much, best regards! We recommend!"
608672,20957078,2014-10-08T00:00:00.000Z,"Chambre avec un petit coin cuisine, centrale  et très calme.
Karl est très sympathique et parle français. Ces quelques recommandations sur les lieux à visiter se sont toutes révélées excellentes."
763407,10463338,2014-02-20T00:00:00.000Z,"Wonderful stay! The appartment is perfect, it's so nice to rent a place which is clean, so comfortable and with a nice interior! Located in Odenplan and only few steps away to supermarket, restaurants and bus/metro station (3 stops only from Stureplan by bus or from T-Centralen by metro). 
Communication was perfect with Gabriella, she is well organized and careful, she gave us all information needed for our stay.
Don't hesitate, book here!"
164448,333410794,2018-10-07T00:00:00.000Z,"Li was an absolutely outstanding host, going above and beyond to help us and guide us in our travels, just world class service all around. The place was as advertised, clean, secure with all the amenities listed. Would recommend for anyone."
819676,514519445,2019-08-21T00:00:00.000Z,As a solo female traveler I felt completely comfortable. The apartment is exactly as pictured and super clean. Thanks again!
299154,102167833,2016-09-17T00:00:00.000Z,"Quartier : meilleur emplacement possible pour visiter la ville, quartier avec plein de bar et restaurant + tres tres calme. A 10 minutes à pied de Gamla Stan et proche pour tout le reste.
Acceuil : Comme convenu et à l'heure prevue.
Appartement, pas tres grand mais tellement bien situé !"
556363,265781943,2018-05-18T00:00:00.000Z,Lennard is a welcoming host easy to communicate. His apt is amazing and everything is close by. Top address in Stockholm.
1048260,444697691,2019-04-28T00:00:00.000Z,"Annika’s flat is as lovely as the description. It is well located, a few minutes from the green line (metro) bringing you a few stops away to the key attractions of Stockholm making it a great spot."
819676,80287053,2016-06-17T00:00:00.000Z,"This was a wonderfully located place to stay at. Very close to absolutely everything, and being a fan of walking I enjoyed this a lot. As I arrived pretty early in the morning they kept me posted if I could check in early (which to my luck I could) and also were super nice to offer the possibility of breakfast at 4 AM.

I do recommend it :)"
475409,1312065,2012-05-20T00:00:00.000Z,A really nice flat in a lovely place of Stockholm !
1170766,17960806,2014-08-19T00:00:00.000Z,"Annika's studio is great! Firstly,
it's well located, you can reach everything by foot and enjoy scenic routes. (Plus, just down the road is the best ice cream parlour in Stockholm!)

Secondly, the apartment itself has all you need for a couple of days and you won't need to turn on the light since the many windows allow it being naturally lit. Annika was there when I arrived and explained everything to me. She's got plenty of maps in the apartment and was happy to point out good places for swimming etc. 

I greatly enjoyed my stay and will try to stay at Annika's when I come back to Stockholm!"
1182616,59346853,2016-01-09T00:00:00.000Z,"It's very good house,clean,warm and comfortable. It's convenience,easy to the central station."
1124388,11868174,2014-04-17T00:00:00.000Z,Comfortable environment and convenient transportation.. great stay!
1124388,408696530,2019-02-05T00:00:00.000Z,"Nice apartment as described, on a small island just west of Gamla stan. Carl ist a great host and provided us with very helpful information on how to get there from the airport and on things to do in town. Thanks again, Carl, we'll surely bei back :) Sylke"
647314,58045446,2015-12-31T00:00:00.000Z,"My mom and I really enjoyed our short wintery stay in Stockholm at Malika's apartment. We didn't get to meet her, but Malika was always ready to answer any questions via email.  
We absolutely love what she did with the place; it's comfortable, very nicely decorated and homely. Furthermore, set in the vibrant Södermalm district of central Stockholm, the apartment is excellently located. Especially if you are looking for a place close to small, inviting boutiques, which focus on design and vintage, and good value places to eat that the locals themselves would frequent.
We will highly recommend it to our family & friends, and we are already looking forward to staying here again!"
819676,323901404,2018-09-16T00:00:00.000Z,Great location and great local tips from Andy. Excellent and easy communication.
299154,71657734,2016-04-27T00:00:00.000Z,"Daniel's cozy apartment is located in a perfect location in the heart of Stockholm, I really appreciated his service and every exact detail and information that he had given to me. I truly recommend his apartment and i hope that I will have a chance to stay in his apartment again in the future!"
1231897,46059873,2015-09-07T00:00:00.000Z,"Our time at Alex flat was our first airbnb experience and I have to stay, he set the bar pretty high for any future bookings.

Alex was the perfect host, we even went out together one night, which was pretty cool. He gave us some good tips how to get around in Stockholm and what to see.

As you might noticed, i'm no man of many (Website hidden by Airbnb) i'm going to make this as short as possible:

If we are going to visit Stockholm again, we would definitely stay at Alex's flat again."
1170766,20162676,2014-09-24T00:00:00.000Z,"Für uns war die Lage der Wohnung sehr günstig: nur 2 oder 3 Stationen mit T-Bana zum Zentrum, zu Fuß nach Gamla Stan 15 - 20 Minuten und Station Mariatorget nur 10 Minuten entfernt. In der Nähe von Mariatorget mehrere Restaurants / Konditoreien für den kleinen Hunger. Die Wohnung war sehr ruhig und für unsere Bedürfnisse gut ausgestattet. Aufstieg und Abstieg mit Gepäck über die Trepppe (kein Lift) wäre für uns \"golden agers\" schwierig gewesen, aber Annika ließ es sich nicht nehmen, die Koffer selbst zu tragen. Der freundliche Empfang und die Fürsorge während des Aufenthaltes waren vorbildlich."
819676,91434971,2016-08-05T00:00:00.000Z,"appartement très pratique. Pleins de petites attentions à l'arrivée: serviettes de toilettes fournies, bouilloire dans la chambre avec thé et café à disposition, un étage réservé dans le frigo avec de quoi faire un petit-déjeuner. Idéal pour une personne seule (chambre un peu petite). Vannie travaille à la maison et donc toujours présente ce qui est pratique en cas de question."
1212891,227528172,2018-01-15T00:00:00.000Z,"Nice place, close to public transport, convienient for a tourist visiting Stockholm. Maud was very helpful and flexible regards our arrival and departure time, very friendly and kind. The house is fully equipped and the cat is friendly and used to people. Excellent choice and definetely worth it."
763407,16818038,2014-08-03T00:00:00.000Z,"The Cozy flat rented by Gabriella is a lovely place which we enjoyed very much. 
When back in Stockholm we will choose it again."
1248490,10265434,2014-02-10T00:00:00.000Z,"We had an wonderful time in Maria's apartment. The flat was absolutely gorgeous and very clean and tidy, and Maria was the perfect host. We will definitely be returning soon!"
1153177,479712474,2019-07-01T00:00:00.000Z,Perfect location and a helpful host
608672,42387292,2015-08-13T00:00:00.000Z,"Appartement fonctionnel et bien situé au centre de stockholm (15 minutes du centre ville). Karl nous a très bien acceuillis et conseillé sur les lieux à visiter.
-------------------------------------------------------------------------------------
Functional and well located apartment in central Stockholm (15 minutes from downtown). Karl was very well accomodated and advised us on places to visit."
628555,205931293,2017-10-23T00:00:00.000Z,Beautiful home- cosy and good access to transport. Would stay here again for sure!
438129,33642268,2015-05-31T00:00:00.000Z,"Eva var en väldigt trevlig värd som var snäll och omtänksam. Boendet var trevligt också. 

Rummet var mycket litet, men tillräckligt stort för att göra studier med ett bra skrivbord och en bekväm stol. Något som bör tänkas på dock för andra resenärer som t.ex. behöver arbetsro är att barnen i huset ibland kan vara högljudda (även om de är jättesnälla). Rummet har heller inte några fönster (vilket ses på bilderna), vilket bör uppmärksammas för den som vill se dagsljus ofta. För min del fungerade det dock bra eftersom jag ändå kom hem under kvällen oftast när det var mörkt ute. Sängen var bekväm och man sov gott i rummet.

Huset ligger inom bra avstånd till tunnelbanan och billigare mataffärer nära Hagsätra centrum.

Boendet rekommenderas till den som vill ha ett boende inom fungerande pendlingsavstånd till Stockholm centrum, en trevlig värd och ett stort skrivbord för arbete (men med beaktande av att det finns barn i huset)."
723539,486845097,2019-07-13T00:00:00.000Z,"We had a perfect stay at Mathias‘ appartment. The location is fantastic, right in the middle of the lovely Östermalm neighbourhood. Many restaurants, bars and important sights are within walking distance (Gamla stan, Norrmalm, Djurgården, Strandvägen where many boat trips start). The appartment is tidy and you find there everything you need. It is perfect for a couple, a couple with kids or for 2-3 friends. Communication with Mathias was great. I highly recommend the spot!"
242188,413250633,2019-02-17T00:00:00.000Z,"Amazing place! Staying with Li was like staying with family. She is very kind, welcoming and friendly- with lots of local tips and info on what to see and how to get there. Li has a gorgeous and spacious home, close to transport, or walking distance to the food and music district and old town if you prefer to explore on foot. 

I had a great stay, would definitely recommend. I was the only guest when I stayed and had the top floor of the apartment to myself, with a bathroom, kettle and fridge and comfy sitting area full of light and plants and a big bathroom."
1271843,48752427,2015-09-28T00:00:00.000Z,"André and Johanna were perfect hosts. They're house was clean, beautiful and located in a very nice part of Stockholm. We recommend staying with them to anyone."
299154,51809071,2015-10-24T00:00:00.000Z,"We had a great time staying in Daniel's home - it was clean, comfortable, and in a great location. The apartment had everything we needed, and Daniel was flexible with our check in times, and was very friendly. I would definitely recommend this location for anyone looking to stay in Stockholm!"
700113,478555106,2019-06-30T00:00:00.000Z,"Super clean place with a beautiful view from the balcony! Everything you need is really near this place like cafes, restaurants, supermarket and public transport! Had an amazing stay!"
581243,47422767,2015-09-18T00:00:00.000Z,"Edwin & Ladiya were very kind and gracious hosts. The room and apartment were exactly as photographed and described and the location is perfect! Edwin offered some great suggestions and went above and beyond when I had questions or needed some help. This apartment is in the lovely Ostermalm neighborhood, which is a really beautiful place where a lot of locals live. Plenty of shopping, grocery, and some great restaurants nearby, not to mention that central Stockholm and all of the tourist sites are an easy 15 minute walk away. The Karlaplan metro stop is literally just downstairs as well, which made getting to/from the central station a simple 5 minute train ride.  If you stay here, I'd also recommend checking out the local cafe/restaurant called Broms, which is just around the corner. Excellent food and drinks!

I had a wonderful time exploring Stockholm and Edwin's place was the perfect place to start and end my day. I would highly recommend staying here if you have the opportunity!"
1048668,70611383,2016-04-19T00:00:00.000Z,The host canceled this reservation 75 days before arrival. This is an automated posting.
608672,113593160,2016-11-13T00:00:00.000Z,Karl était très disponible avant l'arrivée et nous a bien aidé pour préparer notre venue
259025,15351158,2014-07-07T00:00:00.000Z,"La maison d'Ali est très jolie et très bien entretenue. Ali est un hôte discret et prévenant. Une chambre douillette. Métro  à qq mn à pied pour arriver à Stockholm plein centre en 20 mn. Nous avons passé des nuits tranquilles , nos journées étant totalement consacrées à la balade. Mercis à Ali pou nous avoir accueilli très tard, low- cost plane....arrivée un peu decalee..."
368952,14546257,2014-06-22T00:00:00.000Z,"Madeleine has been a wonderful host, always nice, open-minded and talkactive. you shouldn't miss her awesome insider tips for your stay in Stockholm! Getting to the city is quite easy as well, as the bus goes quite frequently directly to Slussen. I really enjoyed my stay at Madeleine's and I would definitely recommend her! Thank you so much, madeleine :)"
533880,12295810,2014-04-28T00:00:00.000Z,"Jarl was a really nice host, and everything worked good, especially the communication. It was my first airbnb stay, and I can really recommend visiting him. Also the bed was really comfortable :)"
757320,72820720,2016-05-04T00:00:00.000Z,"Barb is a very nice, welcoming and caring host. We had nice talks.
In nice area Sodermalmand close to Gamla Stan.
Large room and large bathroom.
Can be recommended!!"
628555,5209981,2013-06-18T00:00:00.000Z,"We had a lovely time in Anna's appartment. The appartment is beautiful and there is all you need. 
We did not meet Anna but she sent us in advance all the info about the appartment.
It is very easy to go to the center of Stockholm from the flat (subway)."
700113,16713173,2014-08-01T00:00:00.000Z,"I can highly recommend Ilonas appartement! 
It was cozy, clean and really close to the city center.
Ilona was a very nice host – you live pretty close to her but still have your own privacy.
The bed is a little small for two persons – so only sleep there together if you have a close relationship ;-)

Thanks a lot for your hospitality, Ilona!"
1048260,41836528,2015-08-09T00:00:00.000Z,Annika was extremely helpful and went the extra mile to make us feel welcome and comfortable with the area. She provided us with detailed instructions and tips so that we never felt lost when exploring the neighborhood. Her place is also lovely as pictured and conveniently located. I would definitely stay at her house again.
1144069,39278172,2015-07-22T00:00:00.000Z,"Jon was a great host.  He gave unusually good directions on how to find the apartment, then spent the time to show us everything we needed to know.  His sheet of recommended restaurants, grocery stores, etc. in the neighborhood was appreciated.  The apartment was very comfortable and well-equipped and the neighborhood appealing and very close to two subway stops."
1182616,512437478,2019-08-18T00:00:00.000Z,"Appartement pratique et bien équipé. 
Très bien placé dans Stockholm, on a beaucoup aimé. En plus on avait un petit balcon privatif où on prenait notre petit déjeuner, très agreable !
L'appartement a 3 chambres et les 3 étaient louées pendant notre sejour. Nous n'avons pas croisé Peter mais il nous avait mis les clefs à dispo. Très pratique."
1234960,67559819,2016-03-30T00:00:00.000Z,"Vi hadde en kjempefin påske i Stockholm og er veldig fornøyd med oppholdet hos Jacob. Super beliggenhet, koselig hjem, barnevennlig, rent og pent. Vi hilste på Jacob da vi kom. Han møtte oss ved t-banen og fulgte oss hjem. Vi kan absolutt anbefale et opphold hos han."
