listing_id,review_id,date,comments
748847,27199464,2015-02-28T00:00:00.000Z,"Lägenheten var jättefin och hade allt man kan önska sig. Fullt utrustat kök, supers snabbt  Wifi samt en stor tv. Lägenheten ligger i ett lugnt område, men ändå centralt och nära till allt.
Vi bodde där i två och en halv månad, två vuxna och två barn (6 och 8 år) och det fungerade alldeles utmärkt. 
Heath är en perfekt värd, trevlig och hjälpsam. Även om vi aldrig träffade honom, hade vi väldigt smidig kommunikation. Han svarade alltid snabbt på alla våra frågor.
Jag kan verkligen rekommendera Heaths boende till alla som vill besöka Stockholm.
Annika Johansson"
302496,22504636,2014-11-08T00:00:00.000Z,"Good location if you want to avoid public transport while visiting the city centre, museums, restaurants and do shopping. The apartment was more than photos can ever display ;) it was spacious, had The ambience! The whole place is fully equipped, from the kids department till kitchen. Seta as host was very helpful and her warm welcome gave a good start to our stay. We were three adults and two kids (10m/5y) and all that comes along."
1304431,11860423,2014-04-17T00:00:00.000Z,We had a wonderful time in Madeleine's cozy apartment in Södermalm. The flat is situated in a calm area and equipped with everything you'll need. Madeleine was an excellent host and we immediately felt at home. We'd be happy to return. Don't miss the Indian restaurant and the organic shop next door ;)
1248490,45943991,2015-09-07T00:00:00.000Z,"Apartment was as described. Anna met us on schedule and was very nice and accommodating, taking time to talk to us about Stockholm and provide advice. Apartment is in cool neighborhood with lots of cool non-touristy shops and restaurants. Metro is near by and provides convenient access to downtown. Very quiet area - easy to sleep! Overall good experience, would recommend."
1182616,303381080,2018-08-07T00:00:00.000Z,"Peter is a very kind person who is  ready to help you. And give you what you needed help.  He gave me flexible check in and check out . The house is in good place, walking distance to underground station and department store / supermarket. Strongly recommend to you."
608672,106240151,2016-10-05T00:00:00.000Z,The bed was comfortable a d the building was very cool and in a great part of town.
581243,17667639,2014-08-16T00:00:00.000Z,"Ganz tolles, sauberes Apartment in ruhiger, zentraler Lage. 10 Minuten zum Vasa-Museum, ca. 20 Fußminuten zum Central. Einkaufmöglichkeit direkt im Haus -> im Erdgeschoss befindet sich eine rießige Mall, mit allem was das Herz begehrt...Lebensmittel Markt, Drogerien, etc. etc.
Freundlicher Gastgeber - danke Gabriel (Sohn von Edwin), für Deine Hilfe. Sehr gute Weg-Beschreibung  vorab per Email von Edwin bekommen. Wir empfehlen Edwin hiermit uneingeschränkt weiter. TOP, 1 A
Wir hatten einen Traumurlaub in Stockholm"
1255668,145645278,2017-04-19T00:00:00.000Z,"The apartment is light, sunny, and comfortable. The sunsets and views of the water are very pretty. It's very pleasant to walk around the quiet neighborhood. Perfect for a family traveling with small children as the apartment has a very accommodating set-up for the little ones. The grocery is nearby and very convenient. It's just a short walk to the bus which took us to the center of the city within 15 minutes. Sandra was helpful and responded to communication quickly."
302496,250443247,2018-04-05T00:00:00.000Z,Fantastically beautiful apartment in a an amazing location.
299154,73643229,2016-05-09T00:00:00.000Z,En väldigt praktisk enkel liten lägenhet med ett riktigt bra centralt läge. Världen Daniel skötte sig utmärkt!
164448,33994596,2015-06-03T00:00:00.000Z,"Our experience in lidia's place was great! Very clean and she always is looking for make your stay perfect she is very helpful.
I recommend her place for sure!"
1205051,188147348,2017-08-28T00:00:00.000Z,"I was happy to deal with Viktor : he's quick, very effective and very kind.
The apartment is like the description : no surprise !
The place is very well located and quiet."
581243,298325686,2018-07-29T00:00:00.000Z,"Great, central location! Very clean. Excellent host"
755843,156342848,2017-05-30T00:00:00.000Z,Very good location and quiet zone. About 10mins walk to supermarket and other stores.
1234960,367259120,2019-01-04T00:00:00.000Z,Che casa fantastica..abbiamo trascorso con amici il periodo di (Website hidden by Airbnb) casa è molto calda e accogliente..finemente arredata e la sauna è davvero il top..grazie di tutto
1054406,98656649,2016-09-01T00:00:00.000Z,"Lieber Thomas, liebe Madeleine, herzlichen Dank für alles!! Wir hatten einen wunderschönen Urlaub bei Euch! Wir waren sehr beeindruckt von Eurer Persönlichkeit und Gastfreundschaft, dem geräumigen Appartement und der traumhaften Lage am See... So ruhig und idyllisch und trotzdem braucht man mit öffentlichen Verkehrsmitteln nicht lange bis in die City. Für unsere Tochter Ida war es der Himmel auf Erden, im Garten zu spielen, Trampolin zu springen und sich mit den Hasen zu beschäftigen!! Es hätte in jeder Hinsicht nicht besser sein können! Alles Liebe! Mark und Tanja"
1124388,52231178,2015-10-27T00:00:00.000Z,"We had a great time in Stockholm. The apartment was cosy and comfortable - exactly as per description. 
Carl was very friendly, flexible, helpful, and easy in communication. He gave us some information and tips for our stay in Stockholm. The bus stop and a small supermarket are just round the corner. It was just perfect - We can recommend this small apartment!
Doris"
1255668,266582011,2018-05-20T00:00:00.000Z,Great location and super clean and fresh apartment. Lovely almost rural area yet within easy distance to downtown Stockholm.
700113,61371427,2016-02-03T00:00:00.000Z,"This is a very pleasant place for a base for exploring Stockholm.  It's quiet with a view to a park, but it's central and close to the center and shops, the university, and public transportation.  Ilona is a very nice host.  I always try to stay here when I go to Stockholm!"
242188,86149260,2016-07-15T00:00:00.000Z,"Lidia is a wonderful host! Her apartment is very centrally located, clean, and just beautiful. She helped me plan my trip, gave me maps and information, and was always available if I had questions. I couldn't recommend staying here more!

The apartment itself is in the cool/trendy Sodermalm neighborhood, but in a very quiet residential area. It's only a 5 minute walk to a main train station, and a 5-10 minute walk to the subways and lots of restaurants. It is really the absolute best location to stay to see Stockholm, from what I could tell from my short stay there.

Thanks, Lidia, for making my short trip to Stockholm so great!"
164448,39412022,2015-07-23T00:00:00.000Z,"Lidia was a wonderful and accommodating host who made us feel at home, and the room is very comfortable and located in an excellent area of Stockholm. Highly recommend to anyone!"
1048260,6785754,2013-08-25T00:00:00.000Z,"Excellent, Annika has a beautiful flat in a great location. She is very friendly and accommodating. I'd recommend anyone to stay here!"
1262520,7287067,2013-09-14T00:00:00.000Z,The reservation was canceled 4 days before arrival. This is an automated posting.
1124388,30305375,2015-04-20T00:00:00.000Z,"It was great to be in the apartment of Carl. Nice place, good bed behind the white wall and even an extra bed for our son. Carl was in the house to welcome us and we had a great time. The house is on a small island quite close to the centre. On the first evening we rounded the island on a nice walk."
628555,209850378,2017-11-06T00:00:00.000Z,"Short stroll to public transport which is a must for exploring Stockholm. 
Breakfast, coffee and fikka are a must at AB Cafe! 
Property is perfect for a couple wanting to base themselves in a leafy suburb!"
1048260,123900875,2016-12-31T00:00:00.000Z,"I defiantly recommend staying at Annika's flat.

Annika's flat is a wonderful space with fantastic decoration. It was also perfectly clean and it was a pleasure to cook in the kitchen which has everything you need. 

The flat is very near an underground station which is two stops from city centre and so we found it very convenient for exploring Stockholm from.

The best thing about staying at Annika's was the tips she's gave us about what to do in Stockholm - we would never have known about Hellasgarden without her advice!

Annika's flat is excellent value for money, she replies to all messages very fast and is very friendly and her flat feels like a home away from home!

Thank you Annika!"
819676,271348171,2018-06-01T00:00:00.000Z,"This is an ideal place to stay. The bedroom I stayed in was small but comfortable with access to a private bath with a shower across the hall. Andy made me feel comfortable to use the living room and kitchen which allowed for lots of space.  The check in was well arranged. The place has an elevator and it’s a secure building. The neighbourhood is lively with restaurants and shopping as well as nightlife. It’s close to a metro and only 2 stops from Central Station. Andy gave good recommendations on things to do for a short stay in Stockholm. In spite of its central location, it was quiet in his place. A perfect place to stay."
581243,5466084,2013-07-01T00:00:00.000Z,Great host. He helped me with transportation going to my ship and provided all info i needed. Ed's apartment was also convenient and centrally located.
1128990,40374641,2015-07-30T00:00:00.000Z,"Bon accueil avec des explications claires sur les choses pratiques. Par contre, un peu trop peu d'informations sur la façon d'arriver à l'appart  ( transports publics )"
514210,107995373,2016-10-13T00:00:00.000Z,"We have felt very welcomed during our stay of almost seven weeks at Margareta's place. She had made sure we found our way to the flat and even asked someone to welcome us and show us around, as she couldn't be there. Margareta and her two children have been very kind and helpful. The room and the bathroom look like they do in the pictures. Everything has been very clean. 
It takes about 20 minutes to go to Stockholm central station. Therefore you have to take a bus for 10 minutes and the metro for another 10 minutes. It was very easy to find everything, as the bus station is also only 3 minutes away by walking from the flat.  
The flat is located in a family friendly neighbourhood. There is a supermarket very close, as well. 

We would definitely recommend staying at Margareta's place!"
900043,149106454,2017-05-02T00:00:00.000Z,Flat ideally located to discover the city!
628555,2092450,2012-08-25T00:00:00.000Z,Anna's place was so great. Very clean and nice. The king sized bed could be a separate vacation on its own. She went out of the way to show me the way around her home which was very nice. The neighbourhood is nice and quiet. Go right for it!
608672,16675740,2014-07-31T00:00:00.000Z,"The room is comparable to the whole of Stockholm: neat, convenient and lovely. Mr Büsselmann gave me a warm welcome and provided some helpful tourist information. 
Very trustworthy."
904739,14368776,2014-06-17T00:00:00.000Z,"Menaf is the nicest host ever. He welcomed us in a cool apartment designed in fancy 1970's style with everything a traveler needs: food in the fridge, romantic bed, nice window-view and large TV-room full with gadgets (if you need some). We found ourselves in the hip part of hip Sodermalm with an island-park, riverside bars and a beach five minutes' walk from the door. Highly recommended!"
536283,450701124,2019-05-10T00:00:00.000Z,"It's very very nice to stay in Paolo's apartment. Well located in Södermalm area (near medborgplatsen station), very clean, calm and bright, design and cosy... We had a great week ;))"
974175,81047594,2016-06-20T00:00:00.000Z,"The appartment of Jesper & Sofie is really beautifull, everything looks lovely and very stylish. There appliances are almost too good to be true (they have a golden Quooker and a dishwasher that opens when you knock friendly on its door) We felt at home right away and had a great time with our two young sons. The neighborhood is nice and calm with many cafes and small shops, the park nearby was perfect with a good playground. Communications were easy and there were lots of travel tips to help us out. We had a wonderfull time!"
453692,2054624,2012-08-21T00:00:00.000Z,"A lovely, homely apartment in the most perfect location for a long weekend in Stockholm. And Lovisa is a very helpful and thoughtful host."
819676,121982052,2016-12-20T00:00:00.000Z,"Great location, and lovely apartment! Very easy to walk into the centre, and right by a metro stop. Would definitely recommend!"
1271843,268938590,2018-05-26T00:00:00.000Z,"We had an excellent stay at André's place.
It's really well located and a very comfortable space.
We found it great for exploring the cool neighbourhoods of Södermalm, with heaps of great bars, restaurants and shopping within easy walking distance. The Mariatorget Metro station is also super close, for getting to anywhere else in Stockholm.
André was also a great host. We didn't get to see a lot of him because there is so much do in Stockholm and we spent every hour possible getting to know the city, but we did have a couple of great chats and he checked in a few times with us via email, to make sure everything was going well and with some really helpful tips. He's a genuinely lovely guy and we highly recommend staying here.
Our only regret is that we couldn't stay longer!"
819676,450687570,2019-05-10T00:00:00.000Z,You can feel ease at home! Really chill place to stay. The host are so friendly : )
974175,47456729,2015-09-19T00:00:00.000Z,"Lägenheten var fräsch med en mysig interiör och hade ett fantastiskt bra läge, centralt och nära till tunnelbana och affärer. 
Återkommer gärna till denna lägenhet även nästa gång jag kommer till Stockholm."
1234109,283366115,2018-06-29T00:00:00.000Z,The host canceled this reservation 44 days before arrival. This is an automated posting.
1234109,6135254,2013-07-31T00:00:00.000Z,"Nathalie's home is a bright, cosy and convenient apartment matching exactly the description and photos of the website. 
It was a pleasant place to stay, sleep and relax. 
Located just around the corner of a wonderful green park, the neighborhood is very quiet and safe, 3 minutes walking from metro lines, different buses and shops too; very easy to reach quickly Central station, Nybroplan, Södermalm or other main spots, day and night.  
Five minutes walking from Nörr Mälarstrand, a beautiful walk by the sea with few pretty summer restaurants all along the way, spotting lovely views on the city. We did not meet Nathalie but she left us helpful suggestions to see and do in Stockholm.  
We just enjoyed our sunny swedish holidays.
Great end of summer for you Nathalie !"
1205051,25544735,2015-01-19T00:00:00.000Z,"Viktor was very welcoming and his flat was lovely and comfortable.  The location is excellent, easy walking to Gamla Stan, lots of neat shops and restaraunts, and some quiet residential areas too.  Though Viktor was traveling when we arrived, he was available by email and his family welcomed us to the place and helped us get settled. Great experience.  Thanks, Viktor!"
688947,81152554,2016-06-21T00:00:00.000Z,"We stayed 8 nights and we had the whole flat. The place was very nice, quiet, clean and close to the metro. However there was no wifi but Alex gave us some way to have it.
We were very well welcomed, Alexandre is very nice.
Totally recommended!"
164448,54770143,2015-11-23T00:00:00.000Z,"Staying with Lidia was a perfect base for us on our long weekend in Stockholm. The bed was so comfortable, and the bathroom was very good. There was a shared living space upstairs right outside our room where Lidia left tea making facilities etc. Location wide this is fantastic. Loads of public transport options extremely close by. Lots of places to eat, drink or look at some shops. And it was a very simple and short walk to the old town (about 20min I think) and then into the downtown area. Lidia was so helpful! When we arrived VERY late from the airport she stayed up to meet us and took the time to sit down with us, make a pot of tea, and discuss all the things we wanted to do while visiting. She gave us a map and helped us to know where everything was. Throughout our stay she was always helpful with ideas and even researched a lovely restaurant for us for brunch on Sunday!
It is worth noting that Lidia has two rooms that she rents out and these rooms share the one bathroom and the living space. Lidia bases herself downstairs. This wasn't an issue for us at all."
164448,109581900,2016-10-22T00:00:00.000Z,"Lidia was wonderful host. She made us feel like at home. Welcomed us warmy and gave us good advices about interesting touristic attraction and Nice shopping places. She was very disponible for us.
The apartment is good located next to subway station. We were in city center very quickly."
313763,70706487,2016-04-19T00:00:00.000Z,It was a pleasure staying at Martins Appartment in Stockholm. He made it easy from the start! We had everything we needed and were situated in the middle of a beautiful part of town with everything on our doorstep. Wonderful!
220851,24958587,2015-01-04T00:00:00.000Z,"The apartment is beautiful, the location is great, and most importantly - Fredric was a great host, from the first moment he welcomed me to his apartment, throughout all my stay. Hope I'll get to chance to see him again soon!"
1182616,210212415,2017-11-08T00:00:00.000Z,Peter's apartment is very well located. There are 3 airbnb rooms but we were alone the whole time. It's easy to communicate with Peter. I agree with the comment that it's a bit like a youth hostel which was perfect for us.
916806,33441250,2015-05-28T00:00:00.000Z,We had a wonderful time in Stockholm and we liked very much the appartment of Mansour. It is beatifully located at the edge of Skarholmen so very close to nature. Mansour was helpful and there was a nice information packet in the appartment which was veryuseful.
299154,115942950,2016-11-27T00:00:00.000Z,"Great place to stay in the heart of Stockholm, easy to get around and close to lots of pubs and bars! 
Had everything we needed for a pleasant stay, highly recommend if you're looking to stay in Stockholm city!"
1124388,9024992,2013-12-02T00:00:00.000Z,"Carl was very nice and helpful. He is a very generous host since he was ready to make available coffee and everthing we needed for breakfast, and even more. 

We were three and the extra bed was ok. We had a really nice stay at his place, which was very clean and convenient. We took the bus to go to town but we also walked (around 45min) and the path is really nice for those who don't mind."
1124388,12820356,2014-05-12T00:00:00.000Z,"Carl provided us with a lot of tips for our stay in STHLM, nice guy, totally recommend this place if u want to stay close by the city center."
1035775,54278139,2015-11-17T00:00:00.000Z,"Ho scelto questo appartamento per mio fratello, dato che non mi era possibile ospitarlo a casa mia, vivo infatti a Stoccolma, a pochi passi dall'appartamento di Magnus. La zona e' molto bella e tranquilla a pochi passi c'e' la stazione della metro e una fermata con due linee di bus. Raggiungere il centro storico di Stoccolma risulta molto facile e rapido. L'appartamento e' molto accogliente e pulito con un bel terrazzino. In cucina c'e' tutto il necessario per prepararsi da mangiare. Consigliato e sicuramente lo terro' in considerazione quando amici/parenti verranno a trovarmi a Stoccolma!"
873383,158127174,2017-06-05T00:00:00.000Z,"Her room is very lovely. It makes me comfortable like my home. It is calm and peaceful. Living room(apple tv 4 generation) and kitchen are spacious and available. Your room is also spacious and have lots of storage space. There is multi tab. Her house is full of beautiful plants and pictures. When you wake up or come to home, cute cat will say hello to you. She helped me out quickly when I have questions.
Tip 1. Go to Sigtuna if you are interested in history and runic stones.
Tip 2. When I stayed, there was food festival on garden of king. If you join local festival, it will make your trip more wonderful."
164448,207087091,2017-10-28T00:00:00.000Z,"Li was a really nice host. The accommodation was exactly as explained, very neat & tidy, and really close to the train station & market. I will definitely recommend this place to anyone looking for a short-term accommodation in Stockholm."
299154,15399375,2014-07-08T00:00:00.000Z,"The apartment was as expected, cosy small and furnished in a good practical way. Very nice and personally. We met Daniel twice, when we arrived and later on when he very quickly came with a new coffemashine. Good machine and good coffee too. We appriciated the little balcony and the uppermadras for the sofabed. The road was more quiet than expected, only a few cars are passing. If it hasn't been for the good weather and the balcony the appartment is a little to small for 3 grown ups. Our grown up son (20) was very fond of the decor. Every thing works in the appartment. Daniel is a very reliable and pleasant host."
748847,14362980,2014-06-17T00:00:00.000Z,"I communicated with Heath over email with great ease - he left clear instructions fir all the basics and in fact we never met him face-to-face. His place was spacious and perfect for 3 friends traveling. The apartment was well appointed and quiet. It is very near all the hot-spots in Sodermalm and we just strolled a few meters to whatever we needed or desired.

This apartment represents extremely good value for money with no hassle whatsoever.

I can highly recommend this listing!"
1132208,168757745,2017-07-10T00:00:00.000Z,"Everything perfect. Every time again.
Nice communication, cozy flat!"
916806,208778273,2017-11-03T00:00:00.000Z,"Très beau, grand et tout équipé
Proche du centre ville"
1212891,33611099,2015-05-30T00:00:00.000Z,"Maud is a warm, kind and considerate lady and made me feel right at home :). The room was cosy and spotless. The apartment is located in a very calm neighborhood, near a large park, and within a short walk from the metro and shops. Great location. Extremely easy to find. Highly recommended."
299154,21027956,2014-10-10T00:00:00.000Z,"Отличный вариант, Даниэль встретил, все рассказал, квартира маленькая но очень продуманная! Близкое расположение к центру! Вообщем все круто!"
442837,284904706,2018-07-02T00:00:00.000Z,"Very comfortable apartment. Room was a bit on the smaller side, but it was very quiet and the curtains blocked out a lot of light. Has a desk and closet area and bed was comfortable! The bathroom is very clean and the washer was a necessity that was great and easy to use as well! Jo provided me with a map and some local tips on where to see the sunset over Stockholm and other things to do. The apartment is 1 minute away from the closest metro and a 3 min walk to the airport bus station. She was also generous enough to wait up for me after a flight delay and was a very courteous and pleasant host."
954832,406832509,2019-01-31T00:00:00.000Z,"Un petit cocon au coeur de Stockholm ! 
Nous avons passé 5 jours dans l'appartement de Mikael et nous serions bien restés plus longtemps ! L'appartement était parfaitement équipé et décoré et très confortable. Nous avons eu l'impression d'être chez nous. Mikael était au petit soin pour nous : toujours disponible si nous avions besoin de quelque chose et plein de bons conseils. 
L'appartement est un peu excentré (20-30 minutes à pied du centre-ville) mais il est proche de toutes commodités (commerces tout autour, métro à deux pas, bus pour l'aéroport à 10 min à pied) et cela vaut le coup de prendre le métro pour découvrir les stations toutes décorées ! De plus, si nous n'avions pas logé sur l'île de Kungsholmen, nous n'y serions surement pas allé. Il y a de jolies promenades à faire le long du lac Mälaren (tout gelé lorsque nous y étions : magnifique ! ) 
Bref, n'hésitez pas ! c'est une bonne adresse !"
164448,38105980,2015-07-13T00:00:00.000Z,Lidia was a perfect host - we really enjoyed our stay! Many thanks for everything ;)
608672,192205114,2017-09-10T00:00:00.000Z,"L'alloggio di Karl si trova in ottimo posizione, a due passi dalla metropolitana e dai negozi! 
Molto pulito e confortevole, offre tutto quello che serve per qualche giorno di relax a Stoccolma! 
Karl parla un italiano perfetto, i suoi consigli sono stati molto preziosi! 
Consigliato!"
1124388,416856517,2019-02-25T00:00:00.000Z,Mysig och ombonad lägenhet med ett centralt läge. Lugnt och tyst fridfullt och naturnära. Helt nära Mälaren med utsikt över sjön där du kan ta ett morgondopp mitt i staden . Det är svårslaget. Carl var vänlig och snabb att återkoppla fanns inget att klaga på. Med vänlig hälsning Annette och Thord
145320,233159940,2018-02-08T00:00:00.000Z,"Kim's place is perfectly located and very comfortable. She was away during my 5-day stay, but was always very responsive in answering questions and providing advice."
904739,25833695,2015-01-26T00:00:00.000Z,"Such an awesome apartment!  Even better than described, very spacious with absolutely everything you need to have a comfortable stay.  Menaf was a pleasure to deal with, easy to contact / stay in touch with, and super friendly.  

The neighborhood is super cool, great bars, cafes, and the subway all within a 10 minute walk.  

I would recommend this apartment to anyone looking for a rad place to stay while in Stockholm and would stay here again in a heart beat!!

Thank you Menaf!"
