listing_id,review_id,date,comments
608672,116142663,2016-11-28T00:00:00.000Z,Appartement idéalement situé à Stockholm cœur de la ville. Quartier et immeuble de standing. Chambre petite mais avec le confort nécessaire pour un séjour de quelques jours. La douche en revanche doit être refaite. Karl est un hôte fort sympatique qui nous a donné des conseils sur les visites et des plans pour manger...
1248490,97721659,2016-08-28T00:00:00.000Z,"Super recommendable. Perfect stay
The appartment is clean and confortable.
Maria is very kind and helpful
The location is ideal. Well communicated by public transportation and very safe."
708979,298327212,2018-07-29T00:00:00.000Z,"Zona tranquila muy cerca de la estación del metro, a pocas paradas del cento, apartamento cómodo y amplio y anfitriones muy amables."
624886,369091053,2019-01-09T00:00:00.000Z,Oskar was an amazing host. We stayed over the new year holiday so we only communicated via text. He responded to our questions very quickly. The flat is beautifully decorated and updated. Our boys were delighted to stay in the children's room. They so graciously left their toys around for our kids to play with all week. This was really the perfect home for our family of four.
536283,6212079,2013-08-04T00:00:00.000Z,We  enjoyed  our stay at Paolo's. His studio is very well located and we managed to find everything we needed in the neighborhood. Thanks Paolo!
301680,41015888,2015-08-03T00:00:00.000Z,"Anitta is a great host, very friendly, polite and intelligent. And definetely, she loves her house!  
The room is very cozy, location is great. Perfect place for those who would like to stay in a quiet peaceful place close to nature, but at the same time be not far from the city center.
There is a nice park and a forest nearby. Lots of birds, rabbits are running all around. Couple of times I even saw little deers! 
Very easy connection to the city center, trains and buses go regularly and accurately. The kitchen is well equipped, even more than I needed. I would strongly recommend this place."
700113,56431974,2015-12-13T00:00:00.000Z,Ilona was a very gracious and accommodating host! She was kind enough to meet me at a late hour and the flat was just as described. Strongly recommend and would stay again!
581243,427957724,2019-03-24T00:00:00.000Z,"Edwin te hace sentir como si estuvieras en tu propia casa, pudiendo hacer uso de las salas comunes con total libertad, y dándote consejos útiles siempre que lo necesites. Cerca del centro, buena conexión con los principales atractivos turísticos de la ciudad. 100% recomendable. Si volvemos a Estocolmo, repetiremos sin ninguna duda."
273906,1745063,2012-07-19T00:00:00.000Z,"Rodrigo et sa femme sont vraiment très sympatiques, chaleureux,disponibles et serviables. Ils nous ont laissés des informations très utiles pour notre séjour à Stockholm. Leur appartement est très confortable, spacieux  et les deux terrasses sont très agréables. Le quartier est calme et il est trés facile de se rendre au centre ville depuis chez eux. L'arrêt du tram ou du bus est à deux minutes de là qui nous amène directement au métro.Tout était parfait pour notre séjour et nous recommendons vivement cette adresse."
220851,100211002,2016-09-08T00:00:00.000Z,"Fredric made me most welcome in his home. Fredric is a tremendous  host! His knowledge of the city is great. He made several suggestions that made my brief visit to Stockholm a pleasure. Should I ever find myself in Stockholm again, I would certainly look to stay at his residence again. Thank you Fredric! Douglas"
1262188,305377221,2018-08-11T00:00:00.000Z,"This is a perfect place to stay in Stockholm, especially for families! Very comfortable, clean, bright, cozy appartment in a car-free area in one of Stockholm's best districts. Playground is just in front of the house, very nice balcony. Great communication with Karin, she had some excellent tips and recommendations for us."
1182616,115018837,2016-11-21T00:00:00.000Z,"Peter was a great host, he was really helpful and flexible. The apartment was clean and cozy, well-equipped and situated really good, the neighborhood is mostly quiet and in few minutes of walk you can find metro station, many shops, many restaurants, and in 15-20 minutes of walk you can already reach the city centre. Sharing only one bathroom with the other occupiers can be a little uncomfortable, the mornings can be little busy but anyway I can recommend this apartment for everyone, I would choose it next time too."
757320,468710872,2019-06-13T00:00:00.000Z,Thank you for the stay x it was lovely
448259,17796336,2014-08-17T00:00:00.000Z,"Nice clean room in a quiet location, conveniently close to the subway"
338470,1233907,2012-05-06T00:00:00.000Z,"Gustaf was a great host. He communicated well with us and provided a clean and spacious apartment.  

We found the bed to be a little tight for two people and the comforter was a little too small, but otherwise the apartment was great.  It is very close to a metro station, so it was a good base for exploring Stockholm. 

I would definitely recommend staying with Gustaf!"
206221,205949551,2017-10-23T00:00:00.000Z,We felt like at our home! Amaizing! Elisabeth is a Great Soul!
438129,431515923,2019-04-01T00:00:00.000Z,"The house is in a lovely area, very green, the metro is closeby, very easy to get around. The room is small, which in my opinion makes it cozy. Eva and her family have been very helpful and welcoming, I'm really glad I found this place last minute and thankful to them for making my stay so calm and worry-free."
985944,506954900,2019-08-11T00:00:00.000Z,"Anna’s place is very comfortable for 4 adults or a family and is filled with natural light.  It is very close to the T and there are a number of cafes within 5 minutes from the apartment.  We were very happy to do laundry too.  The washers and dryers were very efficient.  Thanks Anna for being a wonderful host.

Melanie"
568341,455925327,2019-05-20T00:00:00.000Z,It was an interesting tour !  I learnt much on some basic US history !
1124388,246846168,2018-03-26T00:00:00.000Z,We came to Stockholm for 3 days and we had a great time at Carl’s apartment. It is located 20 min far from the city center but easily comunicated.
514133,343573513,2018-11-01T00:00:00.000Z,"I spent more than 2 months in Mira's apart and It definitely was an excellent experience to stay here. It's bright, very well equipped and with good furniture. The area is perfect with many restaurants nearby, subway/train/buses around and 15 mins walking distance to the city center. And of course Mira is an excellent host, she was ready to help with everything I needed."
1124388,5953818,2013-07-23T00:00:00.000Z,"My partner and I spent a really lovely weekend in Stockholm staying at Carl's apartment. The place was very cosy, the building clean and nice, the bus stop right outside the door. Carl made us feel very welcome, helped us with directions and was overall an amazing host!
My personal favourites during the stay were the bird feeder on the window and the prettiest ever shower curtain :)"
646635,186653238,2017-08-25T00:00:00.000Z,"I had a wonderful stay at Kristina place. The apartment is well located and lovely. Kristina is really kind, and even prepare me some coffee during the morning. Really appreciate that. If I have to go back to Stockholm, I'll go to her place for sure!"
739726,15133451,2014-07-03T00:00:00.000Z,"Sanna met us at her beautiful apartment and showed us around, giving advice on places to eat and what to do in the neighborhood. The apartment was great! Lovely decor, cozy bed and living area, and we loved the neighborhood...great shops and restaurants and a short walk to the metro station. We would definitely stay here again, thanks Sanna!"
1212891,131030572,2017-02-10T00:00:00.000Z,"房間很漂亮整潔,比圖片漂亮溫馨,早上就可以看到窗口的霞光,而且就在湖邊,環境非常優美｡出門就有公車站,五分鐘到地鐵站,雖然離市區遠一點,但這個安靜的環境才是可以長居的地方,難得附近還有一個大超市｡

Maud也是超級可愛,非常熱情的主人,她從早期的沙發客開始就願意接待各國的訪客,真是一位很nice的友人｡希望下次來Stockholm還住在這裡!"
739726,5860340,2013-07-20T00:00:00.000Z,"Lovely home, just as pictured with roomy lounge and nice decorations.  Kitchen has table big enough for eating AND map reading/planning.  Closest café (Il Caffé) has good coffee, sticky buns and Wi-Fi - Gilda Café nice but no Wi-Fi.  We found bus no. 76, an easy walk from apt. even with luggage, takes you to Kungstradgarden and on to St. Peters Line ferry terminal. Without luggage, walking to Gamla Stan and beyond very do-able.  Sanna a cheery hostess.  We look forward to having a coffee with you one day in Sydney.  July, 2013"
819676,104734646,2016-09-28T00:00:00.000Z,"location is perfect! 2 min walk to the subway station. cafes and stores are just around the corner. i loved the fact that i had my own bathroom. the room and bathroom were clean. i love the \"ikea-inspired\" design and furniture!"
1212891,168137769,2017-07-09T00:00:00.000Z,Mauds appartement and our room were really lovely! Every in the flat you can find little notes perfectly organizing living together! We really felt welcome :)
700113,206594935,2017-10-26T00:00:00.000Z,It is really nice apartment with everything you need. Host is just near by if you need anything. Flexible check in and out times. Close to metro station. I would recommend this place.
700113,161613084,2017-06-18T00:00:00.000Z,Great place to stay when you are i Stockholm for business or pleasure. Very nice host too.
1251466,77744560,2016-06-03T00:00:00.000Z,"This place is student accommodation and near the metro station. 
The room size is good, but a little dirty. 
Laundry place is a basement and should booking by host before use. 
Dean was nice host. That is reasonable price."
170651,1738691,2012-07-18T00:00:00.000Z,"Marie's flat is lovely. Very chilled and bohemian. The local neighourhood is great - lots of nice coffee bars, cafes and close to the water. It's a bit more alternative than other parts of Stockholm we visited - and all the better for it. Metro is 5 mins walk away, so it's easy to get to the centre. Recommend it & Marie is really nice too."
283446,46332649,2015-09-09T00:00:00.000Z,"Thanks for suggesting Ms. Vidhi's listing AIRBNB. I just felt being at home. Ms. Vidhi and her husband were extremely sweet in receiving as I landed in the late hours. Yet they were patient and assisted me with the route from the airport. Definitely, will recommend this listing.

Thank you for your kindness Ms. Vidhi!"
536283,9686630,2014-01-05T00:00:00.000Z,Excellent host. Great apartment and great location !
700113,112476488,2016-11-06T00:00:00.000Z,"This was my first solo airbnb and trip in general. I couldn't have chosen a better place. Ilona is an amazing host. She was very helpful and welcoming.  The studio itself is spacious and has cooking utensils, pots, and pans now! The place is also located within an 8 minute walk from a subway station. The neighborhood has quite a few restaurants and bars which is a plus. The grocery store is 5 minutes away. The day before my departure my luggage zipper gave out on me and the luggage store was closed due to the holiday. Thankfully Ilona had a spare. She's so kind! Also on the day of my departure it snowed and she offered to take me to the central train station. If and when I return I will definitely stay here again!"
608672,424853988,2019-03-17T00:00:00.000Z,A lovely little space in an ideal location. Couldn’t be better!
1153177,8131467,2013-10-17T00:00:00.000Z,"The flat is great and so is Terry. If you look for a nice place –  with nice landlord – in Stockholm to stay, you have found it here!"
302496,521860698,2019-09-01T00:00:00.000Z,"Seta's place worked extremely well for us. The location can't be beat. Very close to the subway, grocery stores, restaurants, and anything else a person might need. The apartment is enormous and is decorated in a stylish, artistic manner. The kitchen is very well equipped and my son made great use of the laundry room!  Seta and Goran are a pleasure in person and I hope to stay at their place again in the future!"
608672,198719886,2017-09-30T00:00:00.000Z,"The flat was cozy and central to major neighborhoods, which made getting around very easy! Karl was a great host and very communicative."
763407,5177936,2013-06-17T00:00:00.000Z,The apartment is very beautiful and Gabriella is a great host- her flat is a perfect choice for a Stockholm trip!
723539,149618795,2017-05-05T00:00:00.000Z,"Conocimos a Mathias quien muy gentilmente nos permitió hacer el check in antes del horario establecido, nos dio instrucciones muy estrictas respecto del apartamento y del funcionamiento (lo cual es entendible dado que es su vivienda propia).
En lineas generales el apartamento esta bien, es amplio, muy ordenado, y sobre todo muy bien situado en una zona céntrica lo que permite recorrer los puntos mas importantes de la ciudad a pie, rodeada de bares, restaurantes y comercios. 
Como punto negativo encontramos que la cama es pequeña y las almohadas un tanto incomodas y por otro lado las cortinas dejan pasar la luz de la mañana!"
242188,423132146,2019-03-13T00:00:00.000Z,Allt är guld. Li tar mycket väl hand om sina gäster och det märks att hon har stor vana av att ta hand om folk.
1182616,116620050,2016-12-02T00:00:00.000Z,"Me and my friend really enjoyed staying at peter's place. The room itself is clean and spacious, and the neighborhood is very convenient. We were provided with everything stated in the ad, and although Peter wasn't there at the time of our arrival, our 'check-in' and 'check-out' went very smoothly."
1170766,16742248,2014-08-01T00:00:00.000Z,"We enjoyed very much our week-long stay in Annika's flat. It's a large loft-like room with all facilities and a terrace. The flat is located  in an spacious attic which has been recently modernized and equipped. It's very bright with windows in two directions (east and west). 
The building is a 3 storey building without elevator but the staircase is comfortable and we didn't find it difficult to climb the steps to the flat.
Location couldn't have been better: in the trendy part of Stockholm, Södermalm, close to shops, restaurants, and transport (buses and underground) but still quiet and near to parks and lake Mälaren. The neighbourhood has plenty of beautiful classified buildings.
Communication with Annika works very well and she is very helpful. We would definitely like to come back to her flat."
575371,191948294,2017-09-09T00:00:00.000Z,Appartamento a 20 minuti a piedi dal centro di Stoccolma ma comunque comodo per visitare la città. É andato tutto benissimo.. peccato per i vicini di casa che facevano rumore ma senza nessuna colpa dell'host.
368952,2133434,2012-08-29T00:00:00.000Z,"Super voyage! Très bon acceuil, hôte tres agréble. 
Aucun regret! A refaire"
1212891,12071510,2014-04-22T00:00:00.000Z,Maud was a great host. the flat was very nice and has a good location to discover the city. We would definitely recommend to contact maud if somebody  look for an opportunity to stay in stockholm!
242188,508652007,2019-08-13T00:00:00.000Z,Excelente opción si vas de visita a Estocolmo. Está a 2 minutos caminado la estación del metro y desde allí puedes moverte a cualquier parte de la ciudad. La limpieza y atención del anfitrión en los consumibles es muy buena. Y tal cual se muestra en las fotografías será lo que estará esperándote.
1212891,502889373,2019-08-05T00:00:00.000Z,La camera in cui abbiamo soggiornato si trova in una zona molto tranquilla e soprattutto dovesi respira aria molto (Website hidden by Airbnb) siamo trovati benissimo e soprattutto la metro è a breve distanza rispetto alla posizione della casa.Maud è stata molto gentile e soprattutto molto disponibile per le nostre richieste.
647314,9641843,2014-01-04T00:00:00.000Z,We had a very nice time in Stockholm. Mallika is real nice host and sharing the flat with her was very easy. We even had celebrated new years eve with Mallika and her friends. The flat is beautiful and clean and located in a nice neighborhood near the Subway! We definitively recommend this flat. Thank you Mallika!
608672,107370142,2016-10-10T00:00:00.000Z,Karl was a very gracious host and everything was exactly as advertised.  The location is perfect for exploring Stockholm.
1182616,12765874,2014-05-10T00:00:00.000Z,"The set up and logistics getting keys and checking out was great and the apartment/room is in a great location in Stockholm, close to all public transport and the airport bus. It is a 3 bedroom apartment but note the doors to individual rooms do not have locks on them so you would not have a separate key to the room. Never met Peter but he responds to emails very quickly so there were no problems at all."
442837,7660905,2013-09-28T00:00:00.000Z,"Jo was a great host, and her place was super convenient to all points in Stockholm. I would def highly recommend staying here!"
533880,7221418,2013-09-11T00:00:00.000Z,"WOW!  If you're looking for a place to stay in Stockholm's most prestigious area, look no further.  Jarl's place is a 5-8 minute walk to the Stadion T (subway) stop.  Then it's one stop to Ostermalm, the \"Rodeo Drive\" area of Stockholm, and one more stop to Central Station, in the heart of Stockholm and easy transfers to any other subway line.  

The room is peaceful and functional.  I found the bed very comfortable.  It's basic and clean.  It's at ground level, but extremely quiet at night on his street.  For the price Jarl is charging, it's a steal.   I still can't believe the incredible value for money and feel so lucky I stumbled upon it on AirBnB.  

Jarl's place is very close to Djurgarden, the gorgeous, fairy-tale-like island in Stockholm Harbor, where the main tourist attractions are located, like the Vasa Museum and Skansen.  Do venture there and do not miss Rosendal's Tragard, a lovely organic farm and cafe, with pastoral outdoor seating areas and great food.  

Jarl is a very kind and wonderful host.   He totally respects your privacy yet is available whenever you need his assistance.  I needed to get up for an early-ish flight home and he gave me a second alarm clock so I could make sure to be up in time.  He also printed out an email I needed to show the airline on check-in.

I highly recommend Jarl's place.  Enjoy your time in magical Stockholm!"
299154,134452680,2017-02-27T00:00:00.000Z,Perfect !
1124388,53964554,2015-11-15T00:00:00.000Z,"Carl's place was located on quiet island in Stockholm, very close to the bus stop and a supermarket and to the city center too. Carl himself was very attentive and did his best to make us feel comfortable. The apartment was just as described, very cozy and comfortable and my friend says that he wants an apartment like that when he purchases one :) In short, we are very pleased and grateful. Tack!"
299154,46555616,2015-09-11T00:00:00.000Z,"The apartment was as described. Clean, well equipped and in a good location - perfect for a tourist visiting Stockholm. You'll love the balcony for a breakfast if it's a warm morning :) Daniel was very friendly and accommodating to our check-out time. Thank you!"
533880,2920474,2012-11-19T00:00:00.000Z,Jarl was a perfect host during my stay in Stockholm. The flat is near the center and metro and the room is very comfortable.
757320,85478750,2016-07-11T00:00:00.000Z,"The room is cosy and you will easily find the flat 5min away from the metro. Barb is very nice, she gave us precious advices for our stay at Stockholm. We had access to shared bathroom and kitchen any time we needed. I totally recommend this place."
1158893,523305221,2019-09-03T00:00:00.000Z,Mucho mejor de lo esperado. Dany es un gran anfitrión.
1048668,5171731,2013-06-16T00:00:00.000Z,"Very nice apartment and great price for the room. Everything was very nice and smooth. Fast response and good eye for the details.

No complains!"
514210,80783905,2016-06-19T00:00:00.000Z,"We stayed with Margareta for 5 nights while we were visiting Stockholm. She came to pick us up from the central train station when we arrived to show us the way to her house with public transportation - very nice of her and super handy! Her house is easy to find and is 30 mins from Stockholm with a bus and a metro. Our room in Margareta's place was like in the pictures: big, nice space, with a door to her balcony. We also had a private bathroom and could use the kitchen for breakfast and dinner as we liked.

It was a very nice stay and we would definitely recommend!"
1263558,94620343,2016-08-16T00:00:00.000Z,"Great apartment and location!

We stayed in Carla apartment for + 1w and really enjoyed it. The place has all facilities you need, very child friendly and great location. 

Carl is a very good and communicative host. Made sure all was set upon our arrival."
242188,60452718,2016-01-24T00:00:00.000Z,"I had a wonderful experience at Lydia's place. She is so kind, friendly and willing to help at all time. It's in a very convenient location and nice view from the street. Highly recommended to others. Thank you Lydia."
357012,58366378,2016-01-02T00:00:00.000Z,"The apartment is fantastic, and in a great location. We had no problems getting there and no problems with the apartment. Calle is a good host and responded to our questions promptly. He even left us some Swedish Christmas drinks when we arrived on Christmas. I definitely recommend this place to any one who wants to visit Stockholm."
1262188,93707175,2016-08-13T00:00:00.000Z,"Die kleine Wohnung ist super eingerichtet für einen angenehmen Stadturlaub mit der Familie (2 Kinder). Wir wurden sehr nett von einer Freundin von Karin empfangen. Hinweise auf Läden, Cafes, öffentlichen Nahverkehr etc. lagen bereit. 
Die Wohnung ist ein guter Ausgangspunkt für alle möglichen Stadterkundungen in Stockholm. Die schönsten Plätze in Södermalm, Gamla Stand und in der City sind zu Fuß zu erreichen. 
Bei kleinen Fragen zwischendurch war Karin immer zu erreichen."
1262188,5814567,2013-07-17T00:00:00.000Z,"We were two couples and spent a really nice time in Karin's apartment and Stockholm. The apartment was cosy and well located. We discovered everything walking. The center of Södermalm is quite close and even to the old town the distance is fine. 
The contact with Karin was really friendly and easy. 
Thanks again for the wonderfull stay and the hospitality. We really enjoyed our stay."
1182616,270397785,2018-05-29T00:00:00.000Z,"Pros:
-Close to Fridehelmsplan metro station, some lovely restaurants and a picturesque park.
- Close to the city centre...About 5 mins from Stockholm central and 10 mins from Gamla Stan.
Cons:
-The room was dirty...Almost every area slightly inaccessible to a broom had dust gathered (below the bed, the corners, furniture, etc)
-The host doesn't live here...I was under the impression that he does through our communication but didn't meet him even once for the 3 days I was there.
-Had reached after a 15 hr flight at around 4pm to find the room wasn't ready...Had to wait until 7 pm until it was habitable. So much for a 3pm check in.
- Bathroom is shared by three (Website hidden by Airbnb) you can imagine the inaccessibility. We were lucky that the other guests didn't wake up too early but I would imagine it would get difficult at most times.
- Bathroom sink kept on clogging up...Which was pretty nauseating. The shower cabinet is pretty (Website hidden by Airbnb) only 5'11 but still found it difficult navigating the place. 
-The balcony is not really a private (Website hidden by Airbnb) divided by a curtain between your room and the next. There isn't a door for the next room but a window into the balcony which meant a person could get access to your room through this area. For this reason, we had to lock the doors at night which made it pretty claustrophobic."
608672,141188107,2017-04-02T00:00:00.000Z,"• Ideal location in the centre, close to everything. 
• Beautiful building. 
• Small but practical room - tiny drawback regarding the shower being not very practical but still alright. 
• Karl's absolutely lovely and super flexible. 
• Highly recommend."
1124388,12539362,2014-05-05T00:00:00.000Z,Very clean and nice apartment. Very quite and beautiful location. Not far from the center. Carl is also very nice and pleasant guy!
628555,6444073,2013-08-12T00:00:00.000Z,"If you are looking for a place to stay in Stockholm, look no further! Anna's home really was a wonderful retreat for us. It is really well located, being just outside the hustle and bustle of the city... it's a relaxing place to come home to after touring islands or shopping. It's on a great Metro line which links to Central Station plus the other major stops and so it's super easy to get to and back. Anna's home is a 10 minute walk (or 3 min bus ride) from the Metro and the metro itself takes 10/15 mins to central stockholm. Perfect! Anna's home is really spacious too and has a wonderful Swedish designer feel to it - like staying in a boutique hotel. Anna herself was a wonderful host. She answered everything within minutes of us texting and gave us some great tips for restaurants, islands etc. We were staying a week in Sweden - Stockholm for 2 days, then canoeing in the country and then Stockholm again. After staying 1 night in Anna's place, we decided we wanted to stay there again when we got back to Stockholm. Anna was great! She approved the stay straight away, and also let us leave our bags etc in her flat whilst we went canoeing. This saved us so much hassle on our trip! Go for it - you wont be disappointed. We want to come back!!!"
