listing_id,review_id,date,comments
1096827,30447062,2015-04-22T00:00:00.000Z,"Wir hatten einen sehr schönen Aufenthalt in Stockholm. Die Wohnung ist gut zu erreichen und bietet alles was man benötigt. Die Einrichtung ist in skandinavischem Design und sehr hell. Obwohl Anita während unseres Aufenthalts nicht in Stockholm war, hat alles super geklappt und wir können sie als Gastgeber nur weiterempfehlen."
1124388,26560085,2015-02-15T00:00:00.000Z,"I had a very nice stay at Carl's apartment. Good value for money, I can only recommend it."
700113,14677196,2014-06-24T00:00:00.000Z,"Ilona was a great and very kind host. The apartment is situated near the centre of Stockholm, which was great. Supermarket is just around the corner, metro station about 5-10 min walk. 
The apartment is very cozy and clean, and has everything you need for a short stay. 
I would totally recommend it."
858902,97526343,2016-08-27T00:00:00.000Z,"I stayed for almost a week in Stockholm in Lottas apartment. Prior to my arrival the communication with Lotta was very easy and helpful. She provided me with every information to get easy to her apartment. When I arrived, Lotta welcomed me very warm and had a lot of advices for sightseeings, do's and don't do's (how to avoid all the big tourist groups :-)) and restaurants for me. So that I didn't feel like a tourist. The room is very cosy, clean and after a day full of sightseeing you can feel very comfortable. 
If you have any questions while you stay there, you can contact Lotta by a text and she answers immediately.

To conclude, I can highly recommend to stay in Lotta's apartment."
1035775,177254325,2017-08-02T00:00:00.000Z,"Magnus' space is the perfect size for a single or couple travelers. The patio is gorgeous for morning coffee, it's in a nice area close to the metro as well! Magnus was very helpful and always available for us if needed. He greeted us upon arrival and showed us around, which was very nice. Definitely recommended for anyone staying in Stockholm!"
1124388,69852984,2016-04-14T00:00:00.000Z,"I stayed at the flat already the second time and still everything was fine. Communication, arrival and departure are uncomplicated. The neighbourhood is just great and super close to Västerbron and Kungsholmen. I'm still fascinated by the broad collection of books he has ;-)"
581243,52440441,2015-10-29T00:00:00.000Z,"Excellent stay at Edwin's place, close to KTH university, walking distance to many museums, comfortable and handy. 100% recommended."
1244357,97217008,2016-08-26T00:00:00.000Z,"I only have good things to say about Elliott and Rebecca's apartment and the services they provide.
The property is exactly as it looked in the listing. It is not a lrage apartment but we knew that coming in. Elliott provided us with 2 comfortable floor mattresses for our children and they were quite happy with them.
They gave us a very detailed instruction booklet with everything we needed to know about the apartment itself, plus a comprehensive guide about the area and accessibility to the city. The location is great. Just outside the city centre with trains and busses making it easy to get to.
We had a car for part of the time and parking wasn't the easiest experience. I noticed before our arrival that there is a Avis/Budget office in the building next door so i booked our rental car from them which made it easy to pick up and return.
All in all we had a great trip!"
1212891,274012860,2018-06-08T00:00:00.000Z,"The host is very hospitality and cleanliness. She tries to satisfy you from the smallness. The kitchen is perfect with many spice such as oil, rice, sauce... The apartment is 450m from the metro and near the supermarket."
145320,267677547,2018-05-22T00:00:00.000Z,"A great host! The place is close to the city centre with easy access and a safe area. Kim is organised and quick at responding, also gave great tips about local places."
916806,14218007,2014-06-15T00:00:00.000Z,Mit meinem Vermieter habe ich einen guten Kontakt gehabt.Sie waren beide sehr zuvorkommend.Die Umgebung entsprach meinen Erwartungen.Von seiner Wohnung hat man einen wundervollen Blick auf die Schären.
819676,92106671,2016-08-07T00:00:00.000Z,Centralt läge. Trevliga och hjälpsamma värdar. Väldigt fint rum och toalett med allt som kan behövas!
1271843,35240315,2015-06-16T00:00:00.000Z,"Andre and Johanna were the perfect hosts! Despite us arriving past 1.00am, it was arranged that Johanna would be waiting for us at the apartment. :) 

Andre had prepared a document that provided ample information about getting around, and to the apartment. It also has many recommendations of things to do/eat as well! That was really helpful! :)

The apartment is clean and very spacious. Its location is quiet and not too densely populated - which makes it nice and relaxing. :) It was easy to get around too with the metro station just a 2 minute walk away from the apartment. 

I would recommend this listing, as well as Andre and Johanna as hosts. It was lovely having stayed and met with them! Thank you!"
514210,18771697,2014-08-31T00:00:00.000Z,"I had a great stay at Margareta's lovely house: the room was super cosy, impeccably clean, the house is next to a supermarket and a bus stop going to the city center, and, most important of all, Margareta was the prefect host, welcoming, helpful and friendly. Fully recommended."
1170766,186572072,2017-08-25T00:00:00.000Z,"Très agréable séjour dans le studio d'Annika, très spacieux et bien placé! 
Annika s'attache à accorder le meilleur accueil à ses hôtes, informations précises pour trouver le logement' et petite attention dans les placards (boisson fraîche, gâteaux). 
Vraiment une bonne adresse à deux pas de l'hyper'centre!"
1212891,32450836,2015-05-18T00:00:00.000Z,"Hi all, my wife and i spent a fantastic 4 nights at Mauds in Stockholm. 
The site really says it all : it's a very nice place and Maud is a very nice lady !
We had the best of times, we felt really welcome, and felt very much at home from the first minute.
We're cat people, that helps of course, and i must say the cats are two real beauties, very sociable, and wander around freely, but are never a nuisance and are strictly kept out of the bedroom.
Maud is a a great source of information about the city and the 'Swedish way of life', very easygoing, and a lovely lady and i'm sure we'll meet again!
The place is cosy, very clean and well-organised, you can tell Maud is not new at the travellers scene !
I especially want to mention the well-equipped kitchen ( we cooked dinner every night - there's a small 'Coop'- and a big 'Maxi'-supermarket within walking distance ).
The apartment is 7 stops ( 15 min ) from the 'T-Central'-Subway/Train/Bus-stations and a five-minute walk from the Tunnelbana-Metro-Stop. 
The only reason not to book at Mauds would be a cat allergy. Greetings from Bruges Belgium !
Heidi & Lode"
155685,1881335,2012-08-04T00:00:00.000Z,"We spent a week at Robert's apartment in Hornstull and absolutely loved it! Robert is a formidable host and was extremely attentive to details, from the first communication to his friendly greeting upon our arrival.  The apartment was spotless, tastefully decorated and comfortable, exactly as per the listing, and Robert had provided us with everything we could possibly require.  The neighbourhood is vibrant and full of life (especially on the weekends), and a great location from which to explore Stockholm (either on foot or by subway, with a station within 2 minutes).  Highly recommended!"
688947,67910654,2016-04-01T00:00:00.000Z,"Alexandre's place was very cozy. It has all you may need for your stay. There is a park, a shop and metro stop nearby. Would surely recommend to anyone."
1212891,51125457,2015-10-18T00:00:00.000Z,Had a nice stay at Maud's place. Room & bathroom are clean. Close to City Centre. Nice view of the garden from the window. The best part was that Maud went above and beyond to help me to send my money that I accidentally left in behind in the room. Thanks for your kindness and honesty. Much appreciated Maud!
900043,99446997,2016-09-04T00:00:00.000Z,"Great location, superb little flat if you are on a budget! Really enjoyed our stay, the host was very kind and responsive and collecting the key was very easy."
1271843,453586380,2019-05-16T00:00:00.000Z,Great location! The house was super spacious and sunny with a fully equipped kitchen. We were easily able to spring in and out of the apartment with ease. We only met André at the end of our stay as he was travelling and he proved to be a gracious and most welcoming host.
581243,50592001,2015-10-12T00:00:00.000Z,Had a great stay with Edwin! Very welcoming and comfortable room. Perfect location. Thank you!
785218,5782025,2013-07-16T00:00:00.000Z,"We spent a week in Fredrik's apartment in Stockholm. The apartment was everything we could hope for: spacious, clean and nicely furnished. The area in Stora Essingen was fairly quiet and it seemed like a nice neighbourhood. There is a play ground and a little wading pool for the kids nearby and crocery store not too far away. Even a beach is within a walking distance. You can reach the city easily by a bus or by a tram/subway."
155685,1675629,2012-07-10T00:00:00.000Z,We had the best stay at Roberts the flat was super nice and cosy and the childs room was highly appreciated!Thank you Robert for a super nice stay!
543045,30954991,2015-04-29T00:00:00.000Z,"Anton's hospitality and welcome were amazing: he gave us great directions from the airport, met us at his building and gave us great tips about the city.  Totally lovely.  

His apartment was beautiful! Exactly like in the photos, decorated with excellent taste and super amazing clean.  This was a great vacation in Stockholm, and a lot of that is down to the experience at Anton's apartment."
1234960,82645129,2016-06-28T00:00:00.000Z,"Jacob is a fantastic host. Offered recommendations, provided food in the fridge, great with communication prior and throughout our stay. His house is charming. We usually love to be on the go but his place was so inviting we stayed at the house a bit more than usual. It was easy to save $ on breakfast by cooking at home. For location- I liked not staying in the main area of Stockholm. His house is a five minute walk to the metro and @ a 10 minute ride into the city. His house is a five minute walk to a grocery and a few resturants. It is residential. We have 7 year old kids who loved having their own spaces and a trampoline."
700113,3134777,2012-12-22T00:00:00.000Z,"This is a lovely part of Stockholm, ideal for any holiday or business destination. Ilona is kind and pleasant to deal with. I can highly recommend this quiet city dwelling."
739726,3514092,2013-02-11T00:00:00.000Z,"We had perfect 3 days in this beautiful appartment from Sanna! The location is amazing. We would always recommend to stay in this appartment/ district in Stockholm...great cafes, resturants and shops just around the corner...and a good connection to the metro station. Sanna is a very kind, flexible and helpful host! Thank you Sanna!"
608672,79904764,2016-06-14T00:00:00.000Z,"L'appartamento si trova in una zona centrale e ben servita. Karl, il proprietario, parla un ottimo italiano ed è stato molto gentile e disponibile, fornendoci anche informazioni su come muoverci e cosa fare  in città. L'appartamento è costituito da una stanza con letto matrimoniale, scrivania e poltroncina, un bagnetto e un piccolo locale adibito a cucina. Qui non è possibile cucinare, ma sono presenti un frigo, una caffetteria e un microonde. Unica nota il bagno, la doccia da direttamente sul lavandino ed è praticamente impossibile non allagare tutto. Karl ci ha tuttavia informato che a breve (l'edificio è piuttosto antico e per fare lavoretti di ammodernamento deve aspettare le necessarie autorizzazioni) il bagno sarà rifatto e la doccia sarà spostata dalla posizione attuale."
954832,4593804,2013-05-14T00:00:00.000Z,"The beautiful weather, the lovely city of Stockholm but also our stay at Mikael’s studio made this a spring-trip to remember! The studio was very nice, clean, located in a quiet area with grocery stores around the corner. They really provided everything (towels as much as we wanted, shower gels, tooth-brushes, coffee caps, maps and information about Stockholm,…never seen that before). Mikael was very helpful, easy and fast to communicate with and he respected our privacy. This was our third Airbnb-experience, but the best so far. We really recommend this place, very good value for money! And for the fitness-addicts: there is a free fitness-room + sauna in the basement. Not that we had time for that, to busy having fika! :-)"
1304431,91500047,2016-08-05T00:00:00.000Z,"Das Apartement war super. Sehr geschmackvoll eingerichtet, wir und unsere Kinder (6, 7 und 9) haben uns richtig wohl gefühlt. Ruhige und doch ziemlich zentrale Lage. Madeleine hat uns zahlreiche Tipps für Stockholm gegeben und die Kommunikation mit ihr war perfekt."
1137050,22428796,2014-11-06T00:00:00.000Z,"My wife and I stayed in Gabriel's apartment during our one week stay in STK. Overall perfect! Amazing decoration, lovely details, great shower, fast internet, very cute and functional kitchen, Gabriel is always available to help with anything but above all things an outstanding location. We walked everywhere in the city during our stay and where never bored exploring the neighborhood. If in STK again for sure I'll stay at Gabriel's."
274876,502834432,2019-08-05T00:00:00.000Z,"Great stay in a nice part of town, reasonably close to the old city (half hour walk along beautifull views).
Shop closeby, 3 bedrooms , dishwasher, everything you need for a comfortable stay in stockholm

1 bathroom is perhaps a downside when youre with more people but you can organise around that.

Emma is very accomodating and a fast communicator. 

The outside terrass was a nice bonus that we used quit a lot"
259025,3352594,2013-01-15T00:00:00.000Z,"eine wunderbare möglichkeit gut und günstig in stockholm zu nächtigen. ali ist sehr nett und hilfsbereit. der weg vom haus in die stadt ist im alltag kein problem. die bahnstation ist 3 min entfernt.
es lohnt sich das frühstücksangebot von ali für 4 euro/tag wahrzunehmen, da es sehr teuer ist in stockholm zu essen."
1182616,254574481,2018-04-17T00:00:00.000Z,Meine Schwester und ich hatten eine tolle Zeit und besonders gut hat mir die Lage gefallen. Check in und Kommunikation hat einwandfrei funktioniert! Für einen kurzen städtetrip eignet sich das Zimmer sehr gut.
700113,465166403,2019-06-07T00:00:00.000Z,"Had a wonderful time, Ilona is super friendly and understanding ! Location is close enough where you can easily walk or take public transit to most tourist-y places. Public pool located in the park nearby was a great addition"
1250227,335449345,2018-10-12T00:00:00.000Z,Very fine apartment that aged nicely. Located in one of the finest streets in Stockholm. Enjoyed very much!
974175,105777065,2016-10-02T00:00:00.000Z,"We had a fantastic weekend in Stockholm. Sofie and Jesper are lovely hosts and their home is very clean and well equipped. The beds were very comfortable and we were very impressed with the instant hot water in the kitchen for coffee, tea and cooking! The apartment is close to local amenities and we actually took a nice walk right into the centre of Stockholm. The only thing I think worth mentioning is that there are cameras in the kitchen area and the bedroom with the bunk beds. This was fine with us although my daughters were staying in the bedroom with the bunk beds and felt uneasy when getting undressed so we covered the camera at times but then uncovered when we left. The apartment looks much more fabulous in real life than in the pictures so we were really pleasantly surprised when we arrived. 
Overall we really enjoyed our stay and would love to stay again should we return to Stockholm in the future! Thanks for having us!"
900043,125319529,2017-01-05T00:00:00.000Z,"The apartment is placed near very dynamic streets, close to supermarkets and many means of transportation. Definetly a great place for young couples and friends who want to be in the centre of Stockholm most charming area"
1048260,94309411,2016-08-15T00:00:00.000Z,"Our stay at Annika's flat was really great! Annika is a very nice person and was very available to answer all our questions. The apartment is well located, only a few stops from the city center ! The place was really cosy. The only negative point is the bathroom which is Really humid and which is dark (there is not a lot of light) but for a few days it really is ok! I would totally recommend it !!"
954832,18397577,2014-08-26T00:00:00.000Z,"Mikael was a great host.  He spent time with my daughter and I when we first arrived, going through housekeeping issues, showing us how things worked, taking us through a map of Stockholm and suggesting what we could do. He was very welcoming and gave really clear instructions on how to find the apartment from the airport.  He even met us on the street to guide us in.  He provided my daughter with colouring pens and papers and a soft toy that she could take home, which she has called Princess.  The apartment was really clean and well organised and already had lots of essential things that we were able to use.  Very cosy just for two.  I would highly recommend it to anyone."
1255668,488633264,2019-07-15T00:00:00.000Z,"We are very lucky!  Very quiet place among nature.  By bus 15-20 minutes - and we are in the city center!  The apartment has everything you need.  Very clean.  The hostess answers all questions, is welcoming and hospitable."
581243,402091089,2019-01-17T00:00:00.000Z,"Great host, quick to reply and very informative. The apartment was clean and had everything you need"
533880,13435994,2014-05-27T00:00:00.000Z,"We had a very nice stay at Jarl's. The area is very quiet yet central, ca. 10 mins walking distance from the city centre. The flat was very clean and the room pleasant. Everything was very well organized prior to arrival and Jarl also gave us some recommendations on places to eat, to go and how to best get there. We can only recommend. Thanks again!"
1048260,74569739,2016-05-15T00:00:00.000Z,"Quelle jolie parenthèse que ce séjour à Stockholm, dans l'appartement d'Annika.
Le logement est confortable, douillet et propre. Il est plein d'ondes positives, très zen et avec une belle décoration et des plantes. Il y a un salon avec un matelas confortable au sol, avec un balcon au calme. La cuisine est pratique, avec frigo, gazinière, petite cafetière Bodum et bouilloire. On peut manger dans la cuisine sur la table basse. La petite salle de beau contient une baignoire, un lavabo et un WC. Il y a Internet Wifi et chaine Hifi.
Le logement est au calme, ce qui est très agréable. La ligne de métro est à moins de 10 minutes à pied, les salles de concert Globen et Tele2Arena sont  à 10 minutes à pied. C'est très bien pour visiter Stockholm.
On peut faire ses courses juste en face à l'épicerie Tempo (un peu cher), sinon au ICA du centre commercial Globen (10 min).
Je remercie Annika pour sa confiance, son hospitalité et ses précieux conseils, même si nous n'avons pas eu la chance de nous voir, nous avons communiqué par message."
1119738,300931992,2018-08-03T00:00:00.000Z,"Anna is a really friendly and lovely person. I went to her with a friend of mine and we enjoyed staying there. It is a quiet and lovely place. We even got bicycles to drive to the lake wich is near by. My friend and I went to Stockholm to learn a bit the language and culture and Anna helped us to learn these things. We said that we would try to speak swedish with her and so she spoke swedish with us, even slowly so we could understand better. When we had questions we could just go to her. 
I recommend her cordially."
1304431,86512313,2016-07-16T00:00:00.000Z,"A cozy and most comfortable appartment. Clean, practical and very well situated. Its perfect for families, our kids had fun and almost didn't want to leave their rooms...We appreciated the good information folder, everything worked out well and was good organized."
819676,81765920,2016-06-25T00:00:00.000Z,"Clean, convenient location. Highly recommend!"
164448,5436953,2013-06-30T00:00:00.000Z,"Lydia is very friendly and wonderful person, gives all suggestions to get the best from Stockholm. A very nice and pleasant stayin!! thank you for your help!
Excellent position, nice room and dont forget her delicious breakfast!!"
299154,204039991,2017-10-16T00:00:00.000Z,Daniel was an excellent host. He was very clear and thorough. We arrived much later than our checkout time and he accommodated our schedule with traveling. The place itself is nice and cozy and very convenient as far as location. It's less than a 10 minute walk to old Town and approximately 15 minute walk to the river where a lot of the cruises depart from. Plenty of bars and places to eat around the apartment and close to public transportation. I would definitely stay here again and highly recommend Daniel as a host.
1170766,164981004,2017-06-30T00:00:00.000Z,It was fantastic! The cosy apartment in beautiful Södermalm is quiet and near town at the same time. Annika is a wonderful host - very kind and helpful. Also the communication worked perfectly. I would highly recommend to enjoy this magnificent city staying at Kattgränd!
873383,60065640,2016-01-18T00:00:00.000Z,"Isabelle was a great host!  the pictures definitely don't lie! A very clean, homely and creative apartment :-). Isabelle & Dan were very welcoming, friendly,  kind and AWSOME people! They definitely made me feel like a proper Swede on the first night!  and were full of useful information about Sweden and Stockholm. They definitely has made my visit a memorable one! :-)

Would definitely stay there again for a trip in the summer!  And recommend to anyone who wants to live and see the real Stockholm :-)

Thanks again guys! 

Paresh"
610948,4197873,2013-04-17T00:00:00.000Z,"The best Airbnb experiences match hosts and guests that seem like they already know each other—or should. I felt right at home in Lina and Marcus's wonderful flat. They are very involved in their city, are well traveled and connected. If you get a chance to stay with them, take the chance to appreciate their wonderful aesthetic and fun conversation. Thanks for hosting me, Lina and Marcus!"
1124388,33796696,2015-06-01T00:00:00.000Z,"Well, overall we had a great time at Carl`s place. Although we were three people staying at the slightly smaller apartment, all our needs were met. Carl is a great host, he welcomed us at the apartment had a drink with us and gave a lot of tips with places we might consider visiting both during day and night. Hygiene and cleanness was on a high level. When it comes to its location, the apartment is slightly off the main party/busy area of Stockholm but there is always good public transport connections. Overall, Carl`s apartment is highly recommended."
819676,220641338,2017-12-23T00:00:00.000Z,The place is beautiful and in a really good location. The room and bathroom are spacious and spotless. Andy and Vannie were so helpful in giving me directions on how to get there and suggestions on attractions to see. They were amazing hosts and I had a wonderful stay. You will not regret staying here!!
1182616,80790408,2016-06-19T00:00:00.000Z,"Room was very central walking distance to the city. Lots of Pubs, Restaurants. Supermarkets and shops all around and yet the apartment was quite.
You share with others who were all very nice. Peter responds to all text messages very quickly.  Our room had the balcony which was very nice.
The kitchen to share is very well equipped. 
We met Peter he is very nice. Comes in every day to do clean."
220851,404219448,2019-01-23T00:00:00.000Z,What a gem! Both the place and Fredric are just lovely. Had the best stay and felt like home. The location and value are amazing. Really cool place with an extra arty and soul touch  Will be back soon and defo booking the same place!
873383,215522615,2017-11-30T00:00:00.000Z,"Great host, veré clean, friendly anda yes cosy"
514210,5805252,2013-07-17T00:00:00.000Z,"We really enjoyed our stay at Margareta´s place. The appartment is very clean, has lots of space and a great balcony. We also loved the big kitchen for cooking and storing groceries :) Margareta was very helpful, picked us up from the Central station on our first day and also drove us to the Central station on our last day. She showed us everything about how to use the public transport system, how to find food restaurants and how to enjoy ourselves in Sköndal and Stockholm. She was always concerned to find the right answer to all our questions and to cater for our needs (we could use her bikes, we could wash our clothes, etc.). We recommend her place and her hospitality 100 percent."
1128990,505460214,2019-08-09T00:00:00.000Z,"Anette Yvonne's place in Södermalm is perfectly located and she is a perfect host. We had a nice - for me first - time in Stockholm and enjoyed this diverse neighbourhood. 
Recommended for everyone!"
259722,143982508,2017-04-14T00:00:00.000Z,"I stayed here for 2 months. My stay was better than expected. Communication with Marcelo is easy. Before I came I was worries that room would be cold because it is mostly windows but I was wrong. Room was nicely warm even though there was snow outside. Marcelo kept apartment really clean. Location is superb - only few minutes walk to metro station, buss station and nearest shopping center. I can highly recommend. Compared to other listings in Stockholm this was good quality for the money."
