listing_id,review_id,date,comments
1153177,7461616,2013-09-21T00:00:00.000Z,"We were three on a business trip and stay at Terry's apartment. Terry is very friendly, helpful and welcoming. Terry very surprised us when we arrive,  he prepare dinner four us. The apartment is very nice, bright, clean, spacious and well equipped. It is located in a quiet part of Stockholm. The apartment is near T-Ban station from which you can easily and promptly reach your destination. 
Excellent place to stay in Stockholm, we highly recommend Terry's apartment!"
873383,43489118,2015-08-20T00:00:00.000Z,"Isabelle et Dan ont été des hôtes fantastique, voir l'hôte parfait. Je suis partit seul en vacances à Stockholm pendant 12 jours. Isabelle a toujours été là pour me conseiller:
-quelles activités je pouvais faire 
-quels lieux à visiter. 
Dès que je posait une question elle s'empressait de se renseigner si le lieu était ouvert, si oui combien était l'entrer etc. etc.

De plus, elle m'a proposer de l'accompagner à plusieurs reprise afin de prendre un \"Fika\" (\"apéro\") avec ces amis. 

L'appartement, en plus d'être très propre et bien équipés (TV, wifi, netflix etc..) il est aussi très bien situé, à une centaine de mètre de la station de métro. Il faut compter environ 15-20 min jusqu'au centre de Stockholm. Chaque matin Isabelle proposait un copieux déjeuner, selon les envies que je pouvais avoir. 

Je ne peux que recommander Isabelle si vous souhaitez avoir un séjour à Stockholm. C'est l'hôte idéal qui fait tout pour que l'on se sente à l'aise et chez soit :)"
581243,72990605,2016-05-06T00:00:00.000Z,"Awesome place! Edwin and his wife were so sweet and full of great suggestions on what to see :) The place was clean, quiet, and conveniently located near the metro!"
700113,477452132,2019-06-28T00:00:00.000Z,A spotless accommodation in a quiet neighborhood.  Short walk to bus 57 or easy walk to metro.  Lovely park across the street.  Great hostess.
739726,4244950,2013-04-22T00:00:00.000Z,"It was my 2nd time in Sanna's lovely place. I enjoyed it again, its located in the heard of Södermalm, a nice/creative neighbourhood. Just next to the flat there is a nice Café (Il Cafe) that offers free internet access."
954832,476055543,2019-06-25T00:00:00.000Z,"Die Wohnung ist genau wie beschrieben. Sie ist perfekt für zwei Personen. Sie bietet genug Platz und hat auch eine kleine Kochgelegenheit. Das Bad ist gut und auch nicht zu klein.
Die Lage auf Kungsholmen ist sehr gut und gleich um die Ecke gibt es einen guten Bäcker und ein guten Italiener.
Ich kann die Wohnung von Mikael wärmstens empfehlen!"
916806,253135107,2018-04-13T00:00:00.000Z,"Joli studio au rez-de-chaussée dans un joli quartier de petites maisons colorées. Nous avons particulièrement aimé l’équipement du studio et la réactivité de notre hôte, même si nous ne l’avons pas rencontrée. Ils n’étaient pas là et nous avons fait un self check-out qui s’est très bien déroulé. Petit bémol pour le quartier aux alentours du métro qui n’est pas très accueillant ainsi que pour le bruit à chaque utilisation de l’eau. Si vous êtes sensibles à la lumière le matin prenez des cache-yeux, car le soleil se lève très tôt et il y a beaucoup de lumière le matin."
1182616,107784677,2016-10-12T00:00:00.000Z,Peter went way above and beyond. I left my suit at his apartment and he contacted my friend's uncle as well as delivered the suit to this uncle so he could deliver it to me in Malmö.
533880,3042315,2012-12-08T00:00:00.000Z,"I stayed at Jarl's room for two days during a business visit to Stockholm. The location is very nice, close to public transport and just a couple of minutes away from nice restaurants, bars, shops etc. Even though my flight was delayed Jarl made it possible for me to arrive in the middle of the night. Thanks again for that! The bed was comfortable, clean bathroom and Jarl is a great host and company."
904739,433331106,2019-04-06T00:00:00.000Z,"Absolutely fantastic experience. Everything went smooth. Apartment was amazing. There was even a beer waiting in a fridge for us, wow! 10/10! Best airbnb experience so far :D"
1248490,16823374,2014-08-03T00:00:00.000Z,"We've been delighted by our stay at Maria's home. The place is very well located, 10 mn from the metro, next to nytorget, which is the lovely central place of the famous area of SoFo. There are everything at hand reach: restaurants, shops, supermarket opened 8-22, playgrounds for kids.
The apartment is comfortable and perfect for a family.
Maria was very welcoming and we would definitely come back there if we go to Stockholm again with our two boys."
1234960,15254968,2014-07-06T00:00:00.000Z,"We had a great stay in the house of Jacob for 9 nights,4people,including 5 years old child.
The house is very nice and clean and has a lovely garden.
It is located in a quiet neighborhood with the metro and supermarket within just a few minutes walk.  
The host,Jacob was very kind and friendly.
He prepared a lot of toys for my daughter,and first breakfast,welcome us.
We were able to spend a fun time thanks to his help.
I thought I was good to choose his house.
We want to go Stockholm and his house again soon!"
608672,343384631,2018-10-31T00:00:00.000Z,"I had a nice stay - the studio is comfortable and an easy direct walk into the centre and old town, to everything I wanted to do. There are lots of cafes, shops and a grocery store very nearby."
700113,457938100,2019-05-25T00:00:00.000Z,"Excellent accueil très chaleureux,
la localisation était bonne, très facile d’accès par les transports en commun. Le studio contenait tout ce qu’il faut. Le seul bémol rapporté par mes parents qui ont occupé le logement est que le lit était un peu trop étroit (120cm) ce qui pour 2 est un peu juste."
871262,6697113,2013-08-21T00:00:00.000Z,"Lotta has a wonderful apartment in the heart of Stockholm.  There are plenty of cafes and restaurants in the area, as well as easy access to the public transit network.  Lotta was a very flexible host and was very helpful in offering suggestions on the city.  I would highly recommend this place for a solo traveller."
688947,21303557,2014-10-14T00:00:00.000Z,"I and my dad visited Stockholm for a few days and had the chance to stay at Alex's place. His apartment is definitely as pictured in the description, peaceful, clean and very well-located since there's only about 20 minutes to get to the centre town ! Alex is a friendly guy, he gave us some tips and as I told him, he's a great promoter of Sweden ;) Besides, he's a fine music connoisseur, which highlighted for sure his apartment's great vibes. I highly recommend him !"
757320,168334460,2017-07-09T00:00:00.000Z,"Barb was a wonderful host, very helpful and nice. 
The location of the apartment is very close to the central area of the city. It's just a 10mins walk to old town. 
Bed and bathroom were clean and totally suffient. The room was a little bit light and you could hear some noise from the street, but we didn't have a huge problem with that. I guess only people that are sensible might have some issues with that. 
We felt very comfortable all the time and Barb was also providing us some leftovers for breakfast. 
We had a nice time, thanks again Barb!"
259722,322939380,2018-09-14T00:00:00.000Z,"Marcelo is a wonderful host. He is very professional with allocating the space you need for your groceries, laundry, trash, etc. and labeling them. It makes you feel very comfortable. The room isn't big but's it's perfectly reasonable for a single tennant. I's right as pictured, with a wardrobe and studying table. The lighting is very good, many different lamps and the room gets good amount of sunlight. Since it's ground level it's easy to access. It's located very good as well, one bus stop or 6 minutes walk from Kinsta centrum, where there's subway and all the stuff you need; great shopping center. From there you can go to city center or anywhere else you want thrpugh public transport. There's also a park nearby the house. Good location, great host, perfectly clean and tidy house... Definitely recommended."
299154,309595632,2018-08-18T00:00:00.000Z,I can highly recommend Daniel's flat. The location is superb. The flat is very cosy and has a cute balcony. The streets around have lovely cafe and shops and you are in very close to a central underground station. You can walk into old city and are in the middle of trendy area. Daniel is quick in responding and very helpful. We would definately come and stay again. Thanks for everything!
819676,454980965,2019-05-19T00:00:00.000Z,"The location is the best part, as it is very close to Slussen tunnelbana. Also, the room and private bathroom are at the entrance of the apartment so you can come in and go out, without disturbing the hosts. Comfortable little room with a great heated bathroom."
974175,115916376,2016-11-27T00:00:00.000Z,"Sofie was welcoming from the moment we booked this stunning apartment - she helped us with recommendations for places to eat & drink, even shop and she was there to welcome us/show us around her stylish apartment on arrival. Everything we wanted and needed was there, Sofie even left us some milk in the fridge, she was super thoughtful! We loved this apartment, it was even better than the listing had suggested, beds were extremely comfortable and the kitchen gadgets had us gasping in awe - such a great find! 
Highly rated places to visit/eat/drink - The Brunch Club, Phil's Burgers, The illuminated Reindeer at Nybroplan, Vasa Museum, Svenskt Tenn for a pot of tea and a great shopping experience, Lagerhaus for discount homewares and curious gift ideas, Fotografiska in Södermalm at night followed by dinner at Meatballs for The People, Pharmarium for a crazy cocktails in Gamla Stan, Coffee at johan & nyström, Breakfast pastries at Fabrique (many different bakeries around the City to sample their treats!) - it snowed too, so we got to wear our snowboots and enjoy a cram-packed long weekend in Stockholm! 
This apartment has great wifi access, comfy beds, a homely living room of which we enjoyed watching Netflix and curled up under blankets one evening, the bathroom is a joy to shower in (even towels and hairdryer was provided), the kitchen is well stocked and we loved drinking wine from the glasses provided - a well- thought out apartment/home. The artwork is great to look at and the addition of a new fire burner was welcomed - we didn't use it in the end, but Sofie showed us how to use it if we fancied a real fire - a very unexpected & pleasant addition!
Thank you so much to our hosts, we didn't want to leave! If you are looking for somewhere to stay in Stockholm, this couldn't be rated highly enough - it's easy to get to/explore from, a great base to explore a fun City!"
242188,6273050,2013-08-06T00:00:00.000Z,"Lidia is a great host -very sweet and friendly! It was really great to have a separate large bathroom for guests on the 2nd floor where the rooms are located, plus a fridge and area for preparing coffee & tea in a common living room area. Thanks for the additional travel advice and free maps and allowing me to stay longer in the afternoon due to an evening flight!"
897584,7890783,2013-10-07T00:00:00.000Z,"I stayed at Viveka's place with a friend for a couple of days. She has been very helpful, superfriendly and welcoming. Her apartment was very clean and comfortable and she did a lot of effort to arrange everything we needed. The huge patio and the park right in front of it where also a big plus to relax in the sun after a long day of sightseeing and running around the city. All of that combined made our trip just awesome and unforgettable. A big thank you to a perfect host! Till next time."
338470,989514,2012-03-11T00:00:00.000Z,"This place was great! Perfect for anyone who likes art. Very close to metro, 10-minute walk to trendy / hip restaurants and bars area. 

Gustaf is a very nice and charming host. He gave us handpicked guide and made some useful notes. I will definitely recommend this place to my friends!"
283446,342109753,2018-10-28T00:00:00.000Z,very friendly. amazing food.
536691,11751881,2014-04-14T00:00:00.000Z,"Great spacious apartment! Nice and central in Söder (the ~malm is silent as I learned during my stay :D). Stones-throw from the metro that will get you where-ever else you need to be.

Though we did not meet Cecilia was super helpful with good comms throughout my stay and superb directions to get me there in the first place.

Recommend."
368952,1651516,2012-07-07T00:00:00.000Z,"Stockholm is a beautiful city with soooo much to see and do.  Madeleine became family almost instantly.  She is truly an openhearted and loving person, not to mention a fantastic host.
My son and I had a wonderful time at her place and great conversations regarding the world and Sweden.
I can hardly wait to come back and visit my new friend."
533880,5801169,2013-07-16T00:00:00.000Z,"Jarl left me the best bread I ever had in Sweden! Although I didn't meet him, he arranged everything perfectly and answered all my questions about getting around, laundry, etc, promptly. The room was clean and spacious and only a 5 minute Metro ride to the old town. There's a 7-11 at the corner for your late night ice cream craving and a good cheap Thai takeaway 5 minutes walk away. If you know how expensive things are in Sweden, you'll know this is a Godsend. Last but not least, the shower is hot and has strong water pressure. The apartment has a good feel about it. I highly recommend it."
1124388,71027523,2016-04-23T00:00:00.000Z,"This host was very nice, a very good welcome the day of our arrival. A lot of catalogs of what to do in Stockholm and in its nearest areas in different languages. The island were is the accomodation, is a bit far from the center but there is still buses to go, and by walking there is a beautiful point of view (if we follow the mälaren sea) of stockholm and the city hall (very nice with the sunset). There is everything necessary in the appartment, even a vinyl reader to listen ABBA for example"
875505,267895805,2018-05-23T00:00:00.000Z,Very conveniently located Appartment (10 walking min to central station) with laundry machine and dryer inside the apartment.
302496,1504713,2012-06-18T00:00:00.000Z,"We came to Stockholm with four adults and our small son and the accommodation Seta and Göran offered us could not have been better. They gave us a warm welcome in their wonderful spacious and bright apartment and prepared everything so nicely for our one week stay in Stockholm. The two were very helpful and willing to answer all our questions. I especially loved their collections of modern artworks and literature as well as the antiquated elevator of the house, too. 
You can find plenty restaurants, at least three supermarkets, a nice bakery, a kiosk or a bank branch in the closest neighborhood, so that the everyday requirements could easily be satisfied. Several bus lines with stops right in front of the house connect you directly to the city center.
We thank Seta and Göran very much for everything and not least because of them we will keep fond memories of Stockholm."
1212891,80265251,2016-06-17T00:00:00.000Z,"Maud was a very good host. She had maps and books and showed what we wanted to see. The room is cosy and very fresh, like in the picture. She kept the cats out of the room which was good because i was allergic, but didn't feel it. Another plus was that she had towels for free and schampoo etc was also free to use. clear and easy instructions. I do really recommend Maud! Thank you!"
1182616,241465159,2018-03-09T00:00:00.000Z,"We had no trouble finding Peter’s accommodation.  Public transport was easy, 3 blocks from metro and bus top was around the corner.  We reached city hall using bus no 3. Vasa museum and Gamla Stan was easily reached via public transport. Peter was nice enough to buy a weight scale so that we won’t have a problem in the airport with heavy luggage.  I used the kitchen for cooking breakfast eggs.  Grocery and restaurants were all around. All in all a good stay and very responsive host.  I would not hesitate renting this space again."
299154,352348841,2018-11-25T00:00:00.000Z,"Daniel was beyond accommodating and helpful for check in and helping us store bags. His place is in the PERFECT location from the metro station being a block away to old town being within a 10 minute walk! There is a great brewery even a block away. Just loved the location! (Get the 24 or 72 hr transit pass and you can catch a metro or bus from within of a block of his place to anywhere, saves time and money for sure)"
206221,465269378,2019-06-07T00:00:00.000Z,The host canceled this reservation 10 days before arrival. This is an automated posting.
541875,15076863,2014-07-01T00:00:00.000Z,"I booked Martin's apartment with less than a day's notice and he was very accommodating and even provided someone to pick me up at the station and bring me back to the flat; however, a major issue arose and Martin's handling of the situation was at first, understanding, but then quickly turned immature and unreasonable. After the second evening I found BED BUGS. I had a simple itch after my first night, but I attributed it to maybe a food allergy because I ate a lot of fish. After the second evening the bites were all over my arms and body and I stayed at a friend's apartment. I returned to Martin's flat in the morning and found, in the sheets, a dead bed bug. I immediately called and texted Martin and sent him photos of the dead bed bug and the 70+ bites on my body. I left the dead bug in his flat for evidence. He called an apologized and stated this never happened before and I understand that things happen. We discussed potential solutions and he seemed open to talk; however, after I requested a refund he denied it and acted immature and kept saying that I brought the bugs and there are no bugs in his place. He also stated that it was inconvenient for his friend to pick up the keys at my hotel. Really? I'm sure that is WAY more inconvenient than having your body eaten alive by bed bugs. My stay in Stockholm was completely compromised and miserable and I had to spend an extra amount of money to stay in a hotel, cover my medical costs, and do laundry. I was sleeping most of the time due to the antihistamines and when I was awake I was constantly fighting the urge to itch my entire body. I have disputed the charge on my American Express and have asked them to step in. Martin has good reviews and I understand things happen, but I judge a host on how they handle a bad situation and Martin failed miserably with this issue. This should have been a very simple thing to refund my money and call it a day, but he denied by saying it's not his fault and I'm the one who brought the bugs. I would NOT recommend staying in his flat. You can stay at the Elite Hotel Stockholm which is downtown, provides a free breakfast and is only about $30 or so more expensive than Martin's apartment that has paint peeling off the walls and, during my stay, was infested with bed bugs. Rent at your own risk. My stay was June 25th to the 30th for 5 nights, but I left after the second night due to the bugs."
368952,105237548,2016-10-01T00:00:00.000Z,"Ich habe vom 15. August bis zum 30.September bei Madeleine gewohnt. Meine Unterkunft war ein umgebautes Gartenhaus, ca. 20m² groß. Es gab zwei Herdplatten, eine Mikrowelle, Besteck und Geschirr. Allerdings nur eine Art Plumpsklo, keine Dusche und kein fließend Wasser. Für eine Dusche, oder um die Wassergefäße zu füllen, musste ich in das Haupthaus, indem Madeleine mit ihrem Sohn, ihrem Hund und ihrer Katze lebt. Des Weiteren muss man relativ weit zu Fuß zur nächsten Bushaltestelle gehen (10min). Das Gartenhaus ist gemütlich, direkt am Wald und sauber. Da ich auch einen Schlüssel in das Haupthaus hatte, war Duschen, Abspülen etc. kein größeres Problem. Das Internet war sehr schlecht, auch die Ausstattung erschien mir etwas sporadisch. Also insgesamt mehr ein Camping-Erlebnis, aber das ist ja nicht schlecht. Madeleine ist eine sehr nette Person, sie hat mir den Aufenthalt sehr angenehm gestaltet (ich konnte zum Beispiel mein Auto noch zwei Tage länger auf dem Grundstück parken)"
242188,76294867,2016-05-26T00:00:00.000Z,"Lidia is so lovely and kind, a great resource of excellent information about the city and very attentive to your comfort. I'd highly recommend! The location is ideal, with easy access to all the cool spots Sodermalm has to offer, plus proximity to public transport to easily reach city highlights that are further away."
1119738,466547099,2019-06-09T00:00:00.000Z,"The area is really nice & I think, it is a very authentic Swedish home! I would def. recommend it!"
700113,8177025,2013-10-19T00:00:00.000Z,"Great quiet clean space, as advertised! Llona was very friendly as well!"
1251466,50540244,2015-10-12T00:00:00.000Z,"We (3 girls age 20) enjoyed our stay at Dean's place. His wife and him are welcoming people offering a simple but nice room in Bromma, Stockholm. We were picked up from the metro and given hints and tips about Stockholm as well as invited to try some Pakistani breakfast! 
It proboably takes about 20 minutes from the main station by metro. We would recommend the place for 2 people. 
Thanks for these comfortable three nights, 
Klara, Elena & Lisa"
581243,49302246,2015-10-02T00:00:00.000Z,Edwin is a c very good host. And i will definitely book his room if I come to Stockholm again.
581243,3113707,2012-12-18T00:00:00.000Z,"Edwin è stato molto gentile e disponibile! La stanza è abbastanza centrale, silenziosa e pulita così come bagno (in comune) e gli altri spazi! E poi Stoccolma sotto Natale è magica!"
343925,5634970,2013-07-09T00:00:00.000Z,Our stay in Stockholm was amazing and a great share of it was due to Annika's super cozy flat and wonderful hospitality. The apt was clean and equipped with everything one needs to feel at home away from home. We were very suprised that Annika even picked us up from the train station and then took her time to tell us a lot about the city and where to go. Would definitely recommend to stay with her!
1119738,17087242,2014-08-07T00:00:00.000Z,Nice house with free parking 10 minutes from metro. Ideal for families visiting Stockholm with a car. And Anna is a great host. Recommended.
581243,23761911,2014-12-09T00:00:00.000Z,"Great host extremely helpful, super friendly, the apartment was very clean and the neighbourhood was very safe."
1124388,56203837,2015-12-10T00:00:00.000Z,"Nice little place with easy access to the city, Carl was friendly and left some great suggestions of local site seeing ideas. We would definitely stay again!"
819676,315990608,2018-08-30T00:00:00.000Z,"I usually do not write reviews about air bnb I stayed. However, this place was wonderful in many aspects. First of all, it was very easy to communicate with the host and access to his place. Even though I needed to check-in a bit early, he helped me to check in and bring my luggage in. Secondly, it was only 5 min walk away from Slussen stn., so there was no need to spend lot of energy finding the accommodation. The size of the room was little bit smaller than I expected, but enough for single person, and wonderful view from the room and private toilet explained everything. If you are considering to stay at this place, I definitely recommend it so don't miss it!"
536283,5733048,2013-07-14T00:00:00.000Z,"While we never met Paolo in person, he was very friendly and communicative over email and text. His apartment is in a perfect location--right in the middle of all of the action in Sodermalm, but enough off the main drag to be relatively quiet on busy weekend nights when you'll inevitably have the windows open to stay cool. It is a short walk to the subway and main ferry terminals, and a pleasant walk to the Old City (Gamla Stan).

The kitchen is well equipped, and there's a grocery a block away, a movie theater, as well as many trendy, nice restaurants and shops (Sardin, Sneakersnstuff, etc.) nearby. The apartment is simple, but bright and comfortable. Paolo was kind enough to lend us olive oil for cooking and to not blink an eye when a windy evening blew over and broke his plant pot (sorry about that!). We would definitely return to Paolo's!"
1132208,47358443,2015-09-18T00:00:00.000Z,"The communication with Emma was easy and simple. Her flat is really nice and it´s easy to travel with public transport. I went for a jogging trip twice, there is a beautiful small island just close to the flat and it was great. 
There is everything in the kitchen you need. So I can definitely recommend her place!!!"
897584,17595146,2014-08-14T00:00:00.000Z,"We had a lovely 3-days stay at Viveka's very charming flat - a comfortable, quiet, well equipped and well decorated place just a few minutes away from the metro. We hope to be back soon!"
608672,18887225,2014-09-02T00:00:00.000Z,"Wonderful experience!  Karl was a great host, giving us some good 'insider' tips, providing a map for our usage, and letting us arrive early on a Sunday morning.  The apartment has everything you could need - tea and coffee, hair dryer, and even an iron!  The bed was the comfiest I slept in during my 2-week trip.  Spotlessly clean.  Neighborhood was very cozy and just next to the main shopping drag."
581243,65635545,2016-03-16T00:00:00.000Z,"Really great experience in Stockholm. Edwin's instructions were very clear & the place was at a very accessible location in a nice, friendly neighbourhood on top of a shopping mall (with restaurants and grocery retailers inside). Would come back if I were to visit the city again!"
