listing_id,review_id,date,comments
1124388,10922100,2014-03-13T00:00:00.000Z,"Booked Carl's place for a 5 night stay for 3 of us. Carl is an utmost professional to deal with. I got a response to the pre-booking inquiries in a very timely manner. 

Getting to apartment

After the booking Carl sent exact information on how to get to the apartment. He is also reachable on instant messenger ( (Hidden by Airbnb) ) to make the entire check in process smooth as possible. The morning we were to arrive Carl sent an email about the taxis. If you're using one from Arlanda to Carl's place, use the Taxi020 (yellow cabs) and the fixed price is Kr 470 as of the writing of this review. Be weary of cabs in Stockholm as it is a bit of a minefield for tourist really! 

There is also very easy ways to get to the pale via public transport which Carl gives exact information on. BTW entry to the apartment building is via a 4 digit code which Carl will send. Sometimes you need to punch the code over and over for the door to open. It seems pretty normal. We didn't have any issue for the entire duration of the stay.

Apartment and Area

It is just perfect place for a getaway. Located in a small island which is part of Stockholm. There is a grocery store right in front which is well stocked and the folks speak English pretty well. We used the No 1 (night bus 91) bus to get to the Center of City from the apartment. Easiest we found was to that bus to Freidhemsplan T-station and pretty much anywhere from there. 

I would have no hesitation is recommending Carl's place for your stay in Stockholm."
1231897,44446751,2015-08-26T00:00:00.000Z,"Une super expérience !

Le quartier au calme, très typique de la vie suédoise, à seulement 10 min en transports du centre ville de Stockholm. C'est l'endroit idéal pour décompresser dans un cadre agréable après de longues journées dans le cœur de la capitale scandinave. L'appartement est très sympa, rangé et propre. L'ensemble des éléments de l'appartement sont utilisables et mis à disposition.

Alexander est très sympa, un suédois qui aime la vie et la nature. Il est attentionné, toujours disponible sans être envahissant et investi pour que le séjour se passe bien. Alexander a tout fait pour nous donner des conseils pratiques et touristiques, qui ont eu un grand rôle dans la réussite de notre séjour. Les attentions comme le petit déjeuner offert le premier matin ont été très appréciées.

Une super première expérience avec AirBnB. Hôte sérieux et agéable à recommander !
Merci à toi Alexander et à bientôt ! :-)"
755843,330895871,2018-10-01T00:00:00.000Z,"Die Unterkunft von Pär ist ideal für einen Stockholm Stadtbummel gelegen! Das dritte Bett ist ein Ausklappbett im Flur , was etwas umständlich ist und eine extrem weiche Matraze hat ! Unser dritter Mann hat auf der Couch geschlafen - das ging gut und war bequem ! 
Leider haben wir erst am letzten Tag entdeckt , dass direkt neben der Unterkunft ein super gemütlicher Laden existiert , wo man fantastisches Frühstück erhält! Wenn ihr also mal keine Lust auf Frühstück machen habt , ist das eine Superadresse!"
700113,132772761,2017-02-19T00:00:00.000Z,Warm welcome and friendly communication. A nice place to stay.
1212891,10629517,2014-02-28T00:00:00.000Z,"Maud är en rar och gästvänlig värd, och mån om att man ska ha det bra som hyresgäst. De två fina katterna är lugna och sällskapliga. Jag rekommenderar varmt detta boende, och återvänder gärna själv."
944703,19889574,2014-09-20T00:00:00.000Z,"This place is perfect! I didn't want to leave after staying only 6 nights at Christina's. The locations very convenient being around the corner from the train station and grocery store. Christina was very helpful as well, she waited for us to arrive even though we we're running behind. There were four of us and we felt very comfortable in her apartment after traveling 3 other countries. We'll definitely come back in the future."
838442,201811850,2017-10-09T00:00:00.000Z,"Great location.  Five friends on vacation and this place was perfect. Plenty of space, the hostel attached was wonderful and everything was simple. Great for a group!"
368952,7876166,2013-10-07T00:00:00.000Z,"Madeleine has always been a big help when it came to recommendations about places to visit. Not a typical swede in a positive way as she is a very open and talkative person! 
Bus connection to the city is pretty good (24/7) regarding the distance. The villa itself is perfectly modern equipped and the garden house offers the possibility for withdrawal and privacy. Madeleine also has bikes to rent out - a nice bonus considering the nature around!"
858902,98821564,2016-09-02T00:00:00.000Z,"I had a wonderful stay at Lotta's home! The room was very quiet, the location convenient and Lotta is very friendly.  I highly recommend a stay there. Sarah"
259025,5773044,2013-07-15T00:00:00.000Z,"We came to Sweden as a couple for a three-day weekend. We visited Stockholm, it's really pretty. Ali is friendly and welcoming. It really helped us. The accommodation is well located for the metro. Thank you for your hospitality. Goodbye"
299154,493388713,2019-07-22T00:00:00.000Z,God plassering sentralt i Stocholm.
299154,536595297,2019-09-27T00:00:00.000Z,"Great location (if not the best), ideal for 2 people. Walking distance from the centre but also next to metro stations. Daniel knows how to help you enjoy your trip and is always available for any help you might need."
647314,22452479,2014-11-07T00:00:00.000Z,Wir haben uns bei Mallika und Ramses sehr wohl gefüllt. Die Wohnung ist sehr geschmackvoll eingerichtet und liegt sehr zentral und trotzdem ruhig. Wir sind nur zum Flughafen mit der U-Bahn gefahren und sind ansonsten nur zu Fuß unterwegs gewesen. Es ist eine ansprechende Gegend mit vielen Möglichkeiten zu Essen und zum Shoppen. Stockholm ist großartig und wir kommen gern wieder.
1296080,95930815,2016-08-21T00:00:00.000Z,"We really enjoyed our stay here. The place was clean and tidy and it had everything we needed. Its close to the underground and took us around 20 mins to the center. The bed was a bit tight for two but we managed.

Overall it was really good!"
1261445,109780311,2016-10-23T00:00:00.000Z,"Marie-Louise was THE most gracious and thoughtful host I've had so far on air B and B. All communications we're quick and to point. My wife, two year old, and I were welcomed warmly by Marie-Loises daughter, even fresh fruit was provided!!! Truly a generous host!!!
The apartment is close to the subway, situated right across from the most beautiful church, with those same church views. 
Great restaurants and cafes very close. 
We stayed 22 days!
Could not recommend more!!"
954832,43349955,2015-08-19T00:00:00.000Z,"Our host made us feel very welcome, attending even to supplying us with special access to great expresso in the apartment when he discovered that we are coffee lovers. He also provided great local recommendations and spent considerable time explaining the apartment facilities when we arrived. When he was gone overnight once, he sent a message describing where to find an extra blanket in case the weather turned cooler. A top-notch host! Apartment was well located, appointed and supplied. There was a private courtyard where you can read quietly, have a picnic, or just relax. Plenty of room for two and far superior to a hotel stay. Great public transportation to and from apartment."
916806,102410353,2016-09-18T00:00:00.000Z,"The place is great and clean. Especially the view of terrace is awesome. the self-check in instructions are also very clean. 
Mansour is kind and helpful. because the house were ran out of water one day in some reasons, but Mansour just drove us to her apartment to take a shower and prepare lots of drinking water to us for the next day. 
Very appreciate it and definitely recommend this place !"
1263992,6120062,2013-07-30T00:00:00.000Z,"Really nice and helpful guy! The apartment is well located: it's in a calm area, just 15 minutes away from the center of Stockholm by public transportation. It's really nice, well-appointed and modern. There's a balcony with a table where you can have a meal looking at a stretch of water. There's also a barbecue!!
So, this option is really affordable and worthwhile!
Super recommended!!!"
302496,285248665,2018-07-03T00:00:00.000Z,Amazing high ceilings lovely location and very stylish spacious flat.
299154,6461916,2013-08-13T00:00:00.000Z,Daniel gave us a wonderful house in the trendy area of the city! All that had to be close by and we had a wonderful time) You can walk the walk and do not use transport He also has a great balcony which is good to drink coffee in the morning)
299154,10061548,2014-01-28T00:00:00.000Z,"Very good place to stay in stockholm, little, but with a very nice host. thanks  Daniel
Evie and dauhters."
723539,87244900,2016-07-19T00:00:00.000Z,"Great flat in a terrific location. Clean, sunny, well equipped.  Close to all the nice parts of Stockholm, we could walk everywhere."
1304431,89491068,2016-07-28T00:00:00.000Z,We had a great time in Stockholm and in the Apartement from Madeleine
723539,164457644,2017-06-27T00:00:00.000Z,"Spacious, luminous and very well located apartment, near the heart of the city without disturbing noises. Ideal for 2 to 3 people. Well equipped ( although there´s no microwave oven or toaster) Wifi is only for laptops. The host was always available for every need we had. He is very strict with his house rules, so be sure to read them before rent the apartment."
1182616,73596157,2016-05-08T00:00:00.000Z,"Peter communicated fast and had good description of how to get to the place. Its easy accessible with airportbus. The neighborhood was nice, in the center of Fridhemsplan with shops and all necessities close by. Personally I felt a better description of the actual flat could be nice as we where many people there, sharing one bathroom, although it worked out well as we had different routines and rhythms and the guests in the other two rooms where nice and had good sense of order."
299154,469677940,2019-06-15T00:00:00.000Z,"Omtänksam värd, litet, hemtrevligt och bra läge, dock mycket oljud - byggnation rakt över gatan&mycket förbipasserande människor på kvällarna"
259025,6700709,2013-08-21T00:00:00.000Z,"The place was as shown in the pictures and very clean everywhere, which we appreciated. The bathroom is just one flight of stairs down.

Ali was not there during our stay but a friend of him was there to welcome us and check if we needed everything, as well as take back the keys from us on our way out.

The house is part of a set of similar ones down the hill from the station, we found it quite easily. The area was quiet during our stay. We slept with the window open.

It takes around 30 minutes from the door of the house to the central station, and transportation is easy to take and works well in Stockholm, even in the night.
It might not be as convenient as a place in the center of the city, but it was very good for a young couple like us, trying to control our expenses. (Prices in central Stockholm are very high, even in hostels or bnb.)

There is an unlimited transportation pass (3-day or 7-day) you can buy which is very appropriate for the stay. I strongly recommend it, especially if you stay at Ali's. It's paid off in less than 10 trips (the 7-day one).

From the Arlanda airport, you can take an express train to the center if you want to pay for it, otherwise, a bus to Märsta can let you take a commuter train from there, and you only need that transportation pass all the way. (But it takes between 1h30 and 2h depending on how lucky - and efficient - you are with changes.)

Anyway thanks Ali for this place to stay which let us enjoy very well our stay in Stockholm at a reasonable price."
1212891,294415599,2018-07-22T00:00:00.000Z,"Maud’s place is beyond great. Firstly her place is very easy to find and there is a bus station right next to the building. Secondly her place is so clean and well organized. The thoughtful details made it feel like home. Thirdly Maud is extremely nice and helpful. She always makes sure that her guests are having a good time. Last but not least, Maud has a beautiful cat Sammy! He is the cutest and I love spending time petting him. He is soooo fluffy and lovely! If you ever come to Stockholm, make sure to check whether Maud’s place is available."
442837,4934190,2013-06-03T00:00:00.000Z,"Jo's apartment is a perfect place to stay in Stockholm and she was an excellent host.  It is a lovely apartment, clean, comfortable and I was made to feel very welcome by both Jo and her mother, Lidia who gave me the keys and showed me around.

They were both extremely helpful when I had some issues and I could not think of anywhere better to stay.

Great value and just moments from the metro station and shopping mall."
871262,22868953,2014-11-16T00:00:00.000Z,"Très calme, très propre, rapport qualité prix très (Website hidden by Airbnb) Lotta est très serviable et très discrète..."
1153177,188038447,2017-08-28T00:00:00.000Z,"I have travelled to many airbnbs and this one tops it! Terry was the most amazing super host, greeted us at the door, had candles lit, snacks and wine ready on our arrival, and even serenaded us on his guitar!  The home was so amazingly decorated with both Swedish, British, antique, and contemporary pieces! We were a group of 5 women celebrating a reunion of sorts and we appreciated the two toilets, two hair dryers, loads of mirror space, two amazing decks that had both morning and evening light, and of course an immense supply of clean towels and loo roll (so used to being rationed at other airbnbs of these supplies!)!! The location is perfect, we had quiet rests in the evening and early morning, even with the windows open.  We felt safe walking home at night back to the flat as well.  Great walking distance to yummy brunch places, ethnic restaurants, posh marketplace and of course the water.  Terry's hosting and flat is definitely worthy of super host status!"
313195,165499605,2017-07-01T00:00:00.000Z,David's place is a wonderful place for couples to live!
1251466,45225407,2015-08-31T00:00:00.000Z,"Dean is a great host, he basically saved my life. I had no other place to stay at, as the previous host cancelled at the last moment. Dean accepted my stay with barely 10 hours notice, but it was no problem for him! He is a fair, understandable and really good guy, I can recommend him without any doubts!"
647314,145819077,2017-04-20T00:00:00.000Z,"Nous avons été très bien accueillis chez Mallika, qui a été de bon conseil concernant des adresses de lieux où diner/sortir.
Appartement au calme et très bien placé pour découvrir la ville. Ses chats sont très calins!"
536283,286341111,2018-07-06T00:00:00.000Z,"Paolo's apartment is the perfect place for the solo traveler to explore Stockholm from. The apartment's space is used well and the building is safe, clean, and situated in just about the best location possible. 
You are a short walk from the Metro (Medborgarplatsen) allowing you to easily get anywhere in the city. In addition, the Fotografsika, and all of the amazing food, drink, shopping, and general awesomeness of Sodermalm are within a 15-20 minute walk. 
The space itself is quite neat, gets lots of light, and feels very Swedish in the design aesthetic. You can open the windows to hear the bustle of the street below or close them and not hear a peep. The mattress is comfortable, but worth noting that it is a single size for those traveling with a companion. 
Paolo is a great host and was always very quick to respond and worked with me to ensure I had no problems even with a very late arrival in the city. He also provided a number of great recommendations for everything from bakeries to fine dining in the neighborhood. 
Paolo's apartment is a great spot and I recommend it wholeheartedly."
581243,279663329,2018-06-21T00:00:00.000Z,Edwin’s place was fabulous! He was a terrific host and we really enjoyed our stay.
624886,330106906,2018-09-30T00:00:00.000Z,This is a stylish and very family friendly apartment. I visited with my husband and 19month old son and we had a great week exploring Stockholm. Would definitely recommend this to others! Thanks!
164448,191675727,2017-09-08T00:00:00.000Z,It was a great pleasure for us to stay at Li's room. She gave us a very good introduction about Stockholm and made us feel like at home. Thank you very much!
1263558,305952950,2018-08-12T00:00:00.000Z,"Carl's apartment is spacious, comfortable, very nicely designed and well furnished.  The balcony (over an internal courtyard) is lovely and secluded from the street.   We loved our 2 week stay!

The Vasastan location is great.  Downtown is roughly a 15 minute walk.  There is a T-stop just around the corner, along with numerous bus lines.  Likewise, there is a grocery store and a Systembolaget (alcohol store) close by, as well as numerous restaurants.

Carl is a straightforward and very responsive host, answering questions usually within an hour."
608672,16455376,2014-07-28T00:00:00.000Z,"We were in Stockholm for only 3 days. Karl was really helpful, he provided very clear instructions about how to commute from the airport to the apartment.
The flat is really clean, the location is amazing, only 10 minutes walk from the center!
Karl is really friendly, the flat is furnished with a TV, private bathroom and a small kitchen.
We had an amazing time!"
164448,23764770,2014-12-09T00:00:00.000Z,We had a wonderful time at Lidia's appartement. Everything was perfect especially the typical swedish breakfast !
757320,43816572,2015-08-22T00:00:00.000Z,"Quelques jours passés à Stockholm chez Barb. Chambre très agréable et l'accueil aussi. L'appartement est très bien placé (un peu plus de 5 minutes à pieds du métro) et bien équipé.
Seul petit bémol : rue un peu bruyante malgré le 6ème étage mais le double vitrage fait très bien son travail !!
Nous recommandons sans réserve ce logement."
1261445,75978536,2016-05-23T00:00:00.000Z,"We were met by the host's daughter who showed us around the apartment. The apartment is exactly like the pictures, very clean and very charming. The host provided a care package of food and drinks which was much appreciated after a long journey! The area is great, some really lovely little restaurants and bars nearby - and a really good quality supermarket. The apartment has absolutely everything you will need and everything is easy to find. We walked/cycled everywhere and hired bikes at the host's suggestion."
164448,60040419,2016-01-18T00:00:00.000Z,"We had a great stay at Lidia's place. Good location and a very helpful, welcoming host."
1182616,123233781,2016-12-28T00:00:00.000Z,"The place is on the main street,close to subway station and there's many shops on the street. It's a nice place in Stockholm. The room is big enough for three persons. It's close to city center, 15 mins to city hall. I recommend to purchase a 24hours traffic cards. There's a nice Thai food restaurant cross street. Peter is very friendly and helpful. A nice experience!"
647314,202660894,2017-10-12T00:00:00.000Z,"Mallika is very enthusiastic, the house is full of artistic sense, two cats are very cute"
274876,307871696,2018-08-15T00:00:00.000Z,非常棒的房东 房子很干净很温馨
628555,100748064,2016-09-10T00:00:00.000Z,"We had a wonderful stay at Annas place. Beautiful interior, close to the city, calm and sunny flat - highly recommanded!"
1119738,328120588,2018-09-25T00:00:00.000Z,"位置不错,如果开车到市区中心,也就20分钟的时间｡如果选择公共交通,距离地铁站只有800米步行距离,很方便,到市区中心也就是20-30分钟｡

环境很好｡周围都是别墅,花园绿化都很好,我们到了的时候,苹果树硕果累累,地上都是熟透的果子,花园很漂亮｡

房间很干净,床和房间都很舒服,很安静,很舒适｡

房东ANNA很热情,英语很好,很容易沟通｡我们住了3晚,然后飞挪威和冰岛,在斯德哥尔摩买了很多东西,都可以寄存在房东家里,最后一站还是住她家,很方便,很友善｡

强烈推荐,非常喜欢｡"
700113,7528934,2013-09-23T00:00:00.000Z,"I had a fantastic stay at Ilona's studio! I was in Stockholm for a conference and the location was very convenient. I found it to be nice and quiet, but around the corner from a lively street full of restaurants, bars, supermarkets etc. I walked into the city numerous times (it's a fairly long walk, which I like, but there is also public transport nearby). The studio is completely self-contained and Ilona lives next door. The apartment was laid out a bit differently to the pictures but I found it to be very clean, comfortable and spacious, perfect for one but also good for two. I sat on the balcony to eat dinner when the weather allowed and it was lovely. Ilona was very friendly, helpful, quick to respond and easy to communicate with. The Arlanda airport bus stops about a 15 minute walk from the apartment. I wouldn't hesitate to stay again or recommend staying here!"
1265989,523378032,2019-09-03T00:00:00.000Z,The host canceled this reservation 16 days before arrival. This is an automated posting.
1182616,262187189,2018-05-08T00:00:00.000Z,Un lieu pratique et bien situé pour visiter stokholm
916806,516406983,2019-08-24T00:00:00.000Z,A lovely self contained space in a peaceful area.
700113,338394902,2018-10-19T00:00:00.000Z,"Perfekt beläggande, trevlig balkong till morgonkaffet och mycket trevlig värdinna!"
1153177,83904474,2016-07-04T00:00:00.000Z,"Terry greeted us with a warm welcome and a stocked fridge, a hot meal ready and the beer chilled. He was a wonderful host and his apartment was perfect for our family of five, located in a quiet green suburb beside local transport and also walking distance to town. We especially liked the balconies for catching the sun morning and evening. We also enjoyed the local restaurant Kouzina and bakery. Thanks for a great stay In your lovely home."
1124388,329517302,2018-09-29T00:00:00.000Z,"We wish the place had been as welcoming and nice as Carl (who was a great host - he even picked us up from the bus stop). 
But the place was dusty, and generally not clean. We had to ask for toilet paper, and the bed wasn’t made when we checked in (and no towels). Something was quite smelly in the fridge. And the blankets were super tiny and thin for quite a cold weather! A bit disappointed."
1212891,179646052,2017-08-08T00:00:00.000Z,"The appartment is situated in a beautiful area (really close to Hornsberg Strandpark). It is located just 5 min away from public transportation, parks & supermarket.

Maud is a wonderful and helpul host. The cherry on top is her fluffy cat Sammy. :)

Thank you once again Maud for your kindness!"
723539,14388015,2014-06-18T00:00:00.000Z,"We had a very good time in the appartement and everything went very smoothly with Mathias. Mathias was even so kind to organize some extra stuff for our baby. The appartement is well equipped and located very centrally. You can reach many sightseeings by feet and the area around the appartement is vivid and beautiful. There are many stylish shops, bars, restaurants, etc. around. We can recommend to stay in the appartment!"
647314,67531372,2016-03-30T00:00:00.000Z,My friend and I had a great stay at Mallika's. She was welcoming and helpful - kindly suggesting places we could visit and local restaurants. The room was comfortable and beautifully decorated. Her cat would also pop his head around the door in the mornings and was very friendly and cute. I would recommend staying at Mallika's when visiting Stockholm!
1205051,6509393,2013-08-15T00:00:00.000Z,"Viktor's apartment is a perfect location to explore Sodermalm, which is one of the nicer area of the city. Very well located in the center of Stockholm. Very close to the metro station. 
The apartment is nice, clean and cosy. 
We met Viktor who was a great host : very nice and helpful. 
We were in the best conditions to enjoy our short vacations and we had such a good time there. 
It was our first experience with airbnb and we were completly satisfied ! Thank you Viktor."
873383,78491949,2016-06-07T00:00:00.000Z,"Isabelle is a kind and generous host.  She is very communicative and will make you feel very welcome during your stay.   Her apartment was very colorful and well-decorated, and very clean.  It's a quick, quiet walk to the T station, and it takes less than half an hour to central Stockholm.  
And Isabelle has two really amazing cats.
I would highly recommend to anybody visiting Stockholm."
1149820,506192408,2019-08-10T00:00:00.000Z,"Ce petit studio au cœur de Stockholm, à 200m du métro, est parfait pour découvrir la ville. L'endroit est joli, très propre, avec un lit très confortable pour un prix très raisonnable compte tenu du quartier. Et surtout Klara est très gentille et très réactive.  Entree et sortie des lieux très facile.  À recommander sans réserve !"
954832,7709869,2013-09-30T00:00:00.000Z,"We've been is Mikael and Anna apartment for 4 days. We have received a lot of support, and explanations from them, and  we didn't find any point of dissatisfaction. Everything was clean, ordered and nice. The flat is clear, with a big window, and placed in a quiet building, very near of a metro station,  surrounded by cafes, shops and supermarkets. This an apartment very convenient and, for sure is on our agenda for any new staying in Stockholm. Thanks Mikael and Anna."
608672,246813420,2018-03-26T00:00:00.000Z,"It was a very classical and interesting room. The room is in the center of the city and it is convenient to go anywhere. The owner, Mr. Karl is very kind, the previous guests checked out earlier, so he told me that I can go the room earlier than planned."
